"workID","oaiID","doi","title","authors","createdDate"
51446681,"["oai:scholarworks.uark.edu:oepreport-1003","oai:scholarworks.uark.edu:oepreport-1004","oai:scholarworks.uark.edu:oepreport-1002","oai:scholarworks.uark.edu:oepreport-1005","oai:scholarworks.uark.edu:oepreport-1006","oai:scholarworks.uark.edu:oepreport-1010"]",,"Outstanding Educational Performance Awards: Highlighting High Achieving Arkansas Schools, 2016","["Reid, Charlene A.","Ritter, Gary W."]",2018-06-10T09:03:33
64849625,"["oai:pure.mpg.de:item_3121809","oai:arxiv.org:1009.3188"]",10.1215/00127094-1723755,"New outlook on the minimal model program, I","["Cascini, P.","Lazi\u0107, V."]",2012-04-13T14:18:16
41649100,"["oai:pubmedcentral.nih.gov:3972745","info:doi\/10.1152%2fjapplphysiol.01129.2013","oai:epublications.marquette.edu:psych_fac-1104"]",10.1152/japplphysiol.01129.2013,"Stressor-Induced Increase in Muscle Fatigability of Young Men and Women is Predicted by Strength but Not Voluntary Activation","["Hunter, Sandra","Keller-Ross, Manda L.","Nielson, Kristy A.","Pereira, Hugo M.","Pruse, Jaclyn","Schlinder-Delap, Bonnie A.","Yoon, Tejin"]",2019-07-09T11:15:35
686222,"["oai:arxiv.org:1002.2327"]",,"Picard solution of Painlev\'e VI and related tau-functions","["Mangazeev, Vladimir V."]",2012-04-13T14:17:45
588747,"["oai:arxiv.org:0803.3126","oai:citeseerx.psu:10.1.1.313.7939"]",10.1214/009053607000000433,"Discussion: The Dantzig selector: Statistical estimation when $p$ is
  much larger than $n$","["Efron, Bradley","Hastie, Trevor","Tibshirani, Robert"]",2012-04-13T14:16:19
24745093,"["oai:arxiv.org:1511.05187"]",,"A Note on the Proof of Theorem 13 in the Paper "Generalized Gyrovector
  Spaces and a Mazur-Ulam theorem"","["Abe, Toshikazu","Hatori, Osamu"]",2016-08-03T02:30:17
18090467,"["oai:arxiv.org:1509.02988"]",10.1017/jfm.2015.692,"Isotropic polarization of compressible flows","["Zhu, Jian-Zhou"]",2015-09-24T01:59:55
24741884,"["oai:arxiv.org:1511.01414"]",,"Global bifurcation diagram of steady states of systems of PDEs via
  rigorous numerics: a 3-component reaction-diffusion system","["Breden, Maxime","Lessard, Jean-Philippe","Vanicat, Matthieu"]",2016-08-03T02:28:08
1100047,"["oai:arxiv.org:math\/9902058","oai:citeseerx.psu:10.1.1.239.5966"]",,"The limit configuration space integral for tangles and the Kontsevich
  integral","["Poirier, Sylvain"]",2012-04-13T14:24:08
1062532,"["oai:arxiv.org:math\/0011030"]",,"Some characterizations of the automorphisms of $B(H)$ and $C(X)$","["Molnar, Lajos"]",2012-04-13T14:23:35
725298,"["oai:arxiv.org:1010.3684"]",10.4310/mrl.2011.v18.n3.a13,"Uniqueness of gradient Ricci solitons","["Brendle, S."]",2012-04-13T14:18:21
17012869,"["oai:arxiv.org:1209.3732","oai:recercat.cat:2072\/377499"]",10.1112/blms/bdt093,"Algorithmic detectability of iwip automorphisms","["Kapovich, Ilya"]",2014-10-23T17:19:09
669094,"["oai:arxiv.org:0910.4432"]",,"Wiener index of binomial trees and Fibonacci trees","["Iyer, K. Viswanathan","Reddy, K. R. Uday Kumar"]",2012-04-13T14:17:30
683547,"["oai:arxiv.org:1001.1019"]",,"An extension of Mizoguchi-Takahaashi's fixed point theorem","["Baghani, H.","Gordji, M. Eshaghi","Khodaei, H.","Ramezani, M."]",2012-04-13T14:17:40
1068026,"["oai:arxiv.org:math\/0211304","oai:citeseerx.psu:10.1.1.236.6722"]",,"Algebraicity of some Weil Hodge classes","["Koike, Kenji"]",2012-04-13T14:23:40
1069598,"["oai:arxiv.org:math\/0301269"]",,"Minimal vectors in arbitrary Banach spaces","["Troitsky, Vladimir G."]",2012-04-13T14:23:41
4226287,"["oai:arxiv.org:1208.5826"]",,"Rationality of the moduli spaces of Eisenstein K3 surfaces","["Ma, Shouhei","Ohashi, Hisanori","Taki, Shingo"]",2012-08-30T13:52:57
18046098,"["oai:arxiv.org:1502.05527"]",10.1090/proc12763,"Compact embedding derivatives of Hardy spaces into Lebesgue spaces","["Pel\u00e1ez, Jos\u00e9 \u00c1ngel"]",2015-09-24T00:05:08
45955527,"["oai:arxiv.org:1711.10715"]",10.1093/imanum/drz046,"Linear second-order IMEX-type integrator for the (eddy current)
  Landau-Lifshitz-Gilbert equation","["Di Fratta, Giovanni","Pfeiler, Carl-Martin","Praetorius, Dirk","Ruggeri, Michele","Stiftner, Bernhard"]",2017-12-15T09:09:37
17124484,"["oai:arxiv.org:1305.2118"]",,"Complete bounded embedded complex curves in C^2","["Alarcon, Antonio","Lopez, Francisco J."]",2014-10-24T19:18:04
17027844,"["oai:arxiv.org:1212.5286","oai:eprints.gla.ac.uk:129931","info:doi\/10.4310%2fmrl.2015.v22.n4.a12","oai:citeseerx.psu:10.1.1.753.1565"]",10.4310/mrl.2015.v22.n4.a12,"Derived autoequivalences of generalised Kummer varieties","["Meachan, Ciaran"]",2014-10-23T17:21:15
1075388,"["oai:arxiv.org:math\/0404211"]",,"Stability of extremal K\"ahler manifolds","["Mabuchi, Toshiki"]",2012-04-13T14:23:46
962535,"["oai:cds.cern.ch:391121","oai:arxiv.org:gr-qc\/9906080","oai:deepblue.lib.umich.edu:2027.42\/69599"]",10.1063/1.532942,"Scale Symmetries of Spherical String Fluids","["Glass, E. N.","Krisch, J. P."]",2012-04-13T14:22:04
24753727,"["oai:iris.unife.it:11392\/2350636","oai:arxiv.org:1512.06639","oai:sfera.unife.it:11392\/2350636","oai:air.unimi.it:2434\/638206"]",10.1307/mmj/1472066148,"A remark on the Ueno-Campana's threefold","["Bisi, Cinzia","Cascini, Paolo","Tasin, Luca"]",2016-08-03T02:36:28
17207313,"["oai:arxiv.org:1406.5475"]",,"Uniqueness of photon spheres in static vacuum asymptotically flat
  spacetimes","["Cederbaum, Carla"]",2014-10-24T19:27:20
58949037,"["oai:arxiv.org:1902.02241"]",,"A classical functional generalization of the first Barnes lemma","["Marcovecchio, Raffaele"]",2019-06-02T01:56:55
24922906,"["oai:casi.ntrs.nasa.gov:19760008690"]",,"Aircraft cockpit vision:  Math model","["Bashir, J.","Singh, R. P."]",2016-08-03T08:50:09
45954886,"["oai:arxiv.org:1711.10569"]",10.1090/proc/14183,"Non-symmetric Convex Polytope and Gabor Orthonormal Bases","["Chung, Randolf","Lai, Chun-Kit"]",2017-12-15T09:09:36
160708064,"["oai:digitalcommons.imsa.edu:prin_int_cat-1002"]",,"2024 Intersession Catalog","["Illinois Math and Science Academy"]",2024-09-13T10:43:24
69964063,"["oai:digitalcommons.imsa.edu:res_halls_drawings-1004"]",,"IMSA Residence Hall Exterior Manual","["Illinois Math and Science Academy"]",2019-10-29T23:58:49
69964159,"["oai:digitalcommons.imsa.edu:facility_in2_manuals-1016"]",,"IN2 Door Hardware","["Illinois Math and Science Academy"]",2019-10-29T23:58:51
563891,"["oai:arxiv.org:0709.1557"]",,"The Szemeredi property in ergodic W*-dynamical systems","["Beyers, Conrad","Duvenhage, Rocco","Stroh, Anton"]",2012-04-13T14:15:57
54185271,"["oai:arxiv.org:1812.11519"]",,"Two-scale methods for convex envelopes","["Li, Wenbo","Nochetto, Ricardo H."]",2019-02-06T06:51:39
557095,"["oai:arxiv.org:0707.2041"]",,"Localization in a quasiperiodic model on quantum graphs","["Pankrashkin, Konstantin"]",2012-04-13T14:15:51
17137207,"["oai:arxiv.org:1307.4006"]",,"On harmonic functions and the hyperbolic metric","["Markovic, Marijan"]",2014-10-24T19:19:47
58972607,"["oai:alma.01uoml_inst:11406496340002976","oai:arxiv.org:1904.12010"]",10.1007/s00220-019-03623-0,"Mass rigidity for hyperbolic manifolds","["Huang, Lan-Hsuan","Jang, Hyun Chul","Martin, Daniel"]",2019-06-02T02:02:26
625968,"["oai:arxiv.org:0812.3025","oai:hal:hal-00347529v1"]",,"The number of Hecke eigenvalues of same signs","["Lau, Yuk Kam","Wu, Jie"]",2012-04-13T14:16:51
58966853,"["oai:arxiv.org:1904.03994"]",,"Intrinsic nature of the Stein-Weiss $H^1$-inequality","["Liu, Liguang","Xiao, Jie"]",2019-06-02T02:01:07
17227814,"["oai:arxiv.org:1409.7304","oai:eprints.gla.ac.uk:119696","info:doi\/10.1017%2fs0305004116000372"]",10.1017/s0305004116000372,"Decomposable approximations and approximately finite dimensional
  C*-algebras","["Castillejos, Jorge"]",2014-10-24T19:29:43
24785491,"["oai:arxiv.org:1604.02268","oai:journal.fi:article\/135670","info:doi\/10.5186%2faasfm.2017.4225"]",10.5186/aasfm.2017.4225,"Planar mappings of subexponentially integrable distortion --
  integrability of distortion of inverses","["Xu, Haiqing"]",2016-08-03T02:55:00
69964016,"["oai:digitalcommons.imsa.edu:facility_in2_manuals-1020"]",,"IN2 Ceramic Tiling","["Illinois Math and Science Academy"]",2019-10-29T23:58:51
160708141,"["oai:digitalcommons.imsa.edu:prin_int_cat-1000"]",,"2023 Intersession Catalog","["Illinois Math and Science Academy"]",2024-09-13T10:43:24
1055893,"["oai:arxiv.org:math-ph\/0301012"]",,"The $L^{p}-L^{\acute{p}}$ Estimate for the Schr\"{o}dinger Equation on
  the Half-Line","["Weder, Ricardo"]",2012-04-13T14:23:28
560432,"["oai:arxiv.org:0708.1654"]",,"Erratum to: Deformation Quantization in Algebraic Geometry","["Yekutieli, Amnon"]",2012-04-13T14:15:54
1081361,"["oai:oai.dml.cz:10338.dmlcz\/140544","oai:arxiv.org:math\/0504357"]",10.1007/s10587-010-0001-y,"Extension and reconstruction theorems for the Urysohn universal metric
  space","["A. H. Mekler","A. M. Vershik","J. D. Clemens","J. E. Baumgartner","J. E. Baumgartner","M. D\u017eamonja","M. D\u017eamonja","M. Gromov","M. Hrusak","M. Kojman","M. Kojman","M. Kojman","M. Kojman","Menachem Kojman","S. Shelah","S. Shelah","S. Shelah","S. Shelah","Saharon Shelah","W. H. Woodin"]",2012-04-13T14:23:51
51504107,"["oai:arxiv.org:1805.08362"]",10.1002/mana.201800448,"A note on a smooth projective surface with Picard number 2","["Li, Sichen"]",2018-06-16T12:29:26
695543,"["oai:eprints.lancs.ac.uk:68294","oai:arxiv.org:1004.2301"]",10.1017/s0308210510000648,"Simplicial cohomology of band semigroup algebras","["Choi, Yemon","Gourdeau, Fr\u00e9d\u00e9ric","White, Michael C."]",2012-04-13T14:17:54
1086075,"["oai:arxiv.org:math\/0601467"]",10.1007/bf02960851,"The symmetry axiom in Minkowski planes","["Kosiorek, Jaroslaw","Matras, Andrzej"]",2012-04-13T14:23:56
947706,"["oai:arxiv.org:dg-ga\/9406005","oai:citeseerx.psu:10.1.1.45.5766"]",,"$n$-transitivity of certain diffeomorphism groups","["Michor, Peter W.","Vizman, Cornelia"]",2012-04-13T14:21:52
780315,"["oai:arxiv.org:1109.5556","oai:citeseerx.psu:10.1.1.768.866","oai:epub.ub.uni-muenchen.de:16210"]",10.1063/1.4728982,"Stability of Impurities with Coulomb Potential in Graphene with
  Homogeneous Magnetic Field","["Davis P. J.","Frank R. L.","Gautschi W.","Heinz Siedentop","Hochstrasser U. W.","Rudin W.","Thaller B.","Thomas Maier"]",2012-04-13T14:19:13
18075228,"["oai:arxiv.org:1506.07086"]",10.1007/s00222-015-0618-4,"Erratum to: Birationally rigid hypersurfaces","["de Fernex, Tommaso"]",2015-09-24T00:44:03
1059800,"["oai:arxiv.org:math-ph\/0701061"]",,"The Volterra system and topology of the isospectral variety of
  zero-diagonal Jacobi matrices","["Penskoi, Alexei V."]",2012-04-13T14:23:32
1142158,"["oai:citeseerx.psu:10.1.1.252.7960","oai:cds.cern.ch:678106","oai:arxiv.org:quant-ph\/0310133","oai:citeseerx.psu:10.1.1.253.167"]",,"Quantum algorithms in group theory","["Batty, Michael","Braunstein, Samuel L.","Duncan, Andrew J.","Rees, Sarah"]",2012-04-13T14:24:51
619884,"["oai:arxiv.org:0811.0665"]",10.1088/1751-8113/42/3/035403,"Dynamical Casimir Effect for a Swinging Cavity","["Braggio C","Calucci G","Casimir H B G","Cem Yuce","Dodonov V V","Ling L","Ruser M","Wegrzyn P","Yuce C","Zalihe Ozcakmakli"]",2012-04-13T14:16:46
1096550,"["oai:citeseerx.psu:10.1.1.205.3116","oai:repository.bilkent.edu.tr:11693\/10901","oai:citeseerx.psu:10.1.1.235.8265","oai:arxiv.org:math\/9605202"]",10.1090/s0002-9947-96-01746-1,"Infinite products of finite simple groups","["Saxl, Jan","Shelah, Saharon","Thomas, Simon"]",2012-04-13T14:24:06
1065202,"["oai:hispana.mcu.es:273334","oai:arxiv.org:math\/0111074"]",,"Symplectically harmonic cohomology of nilmanifolds","["Ib\u00e1\u00f1ez, R.","Rudyak, Yu.","Tralle, A.","Ugarte, L."]",2012-04-13T14:23:37
1071360,"["oai:citeseerx.psu:10.1.1.236.6079","oai:arxiv.org:math\/0309059"]",,"A construction of $C^*$-algebras from $C^*$-correspondences","["Katsura, Takeshi"]",2012-04-13T14:23:43
9100310,"["oai:scholarship.claremont.edu:hmc_fac_pub-1130"]",,"Math Major, Math Major","["Benjamin, Arthur T."]",2016-11-21T12:27:57
24916998,"["oai:casi.ntrs.nasa.gov:19770012544"]",,"Correlation of AH-1G airframe test data with a NASTRAN mathematical model","["Berry, V. L.","Cronkhite, J. D."]",2016-08-03T08:41:42
1081755,"["oai:arxiv.org:math\/0505305"]",,"A description of $(C_p[L_p(M)], R_p[L_p(M)])_\theta$","["Xu, Quanhua"]",2012-04-13T14:23:51
1088133,"["oai:arxiv.org:math\/0604291"]",,"Best constants for higher-order Rellich inequalities in $L^p(\Omega)$","["Barbatis, G."]",2012-04-13T14:23:57
671225,"["oai:citeseerx.psu:10.1.1.748.9953","oai:arxiv.org:0911.1239"]",,"Non-disturbance criteria of quantum measurements","["Junde, Wu","Shifang, Zhang","Zhaoqi, Wu"]",2012-04-13T14:17:32
1070005,"["oai:arxiv.org:math\/0302258"]",,"On nonuniqueness for Calderon's inverse problem","["Greenleaf, Allan","Lassas, Matti","Uhlmann, Gunther"]",2012-04-13T14:23:41
1056218,"["oai:arxiv.org:math-ph\/0203014"]",10.1016/s0034-4877(02)80021-0,"Moving frames for cotangent bundles","["Ehlers, K. M.","Koiller, J.","Rios, P. de M."]",2012-04-13T14:23:28
17023948,"["oai:arxiv.org:1211.3380"]",,"Non uniformly hyperbolic diffeomorphisms derived from the standard map","["Berger, Pierre","Carrasco, Pablo D."]",2014-10-23T17:20:27
24808390,"["oai:arxiv.org:1606.06030"]",,"Building-like geometries of finite Morley Rank","["M\u00fcller, Isabel","Tent, Katrin"]",2016-08-03T03:08:11
69963761,"["oai:digitalcommons.imsa.edu:res_halls_drawings-1003"]",,"Residence Hall Exterior Project Drawings","["Illinois Math and Science Academy"]",2019-10-29T23:58:49
69963897,"["oai:digitalcommons.imsa.edu:facility_in2_manuals-1018"]",,"IN2 Non-structural Metal Framing","["Illinois Math and Science Academy"]",2019-10-29T23:58:51
132978123,"["oai:ojs2.computerresearch.org:article\/102194"]",,"A Review on Human Gait Detection","["Pavithra D S","Shrishail Math"]",2022-10-19T05:19:46
1057303,"["oai:citeseerx.psu:10.1.1.153.8411","oai:arxiv.org:math-ph\/0312041","oai:citeseerx.psu:10.1.1.552.923"]",10.1023/b:joss.0000037243.48527.e3,"Partition function zeros at first-order phase transitions: Pirogov-Sinai
  theory","["Biskup, Marek","Borgs, Christian","Chayes, Jennifer T.","Kotecky, Roman"]",2012-04-13T14:23:29
1095361,"["oai:arxiv.org:math\/0702409","oai:citeseerx.psu:10.1.1.240.1432"]",10.1214/105051606000000484,"Market free lunch and large financial markets","["Klein, Irene"]",2012-04-13T14:24:04
2395490,"["oai:arxiv.org:1203.3928"]",,"On the asymptotics of integrals related to the generalized Cantor ladder","["Nazarov, Alexander I.","Rastegaev, Nikita V."]",2012-06-28T20:38:10
1102779,"["oai:arxiv.org:nlin\/0104072"]",10.2991/jnmp.2001.8.2.10,"Addendum to ``Coupled KdV Equations of Hirota-Satsuma Type'' (J. Nonlin.
  Math. Phys. Vol. 6, No.3 (1999), 255--262)","["Sakovich, Sergei Yu."]",2012-04-13T14:24:17
1082304,"["oai:arxiv.org:math\/0506237"]",,"The existence of finitely generated modules of finite Gorenstein
  injective dimension","["Takahashi, Ryo"]",2012-04-13T14:23:52
796008,"["oai:arxiv.org:1112.2482"]",,"A quantitative second order minimality criterion for cavities in elastic
  bodies","["Capriani, Giuseppe Maria","Julin, Vesa","Pisante, Giovanni"]",2012-04-13T14:19:30
4215678,"["oai:arxiv.org:1207.6854"]",,"More sums of Hilbert frames","["Abdollahpour, M. R.","Najati, A.","Osgooei, E.","Saem, M. M."]",2012-08-09T13:55:44
17026687,"["oai:arxiv.org:1212.3672"]",,"Construction of discrete analogue of the differential operator
  $\frac{d^4}{dx^4}+2\frac{d^2}{dx^2}+1$ and its properties","["Hayotov, A. R."]",2014-10-23T17:21:06
17200094,"["oai:arxiv.org:1406.0259","oai:citeseerx.psu:10.1.1.747.8170"]",,"Eigenvalues of real symmetric matrices","["Geck, Meinolf"]",2014-10-24T19:26:50
1074919,"["oai:arxiv.org:math\/0403364"]",,"On linear transformations preserving the P\'olya Frequency property","["Br\u00e4nd\u00e9n, Petter"]",2012-04-13T14:23:45
1057678,"["oai:arxiv.org:math-ph\/0506061","oai:citeseerx.psu:10.1.1.340.8406"]",,"New results on the Stieltjes constants: Asymptotic and exact evaluation","["Coffey, Mark W."]",2012-04-13T14:23:30
571148,"["oai:www.zora.uzh.ch:21523","oai:arxiv.org:0710.5772"]",10.5167/uzh-21523,"Pre-Poisson submanifolds","["Cattaneo, Alberto S.","Zambon, Marco"]",2012-04-13T14:16:04
62529836,"["oai:scholarworks.uark.edu:oepreport-1061","oai:scholarworks.uark.edu:oepreport-1064"]",,"High-Growth Elementary Schools in Arkansas Based on Performance on the ACT Aspire Examinations","["McKenzie, Sarah C.","Reid, Charlene A."]",2019-07-09T15:34:57
1071072,"["oai:centre-mersenne.org:crmath_2003__337_9_569_0","oai:arxiv.org:math\/0307315","oai:numdam.org:crmath_2003__337_9_569_0","oai:citeseerx.psu:10.1.1.239.8107","oai:hal:hal-00622663v1"]",10.1016/j.crma.2003.09.020,"An analytic formula for Macdonald polynomials","["Hua","Jing","Krattenthaler","Krattenthaler","Lapointe","Lassalle","Lassalle","Macdonald","Michael Schlosser","Michel Lassalle","Schlosser"]",2012-04-13T14:23:42
739634,"["oai:arxiv.org:1101.4991"]",10.4310/mrl.2011.v18.n5.a8,"On type III_1 factors arising as free products","["Ueda, Yoshimichi"]",2012-04-13T14:18:36
1072561,"["oai:arxiv.org:math\/0311470","oai:citeseerx.psu:10.1.1.235.7203"]",10.4310/mrl.2006.v13.n3.a12,"Hearing the platycosms","["Conway, J. H.","Rossetti, J. P."]",2012-04-13T14:23:44
17195450,"["oai:arxiv.org:1404.7178","oai:citeseerx.psu:10.1.1.752.3249"]",10.1007/s00220-014-2269-5,"Absence of replica symmetry breaking in the random field Ising model","["Chatterjee, Sourav"]",2014-10-24T19:26:05
17196832,"["oai:arxiv.org:1405.1051"]",,"Automorphism-invariant modules","["Asensio, Pedro A. Guil","Srivastava, Ashish K."]",2014-10-24T19:26:15
128496769,"["oai:harvest.issuelab.org:13683"]",,"The Common Core and the Future of Student Assessment in Ohio","["Emmy Partin","Jamie Davies O'Leary","Kathleen Porter-Magee"]",2016-11-21T19:15:23
1059027,"["oai:arxiv.org:math-ph\/0602005"]",,"The Schr\"odinger Equation with a Moving Point Interaction in Three
  Dimensions","["Posilicano, Andrea"]",2012-04-13T14:23:31
1090011,"["oai:arxiv.org:math\/0608466"]",,"Linear relations in the Calkin algebra for composition operators","["Kriete, Thomas","Moorhouse, Jennifer"]",2012-04-13T14:24:00
1099336,"["oai:arxiv.org:math\/9809114"]",,"Equivalences of triangulated categories and Fourier-Mukai transforms","["Bridgeland, Tom"]",2012-04-13T14:24:07
671252,"["oai:citeseerx.psu:10.1.1.360.4559","oai:arxiv.org:0911.1970","oai:citeseerx.psu:10.1.1.154.3833"]",10.17615/dhvz-vw32,"Path count asymptotics and Stirling numbers","["Petersen, K.","Varchenko, A."]",2012-04-13T14:17:32
1100737,"["oai:arxiv.org:math\/9905106","oai:citeseerx.psu:10.1.1.239.8564"]",,"Deformations of Q-Calabi-Yau 3-folds and Q-Fano 3-folds of Fano index 1","["Minagawa, Tatsuhiro"]",2012-04-13T14:24:08
680292,"["oai:arxiv.org:1001.2091"]",,"Congruences between abelian pseudomeasures, II","["Ritter, J\u00fcrgen","Weiss, Alfred"]",2012-04-13T14:17:41
2397532,"["oai:arxiv.org:1204.1837"]",,"Correction to "Fibers of tropicalization"","["Payne, Sam"]",2012-06-28T20:38:23
17162452,"["oai:arxiv.org:1311.5083"]",,"Higher dimensional multifractal analysis of non-uniformly hyperbolic
  systems","["Guan-Zhong, Ma","Xiao, Yao"]",2014-10-24T19:22:32
17205999,"["oai:arxiv.org:1406.7814"]",,"On an infinite series for $(1+1/x)^x$","["Hu, Yue","Mortici, Cristinel"]",2014-10-24T19:27:34
45151454,"["oai:arxiv.org:1710.10240"]",,"Compact K\"ahler manifolds with positive orthogonal bisectional
  curvature","["Feng, Huitao","Liu, Kefeng","Wan, Xueyuan"]",2017-11-21T00:02:20
1064996,"["oai:arxiv.org:math\/0110166","oai:ora.ouls.ox.ac.uk:uuid:e92775f2-5efc-4ea4-9e75-cce1ebb53e4e","oai:ora.ox.ac.uk:uuid:e92775f2-5efc-4ea4-9e75-cce1ebb53e4e","oai:citeseerx.psu:10.1.1.235.8257"]",10.1007/s002090100377,"On a conjecture of Cox and Katz","["Szendroi, Balazs"]",2012-04-13T14:23:37
18078531,"["oai:arxiv.org:1507.01453"]",,"A note on the infinitesimal Baker-Campbell-Hausdorff formula","["Nishimura, Hirokazu","Takamiya, Hirowaki"]",2015-09-24T00:58:01
714256,"["oai:arxiv.org:1008.2377"]",10.1112/jlms/jdr033,"Inverse systems, Gelfand-Tsetlin patterns and the weak Lefschetz
  property","["Harbourne, Brian","Schenck, Hal","Seceleanu, Alexandra"]",2012-04-13T14:18:11
54149986,"["oai:arxiv.org:1809.02969"]",,"Low regularity blowup solutions for the mass-critical NLS in higher
  dimensions","["Sun, Chenmin","Zheng, Jiqiang"]",2019-02-06T06:41:42
1070605,"["oai:arxiv.org:math\/0304431"]",10.4310/mrl.2003.v10.n2.a1,"Modularity of abelian surfaces with Quaternionic Multiplication","["Dieulefait, Luis"]",2012-04-13T14:23:42
1066887,"["oai:sci-gems.math.bas.bg:10525\/1695","oai:arxiv.org:math\/0204272"]",,"On arrangements of real roots of a real polynomial and its derivatives","["Kostov, Vladimir Petrov"]",2012-04-13T14:23:38
1085897,"["oai:arxiv.org:math\/0601694","oai:citeseerx.psu:10.1.1.238.1391","oai:scholarworks.uno.edu:math_facpubs-1003"]",,"The Euler characteristic of the Whitehead automorphism group of a free
  product","["Jensen, Craig","McCammond, Jon","Meier, John"]",2012-04-13T14:23:56
17037473,"["oai:arxiv.org:1301.7322"]",,"The trisector curve is transcendental","["Monterde, J.","Ongay, F."]",2014-10-23T17:22:01
24790340,"["oai:arxiv.org:1604.06703","oai:numdam.org:crmath_2016__354_9_936_0","oai:centre-mersenne.org:crmath_2016__354_9_936_0","info:doi\/10.1016%2fj.crma.2016.05.016"]",10.1016/j.crma.2016.05.016,"The class of the affine line is a zero divisor in the Grothendieck ring:
  an improvement","["Martin, Nicolas"]",2016-08-03T02:57:36
69962878,"["oai:digitalcommons.imsa.edu:facility_in2_manuals-1009"]",,"IN2 Sheet Metal Flashing and Trim","["Illinois Math and Science Academy"]",2019-10-29T23:58:51
86609278,"["oai:publications.azimpremjiuniversity.edu.in:2309","oai:publications.azimpremjifoundation.org:2309"]",,"Low floor high ceiling tasks : Summing v","["Azim Premji University, Math Space"]",2020-07-09T15:11:57
1054724,"["oai:arxiv.org:math-ph\/0004013"]",,"Schrodinger Operators on Graphs","["P, Novikov S."]",2012-04-13T14:23:27
85774298,"["oai:arxiv.org:2005.06458"]",,"Local Banach-space dichotomies and ergodic spaces","["Carrera, W. Cuellar","de Rancourt, N.","Ferenczi, V."]",2020-05-14T16:53:01
69964008,"["oai:digitalcommons.imsa.edu:facility_in2_manuals-1022"]",,"IN2 Resilient Base and Accessories","["Illinois Math and Science Academy"]",2019-10-29T23:58:51
69964832,"["oai:digitalcommons.imsa.edu:math_journal-1000","oai:digitalcommons.imsa.edu:math_journal-1001"]",,"IMSA Math Journal: a Resource Notebook for High School Mathematics","["Illinois Math and Science Academy"]",2019-10-29T23:59:06
126671023,"["oai:eprints.uad.ac.id:37346","oai:ojs.www.journal2.uad.ac.id:article\/711","oai:ojs.pkp.sfu.ca:article\/711"]",10.12928/notion.v1i1.711,"How Close Are Western Cham Language and Bahasa Indonesia in their Structure?  A Contrastive Study","["Kurniawan, Muhammad Hafiz","Safeat, Math"]",2019-12-15T01:06:27
1060180,"["oai:arxiv.org:math-ph\/9906010"]",,"Comment on ``A simple expression for the terms in the
  Baker-Campbell-Hausdorff series''","["Kobayashi, Hiroto"]",2012-04-13T14:23:32
1055101,"["oai:arxiv.org:math-ph\/0107008"]",,"Prelle-Singer Approach and Liouvillian Solutions: An Important Result","["da Mota, L. A. C. P.","Duarte, L. G. S.","Duarte, S. E. S."]",2012-04-13T14:23:27
636326,"["oai:arxiv.org:0903.1174"]",10.7153/mia-14-06,"An alternative proof of Elezovi\'c-Giordano-Pe\v{c}ari\'c's theorem","["Guo, Bai-Ni","Qi, Feng"]",2012-04-13T14:17:01
42846131,"["oai:arxiv.org:1703.01834","oai:research-information.bris.ac.uk:publications\/8ff21d76-be7d-4ded-9b2a-b8683b01af17","oai:research-information.bris.ac.uk:openaire_cris_publications\/8ff21d76-be7d-4ded-9b2a-b8683b01af17"]",10.1112/s0025579319000184,"A converse theorem without root numbers","["Booker, Andrew R."]",2017-06-19T02:23:08
24896295,"["oai:casi.ntrs.nasa.gov:19840002107"]",,"Molecular contamination math model support","["Wells, R."]",2016-08-03T07:41:15
717923,"["oai:hal:hal-00516080v2","oai:arxiv.org:1009.1611","info:doi\/10.1017%2fs030500411500064x"]",10.1017/s030500411500064x,"Motivic invariant of real polynomial functions and Newton polyhedron","["Fichou, Goulwen","Fukui, Toshizumi"]",2012-04-13T14:18:14
74545475,"["oai:journals.calstate.edu:article\/2123"]",10.32398/cjhp.v16i1.2123,"Comparative De Novo Transcriptome Assembly of Notophthalmus viridescens RNA-seq Data using Two Commercial Software Programs","["Chacon, Jonathan","Cuajungco, Math P."]",2019-12-15T00:59:39
812732,"["oai:www.repo.uni-hannover.de:123456789\/2706","oai:arxiv.org:alg-geom\/9712025"]",10.15488/2680,"Heisenberg-invariant Kummer surfaces","["Hulek, K.","Nieto, I.","Sankaran, G. K."]",2012-04-13T14:19:43
1061406,"["oai:arxiv.org:math\/0009132"]",,"Vertex algebras and the cohomology ring structure of Hilbert schemes of
  points on surfaces","["Li, Wei-ping","Qin, Zhenbo","Wang, Weiqiang"]",2012-04-13T14:23:34
2389564,"["oai:arxiv.org:1202.5245"]",10.4310/mrl.2012.v19.n2.a18,"Salem Numbers and Automorphisms of Complex Surfaces","["Reschke, Paul"]",2012-06-28T20:37:58
18076057,"["oai:arxiv.org:1506.08298"]",,"The number of chains of subgroups of a finite elementary abelian
  $p$-group","["T\u0103rn\u0103uceanu, Marius"]",2015-09-24T00:48:27
1064632,"["oai:arxiv.org:math\/0109010","oai:citeseerx.psu:10.1.1.240.8495","oai:citeseerx.psu:10.1.1.23.4487","oai:citeseerx.psu:10.1.1.104.5678"]",10.1006/jcta.2002.3251,"Combinatorial proofs of q-series identities","["Chapman, Robin"]",2012-04-13T14:23:36
598427,"["oai:arxiv.org:0805.4454"]",10.1007/s00220-009-0970-6,"Existence, Regularity, and Properties of Generalized Apparent Horizons","["A. Ashtekar","D. Gilbarg","G. Huisken","H. Bray","J. Serrin","L. Andersson","M. Khuri","M. Kriele","Michael Eichmair","R. Schoen","R. Schoen","R. Schoen","S. Hawking"]",2012-04-13T14:16:26
