"workID","oaiID","doi","title","authors","createdDate"
1081889,"["oai:arxiv.org:math\/0505345","oai:hal:hal-00628580v1"]",10.1007/s11856-009-0084-z,"Existential questions in (relatively) hyperbolic groups {\it and}
  Finding relative hyperbolic structures","["A. Kharlampovich","B. Farb","C. Hruska","D. Epstein","E. Rips","F. Dahmani","F. Dahmani","F. Dahmani","F. Dahmani","Fran\u00e7ois Dahmani","G. Makanin","M. Coornaert","M. Gromov","P. Papasoglu","T. Delzant","V. Diekert","V. Diekert","V. Diekert","V. Diekert","V. Roman\u2019kov"]",2012-04-13T14:23:52
155487585,"["oai:eprints.umm.ac.id:4755"]",10.1088/1742-6596/2157/1/012038/pdf,"High Order Thinking Skills: Can It Arise When A Prospective Teacher Solves A Controversial Mathematics Problem?","["Athma Putri Rosyadi, Alfiani","Rahardjo, Swasono","Sa\u2019dijah, Cholis","Susiswo, Susiswo"]",2013-07-19T16:12:59
24817295,"["oai:eprints.gla.ac.uk:234450","oai:arxiv.org:1606.09377"]",10.1112/blms.12476,"A note on spherical functors","["Meachan, Ciaran"]",2016-08-03T03:10:17
557545,"["oai:hal:hal-00622757v1","oai:arxiv.org:0707.2732"]",10.1007/s00208-007-0156-5,"An explicit formula for the characters of the symmetric group","["Lassalle, Michel"]",2012-04-13T14:15:51
24801157,"["oai:arxiv.org:1605.04643"]",,"On a gradient maximum principle for some quasilinear parabolic equations
  on convex domains","["Kim, Seonghak"]",2016-08-03T03:01:42
145193301,"["oai:arxiv.org:1901.11127"]",,"Smoothing finite group actions on three-manifolds","["Pardon, John"]",2019-02-06T06:54:18
562255,"["oai:tohoku.repo.nii.ac.jp:00108672","oai:arxiv.org:0709.0336","oai:citeseerx.psu:10.1.1.244.8137","oai:citeseerx.psu:10.1.1.1014.1721","oai:citeseerx.psu:10.1.1.245.2085","oai:citeseerx.psu:10.1.1.245.282","oai:citeseerx.psu:10.1.1.535.2391","oai:citeseerx.psu:10.1.1.245.1971","oai:arxiv.org:0709.0332"]",10.1063/1.2896975,"Effective base point free theorem for log canonical pairs--Koll\'ar type
  theorem","["Balachandran Jeyadevan","K. Fujii","K. Ohkawa","Kazuyuki Tohji","Noriyoshi Tsuchiya","T. Yao"]",2012-04-13T14:15:57
18047638,"["oai:arxiv.org:1502.06906","oai:arxiv.org:1604.04974"]",10.4169/amer.math.monthly.122.03.275,"Finite groups with a certain number of cyclic subgroups","["Tarnauceanu, Marius"]",2015-09-24T00:05:38
37616868,"["oai:doaj.org\/article:a92f2d20d8394f2bb922b8d881ce7ef7","oai:arxiv.org:1609.01063"]",10.3934/math.2017.1.1,"Remarks on an elliptic problem arising in weighted energy estimates for
  wave equations with space-dependent damping term in an exterior domain","["Sobajima, Motohiro","Wakasugi, Yuta"]",2016-12-01T20:56:00
54181043,"["oai:pure.atira.dk:openaire_cris_publications\/71c7ce35-fb57-407c-969f-27468edf24c3","oai:arxiv.org:1812.07268","oai:pure.atira.dk:publications\/71c7ce35-fb57-407c-969f-27468edf24c3"]",10.1007/s00220-019-03676-1,"Magnetic Skyrmions at Critical Coupling","["Barton-Singer, Bruno","Ross, Calum","Schroers, Bernd J"]",2019-02-06T06:50:45
1059329,"["oai:arxiv.org:math-ph\/0607013","oai:www.iris.unisa.it:11386\/4681209"]",10.1016/s0034-4877(07)00004-3,"A variational formulation of analytical mechanics in an affine space","["Antonio De Nicola","Marmo","Tulczyjew","Tulczyjew","Wlodzimierz M. Tulczyjew"]",2012-04-13T14:23:32
18077648,"["oai:arxiv.org:1507.01337","oai:irdb.nii.ac.jp:00883:0004066071"]",,"Notes on optimality conditions using Newton diagrams and sums of squares","["Sekiguchi, Yoshiyuki"]",2015-09-24T00:57:31
557622,"["oai:arxiv.org:0707.2862","oai:citeseerx.psu:10.1.1.249.5293","oai:archive.ugent.be:425355"]",10.1016/j.jmaa.2007.06.015,"Fundamental solutions for the super Laplace and Dirac operators and all
  their natural powers","["Aronszajn","Bartocci","Berezin","Berezin","Brackx","De Bie","Delanghe","F. Sommen","Gilbert","H. De Bie","Kostant","Le\u012dtes","Sommen","Sommen"]",2012-04-13T14:15:52
17018843,"["oai:arxiv.org:1210.5325"]",,"Coarsenings, injectives and Hom functors","["Rohrer, Fred"]",2014-10-23T17:19:53
43887294,"["oai:arxiv.org:1708.02496","oai:doaj.org\/article:38a478f8c3484dddbb733e31f0e2e3f1"]",10.3934/math.2018.1.148,"A Minimization Approach to Conservation Laws With Random Initial
  Conditions and Non-smooth, Non-strictly Convex Flux","["Caginalp, Carey"]",2017-09-08T05:02:23
24823141,"["oai:arxiv.org:1607.04021","oai:iris.unibs.it:11379\/487242","oai:re.public.polimi.it:11311\/1020730","oai:doaj.org\/article:fcf8b2b57f2f4cd69147a04a1b38471c"]",10.3934/math.2017.1.28,"Steady states of elastically-coupled extensible double-beam systems","["Dell'Oro, Filippo","Giorgi, Claudio","Pata, Vittorino"]",2016-08-03T03:12:44
1056097,"["oai:arxiv.org:math-ph\/0201026","oai:gredos.usal.es:10366\/121183"]",,"On the derivatives of generalized Gegenbauer polynomials","["Fuertes, W. Garcia","Perelomov, A. M."]",2012-04-13T14:23:28
747935,"["oai:hal:hal-02988426v1","oai:arxiv.org:1103.1855"]",,"The Schur multiplier of finite symplectic groups","["Funar, Louis","Pitsch, Wolfgang"]",2012-04-13T14:18:42
558190,"["oai:arxiv.org:0707.3590"]",,"Trigonometric Series via Laplace Transforms","["Efthimiou, C. J."]",2012-04-13T14:15:52
1071308,"["oai:citeseerx.psu:10.1.1.235.1215","oai:arxiv.org:math\/0306067"]",10.1142/s0129167x04002417,"About the QWEP conjecture","["Ozawa, Narutaka"]",2012-04-13T14:23:42
36986137,"["oai:harvest.issuelab.org:7592"]",,"The Promise of Faculty Inquiry for Teaching and Learning Basic Skills","["Mary Taylor Huber"]",2016-11-21T19:11:15
43887217,"["oai:arxiv.org:1708.02339","oai:doaj.org\/article:16a88c6f975c405cb382bf04e9fa4311"]",10.3934/math.2018.1.96.,"Minimization Solutions to Conservation Laws with Non-smooth and
  Non-strictly Convex Flux","["Caginalp, Carey"]",2017-09-08T05:02:11
17015365,"["oai:arxiv.org:1210.0367"]",10.1007/s00365-013-9192-4,"On 2D Newest Vertex Bisection: Optimality of Mesh-Closure and
  H1-Stability of L2-Projection","["Karkulik, Michael","Pavlicek, David","Praetorius, Dirk"]",2014-10-23T17:19:27
17189864,"["oai:arxiv.org:1404.3745","oai:citeseerx.psu:10.1.1.750.9082","oai:authors.library.caltech.edu:59007"]",10.1090/s0002-9939-2015-12603-2,"New Counterexamples for Sums-Differences","["Lemm, Marius"]",2014-10-24T19:25:50
51447279,"["oai:scholarworks.uark.edu:oepreport-1004"]",,"Outstanding Educational Performance Awards: Highlighting High Achieving Arkansas Schools, 2016","["Reid, Charlene A.","Ritter, Gary W."]",2018-06-10T09:03:33
36997197,"["oai:harvest.issuelab.org:11376"]",,"Technology Solutions for Developmental Math: An Overview of Current and Emerging Practices","["Elaine DeLott Baker","Rhonda M. Epper"]",2016-11-21T19:13:15
705650,"["oai:arxiv.org:1006.3413","oai:pure.mpg.de:item_3121732"]",10.4171/jems/326,"Algebraic K-theory of the first Morava K-theory","["Ausoni, Christian","Rognes, John"]",2012-04-13T14:18:02
1153357,"["oai:arxiv.org:solv-int\/9507002"]",10.1088/0305-4470/28/13/003,"Multivariable continuous Hahn and Wilson polynomials related to
  integrable difference systems","["van Diejen, J. F."]",2012-04-13T14:25:01
49547475,"["oai:arxiv.org:1802.01735"]",,"About the Noether's theorem for fractional Lagrangian systems and a
  generalization of the classical Jost method of proof","["Cresson, Jacky","Szafranska, Anna"]",2018-03-05T19:52:07
1092855,"["oai:arxiv.org:math\/0611362","oai:citeseerx.psu:10.1.1.240.6370"]",,"On Relations among Fourier Coefficients and Sum-functions","["Yu, Dan-Sheng","Zhou, Song-Ping"]",2012-04-13T14:24:02
795172,"["oai:arxiv.org:1112.1359"]",,"A Proof that Zeilberger Missed: A New Proof of an Identity by Chaundy
  and Bullard based on the WZ Method","["Chen, YiJun"]",2012-04-13T14:19:29
1061465,"["oai:arxiv.org:math\/0005296"]",,"An example concerning Ohtsuki's invariant and the full SO(3) quautum
  invariant","["Li, Bang-He","Li, Tian-Jun"]",2012-04-13T14:23:34
2404839,"["oai:arxiv.org:1205.4273"]",,"An algebraic approach to the openness conjecture of Demailly and Kollar","["Jonsson, Mattias","Mustata, Mircea"]",2012-06-28T20:38:39
632431,"["oai:arxiv.org:0902.2513"]",10.1016/j.jat.2011.04.003,"An extension of an inequality for ratios of gamma functions","["Abramovich","Alzer","Alzer","Alzer","Bai-Ni Guo","Bennett","Chen","Dubourdieu","Feng Qi","Guo","Guo","Ismail","Ismail","Minc","Muldoon","Qi","Qi","Qi","Qi","Qi","Qi","Yu"]",2012-04-13T14:16:58
1098524,"["oai:arxiv.org:math\/9807157"]",,"Irreducible highest weight representations of the quantum algebra
  $U_h(A_\infty)$","["Palev, T. D.","Stoilova, N. I."]",2012-04-13T14:24:07
24750200,"["oai:arxiv.org:1512.03767"]",10.1017/s0956792516000243,"Bifurcations analysis of the twist-Fr\'eedericksz transition in a
  nematic liquid-crystal cell with pre-twist boundary conditions: the
  asymmetric case","["da Costa, Fernando P.","M\u00e9ndez, Maria Isavel","Pinto, Jo\u00e3o T."]",2016-08-03T02:34:49
24780825,"["oai:arxiv.org:1604.01970"]",,"Four generated 4-instantons","["Anghel, Cristian","Coanda, Iustin","Manolache, Nicolae"]",2016-08-03T02:54:50
758303,"["oai:arxiv.org:1105.5043"]",,"Refinements of Hermite-Hadamard inequality on simplices","["Mitroi, F. -C.","Spiridon, C. I."]",2012-04-13T14:18:54
4225066,"["oai:arxiv.org:1208.3302"]",,"Fano 5-folds with nef tangent bundles and Picard numbers greater than
  one","["Watanabe, Kiwamu"]",2012-08-30T13:52:55
17035636,"["oai:arxiv.org:1301.3916"]",,"Polya's random walk theorem","["Novak, Jonathan"]",2014-10-23T17:21:47
1057474,"["oai:arxiv.org:math-ph\/0404052"]",,"Pseudo-differential equations connected with p-adic forms and local zeta
  functions","["Zuniga-Galindo, W. A."]",2012-04-13T14:23:29
1100233,"["oai:citeseerx.psu:10.1.1.234.9875","oai:arxiv.org:math\/9903108"]",10.1112/s0024610799006997,"A weight system derived from the multivariable Conway potential function","["Murakami, Hitoshi"]",2012-04-13T14:24:08
36995862,"["oai:harvest.issuelab.org:10674"]",,"Preparing Low-Skilled Workers for the Jobs of Tomorrow","["Kenneth E. Poole"]",2016-11-21T19:12:51
18093976,"["oai:centre-mersenne.org:crmath_2015__353_11_995_0","oai:arxiv.org:1509.03952","oai:numdam.org:crmath_2015__353_11_995_0","info:doi\/10.1016%2fj.crma.2015.09.006"]",10.1016/j.crma.2015.09.006,"A symplectic analog of the Quot scheme","["Biswas, Indranil","Dhillon, Ajneet","Hurtubise, Jacques","Wentworth, Richard A."]",2015-09-24T02:00:16
2706382,[],,"Does Practice-Based Teacher Preparation Increase Student Achievement? Early Evidence from the Boston Teacher Residency","["John P. Papay","Jon B. Fullerton","Martin R. West","Thomas J. Kane"]",2012-07-06T03:54:18
36991098,"["oai:harvest.issuelab.org:10507"]",,"Out of Many, One: Toward Rigorous Common Core Standards From the Ground Up",[],2016-11-21T19:12:48
17172131,"["info:doi\/10.1016%2fj.crma.2013.10.024","oai:arxiv.org:1401.5214","oai:numdam.org:crmath_2014__352_5_387_0","oai:centre-mersenne.org:crmath_2014__352_5_387_0"]",10.1016/j.crma.2013.10.024,"A remark on the approximation of plurisubharmonic functions","["Kim, Dano"]",2014-10-24T19:23:50
1150186,"["oai:escholarship.org\/ark:\/13030\/qt6wf4m6m1","oai:escholarship.org:ark:\/13030\/qt6wf4m6m1","oai:arxiv.org:quant-ph\/9502011","oai:cds.cern.ch:275131"]",,"Is Mental Process Non-Computable?","["Stapp, Henry P."]",2012-04-13T14:24:58
24709872,"["oai:eprints.gla.ac.uk:120431","info:doi\/10.1016%2fj.ijpsycho.2016.06.005"]",10.1016/j.ijpsycho.2016.06.005,"The effect of voluntary modulation of the sensory-motor rhythm during different mental tasks on H reflex","["Jarjees, M.","Vu\u010dkovi\u0107, A."]",2016-07-28T20:26:27
1130024,"["oai:cds.cern.ch:983161","oai:arxiv.org:physics\/0609078"]",,"Comments on "Attainable conditions and exact invariant for the
  time-dependent harmonic oscillator"","["Chu, Kwang-Hua W."]",2012-04-13T14:24:40
24733282,"["oai:arxiv.org:1510.03597"]",,"A note on weak$^*$-convergence in $h^1(\mathbb R^d)$","["Hung, Ha Duy","Huy, Duong Quoc","Ky, Luong Dang"]",2016-08-03T02:24:38
36994234,"["oai:harvest.issuelab.org:8130"]",,"2011 School Report Card: The Best and Worst Results for Detroit Students",[],2016-11-21T19:11:28
701721,"["oai:www.research.unipd.it:11577\/131097","oai:arxiv.org:1005.4168","oai:citeseerx.psu:10.1.1.750.7334"]",10.4064/cm122-2-4,"Rings whose proper factors are right perfect","["Facchini, Alberto","Parolin, Catia"]",2012-04-13T14:17:59
24707527,"["oai:eprints.gla.ac.uk:116060","info:doi\/10.1016%2fj.jbiomech.2015.11.013"]",10.1016/j.jbiomech.2015.11.013,"Uncertainty quantification for personalized analyses of human proximal femurs","["Rank, Ernst","Ruess, Martin","Wille, Hagen","Yosibash, Zohar"]",2016-07-28T20:25:12
562263,"["oai:arxiv.org:0708.3966"]",10.1007/s00209-007-0276-3,"PAC Fields over Finitely Generated Fields","["Bary-Soroker, Lior","Jarden, Moshe"]",2012-04-13T14:15:56
36993933,"["oai:harvest.issuelab.org:10296","oai:scholarworks.uark.edu:scdp-1068"]",,"Milwaukee Independent Charter Schools Study: Report on One Year of Student Growth","["Alicia Dean","Deven Carlson","John F. Witte","Patrick J. Wolf"]",2016-11-21T19:12:44
1090698,"["oai:edoc.mpg.de:405535","oai:pure.mpg.de:item_3123750","oai:arxiv.org:math\/0608284","oai:citeseerx.psu:10.1.1.236.6931"]",10.1007/s00222-007-0098-2,"Domains of holomorphy for irreducible unitary representations of simple
  Lie groups","["A.W. Knapp","B. Kostant","B. Kr\u00f6tz","B. Kr\u00f6tz","Bernhard Kr\u00f6tz","D.N. Akhiezer","G. Fels"]",2012-04-13T14:24:00
1064373,"["oai:arxiv.org:math\/0107039"]",,"The Oka principle for multivalued sections of ramified mappings","["Forstneric, Franc"]",2012-04-13T14:23:36
1104409,"["oai:citeseerx.psu:10.1.1.234.4691","oai:arxiv.org:nlin\/0503055"]",,"Discrete Toda field equations","["Habibullin, Ismagil"]",2012-04-13T14:24:19
1075899,"["oai:citeseerx.psu:10.1.1.235.378","oai:arxiv.org:math\/0407309"]",10.1007/s00209-004-0730-4,"Rigidity of surjective holomorphic maps to Calabi-Yau manifolds","["Hwang, Jun-Muk"]",2012-04-13T14:23:47
874050,"["oai:oai.dml.cz:10338.dmlcz\/147650","oai:zenodo.org:162684","oai:arxiv.org:0708.3966"]",10.1007/s00209-007-0276-3,"PAC Fields over Finitely Generated Fields","["Ben Omrane, Ines","Gala, Sadek","Kim, Jae-Myoung","Ragusa, Maria Alessandra"]",2012-04-13T14:15:56
37003803,"["oai:harvest.issuelab.org:12906"]",,"Growing Opportunity: A Two-Year Update on The Opportunity Equation: Transforming Mathematics and Science Education for Citizenship and the Global Economy",[],2016-11-21T19:14:00
36995476,"["oai:harvest.issuelab.org:9822"]",,"Improving Student Success by Strengthening Developmental Education in Community Colleges: The Role of State Policy","["Brandon Roberts","Derek V. Price"]",2016-11-21T19:12:25
17127697,"["oai:arxiv.org:1305.5664","oai:citeseerx.psu:10.1.1.743.9604"]",,"Arithmetic three-spheres theorems for quasilinear Riccati type
  inequalities","["Granlund, Seppo","Marola, Niko"]",2014-10-24T19:18:26
17211209,"["oai:arxiv.org:1407.2779"]",,"$\GL(V)$-invariant Ulrich bundles on Grassmannians","["Costa, L.","Mir\u00f3-Roig, R. M."]",2014-10-24T19:27:50
2396926,"["oai:arxiv.org:1204.1689"]",,"Actions of Lie groups and Lie algebras on manifolds","["Hirsch, Morris W."]",2012-06-28T20:38:22
1121535,"["oai:cds.cern.ch:550613","oai:arxiv.org:physics\/0205022","oai:citeseerx.psu:10.1.1.176.6876"]",10.1088/0305-4470/35/42/307,"Comment on 'Self-dressing and radiation reaction in classical
  electrodynamics'","["Bohr N","Compagno G","Hnizdo V","V Hnizdo"]",2012-04-13T14:24:35
36993183,"["oai:harvest.issuelab.org:11329"]",,"Supporting Instruction: Investing in Teaching",[],2016-11-21T19:13:14
1079105,"["oai:citeseerx.psu:10.1.1.236.1256","oai:arxiv.org:math\/0501457"]",,"Selected problems","["Zaidenberg, Mikhail"]",2012-04-13T14:23:50
614910,"["oai:arxiv.org:0810.0230"]",10.1016/j.jmaa.2008.10.047,"Tensor products of recurrent hypercyclic semigroups","["Weber, Andreas"]",2012-04-13T14:16:41
50067150,"["oai:arxiv.org:1803.03862"]",,"The Rudin-Kisler ordering of P-points under $\mathfrak{b} =
  \mathfrak{c}$","["Starosolski, Andrzej"]",2018-03-21T05:50:13
566588,"["oai:citeseerx.psu:10.1.1.244.6950","oai:usiena-air.unisi.it:11365\/24641","oai:arxiv.org:0709.4677"]",10.1002/mana.200610000,"A continuation principle for a class of periodically perturbed
  autonomous systems","["Kamenskii, Mikhail","Makarenkov, Oleg","Nistri, Paolo"]",2012-04-13T14:16:00
17195327,"["oai:arxiv.org:1404.6600"]",,"On an inequality concerning the polar derivative of a polynomial with
  restricted zeros","["Gulzar, Suhail","Rather, N. A."]",2014-10-24T19:26:02
37996784,"["oai:harvest.issuelab.org:22619"]",,"National Board Certification and Teacher Effectiveness: Evidence from Washington","["Dan Goldhaber","James Cowan"]",2017-02-15T00:14:10
1089897,"["oai:arxiv.org:math\/0608318"]",,"The Sato-Tate Conjecture on Average for Small Angles","["Baier, Stephan","Zhao, Liangyi"]",2012-04-13T14:24:00
17181797,"["oai:arxiv.org:1402.5701"]",,"A note on local behavior of eigenfunctions of the Schr\"odinger operator","["Seo, Ihyeok"]",2014-10-24T19:24:37
43883510,"["oai:arxiv.org:1707.07575"]",10.1016/j.jmaa.2017.09.049,"Corrigendum to "Syndetically proximal pairs" [J. Math. Anal. Appl. 379
  (2011) 656--663]","["Li, Jian","Moothathu, T. K. Subrahmonian","Oprocha, Piotr"]",2017-09-08T04:57:13
2397276,"["oai:arxiv.org:1204.1671"]",10.1214/14-aap1031,"Mixing time of Metropolis chain based on random transposition walk
  converging to multivariate Ewens distribution","["Jiang, Yunjiang"]",2012-06-28T20:38:22
17177753,"["oai:publications.rwth-aachen.de:667734","oai:arxiv.org:1402.0653","oai:localhost:20.500.11897\/424848"]",10.1137/14100110x,"A Framework on Moment Model Reduction for Kinetic Equation","["Cai, Zhenning","Fan, Yuwei","Li, Ruo"]",2014-10-24T19:24:09
1070553,"["oai:arxiv.org:math\/0304169"]",,"On modularity of rigid and nonrigid Calabi-Yau varieties associated to
  the root lattice A_4","["Hulek, Klaus","Verrill, Helena"]",2012-04-13T14:23:41
562520,"["oai:arxiv.org:0708.3990"]",10.1007/s00208-008-0243-2,"Extreme values of zeta and L-functions","["Soundararajan, K."]",2012-04-13T14:15:56
24731285,"["oai:arxiv.org:1509.08447"]",,"Nonlinear Liouville problems in a quarter plane","["Xiang, Chang-Lin"]",2016-08-03T02:22:18
24758957,"["oai:arxiv.org:1601.03014","oai:acta.bibl.u-szeged.hu:48922"]",10.14232/actasm-015-582-0,"An Application of the Pr\'ekopa-Leindler Inequality and Sobolev
  Regularity of Weighted Bergman Projections","["Zeytuncu, Yunus E."]",2016-08-03T02:39:43
1098401,"["oai:arxiv.org:math\/9803024"]",10.1007/bf01236876,"Affine quantum groups and equivariant K-theory","["Vasserot, Eric"]",2012-04-13T14:24:06
753038,"["oai:arxiv.org:1104.1696"]",10.1016/j.amc.2006.11.114,"Symbolic computation of weighted Moore-Penrose inverse using
  partitioning method","["B., M.","D, M.","Petkovi\u0107","S., P.","Stanimirovi\u0107","Tasi\u0107"]",2012-04-13T14:18:47
17192227,"["oai:arxiv.org:1404.6387"]",,"PySTEMM: Executable Concept Modeling for K-12 STEM Learning","["D'Souza, Kelsey"]",2014-10-24T19:26:01
1071146,"["oai:iris.sissa.it:20.500.11767\/11504","oai:arxiv.org:math\/0306114"]",10.1016/j.geomphys.2003.09.007,"Bijectivity of the canonical map for the noncommutative instanton bundle","["Bonechi, F.","Ciccoli, N.","Dabrowski, L.","Tarlini, M."]",2012-04-13T14:23:42
17032760,"["oai:arxiv.org:1301.1001"]",,"A Characterization of Inner Product Spaces Related to the Skew-Angular
  Distance","["Dehghan, Hossein"]",2014-10-23T17:21:30
2396279,"["oai:arxiv.org:1203.5678"]",,"Function contractive maps in partial metric spaces","["Turinici, Mihai"]",2012-06-28T20:38:14
959386,"["oai:citeseerx.psu:10.1.1.530.2615","oai:citeseerx.psu:10.1.1.339.7751","oai:cds.cern.ch:288915","oai:arxiv.org:gr-qc\/9510004"]",10.1063/1.531427,"Comment on Ricci Collineations of Static Spherically Symmetric
  Spacetimes","["G. Contreras","J. Carot","Jamil Amir","Katzin","L. A. Nu\u0301n\u0303ez","R. Bertolotti","U. Percoco"]",2012-04-13T14:22:02
49554825,"["oai:arxiv.org:1802.09385","oai:research.chalmers.se:514367"]",10.1016/j.matpur.2018.10.002,"Sharp estimates of the spherical heat kernel","["Nowak, Adam","Sj\u00f6gren, Peter","Szarek, Tomasz Z."]",2018-03-05T19:53:38
1083328,"["oai:citeseerx.psu:10.1.1.236.5972","oai:citeseerx.psu:10.1.1.236.2940","oai:arxiv.org:math\/0508182"]",10.4064/aa122-3-4,"On the equivariant main conjecture of Iwasawa theory","["Abstract Refining","Cornelius Greither","David Burns","Guido Kings","Malte Witte","Respectively Annette Huber","We Formulate"]",2012-04-13T14:23:53
62532790,"["oai:scholarscompass.vcu.edu:jmsce_vamsc-1046"]",,"Challenges for Science and Mathematics Faculty","["Thornton, S. T."]",2019-07-09T15:38:27
62534024,"["oai:scholarscompass.vcu.edu:jmsce_vamsc-1062"]",,"An Investigative Approach to Teaching Mathematics: Excitement and Concerns of K-8 Preservice Teachers","["Wilkins, J. L. M."]",2019-07-09T15:38:27
658098,"["oai:arxiv.org:0908.1210"]",10.1007/s10958-010-0175-8,"On the modularity of rigid Calabi-Yau threefolds: Epilogue","["Dieulefait, Luis"]",2012-04-13T14:17:22
17025875,"["oai:arxiv.org:1211.6501"]",10.1090/s0002-9939-2014-12148-4,"A Fourier restriction theorem based on convolution powers","["Chen, Xianghong"]",2014-10-23T17:20:42
43121785,"["oai:journal.austms.org.au:article\/12209","oai:arxiv.org:1707.04215"]",,"On graded C*-algebras","["Raeburn, Iain"]",2017-07-23T18:39:16
707971,"["oai:arxiv.org:1007.0156"]",10.1215/00127094-3167597,"Supercritical Nonlinear Schr\"odinger equations: Quasi-Periodic
  Solutions","["Wang, W. -M."]",2012-04-13T14:18:04
24751334,"["oai:arxiv.org:1512.05136"]",10.1007/s11425-016-5152-3,"The Chern-Ricci flow and holomorphic bisectional curvature","["Yang, Xiaokui"]",2016-08-03T02:35:36
1072348,"["oai:arxiv.org:math\/0309360","oai:zenodo.org:186704","oai:citeseerx.psu:10.1.1.236.9481"]",10.1090/s0002-9939-04-07502-1,"Essential domains and two conjectures in dimension theory","["Fontana, Marco","Kabbaj, Salah"]",2012-04-13T14:23:43
1064565,"["oai:arxiv.org:math\/0108055","oai:citeseerx.psu:10.1.1.237.9430"]",10.1007/s002200100549,"Characterizations of the automorphisms of Hilbert space effect algebras","["Molnar, Lajos"]",2012-04-13T14:23:36
52301096,"["oai:arxiv.org:1808.02135"]",,"A general principle for Hausdorff measure","["Hussain, Mumtaz","Simmons, David"]",2018-09-08T08:12:45
17214246,"["oai:arxiv.org:1407.6696","info:doi\/10.1007%2fs13348-015-0150-2","oai:ruj.uj.edu.pl:item\/36321"]",10.1007/s13348-015-0150-2,"Estimates of the Bergman distance on Dini-smooth bounded planar domains","["Nikolov, Nikolai","Trybu\u0142a, Maria"]",2014-10-24T19:28:12
36992474,"["oai:harvest.issuelab.org:10008","info:doi\/10.2139%2fssrn.2159845"]",10.2139/ssrn.2159845,"Knowledge Economy Immigration: A Priority for U.S. Growth Policy","["Robert E. Litan","Tim Kane"]",2016-11-21T19:12:31
2395708,"["oai:arxiv.org:1203.6855"]",,"Spaceability in sets of operators on $C(K)$","["Fajardo, Rog\u00e9rio","Kaufmann, Pedro","Pellegrini, Leonardo"]",2012-06-28T20:38:19
42851559,"["oai:arxiv.org:1703.08594"]",10.1007/s11854-019-0068-9,"Proper holomorphic immersions into Stein manifolds with the density
  property","["Forstneric, Franc"]",2017-06-19T02:28:06
1067664,"["oai:arxiv.org:math\/0206311","oai:citeseerx.psu:10.1.1.237.4144"]",,"Quotient curves of the Deligne-Lusztig curve of Suzuki type","["Giulietti, Massimo","Korchm\u00e1ros, G\u00e1bor","Torres, Fernando"]",2012-04-13T14:23:39
4223841,"["oai:citeseerx.psu:10.1.1.303.6517","oai:arxiv.org:1208.2464"]",10.1007/s40304-013-0001-y,"Combinatorial independence and sofic entropy","["Kerr, David","Li, Hanfeng"]",2012-08-30T13:52:54
58950911,"["oai:arxiv.org:1902.05292"]",,"On the fundamental group of complete manifolds with almost Euclidean
  volume growth","["Wan, Jianming"]",2019-06-02T01:57:26
1056576,"["oai:arxiv.org:math-ph\/0211037"]",10.1088/0305-4470/35/46/316,"Comment on "A note on the construction of the Ermakov-Lewis invariant"","["F Haas","Haas F","J Goedert","Moyo S","Ray J R","Ray J R"]",2012-04-13T14:23:28
17130347,"["oai:citeseerx.psu:10.1.1.766.2945","oai:arxiv.org:1306.2415"]",,"Positivity for cluster algebras","["Lee, Kyungyong","Schiffler, Ralf"]",2014-10-24T19:18:49
660755,"["oai:arxiv.org:0908.4355"]",,"Local growth of pluri-subharmonic functions","["Truong, Tuyen Trung"]",2012-04-13T14:17:24
671735,"["oai:arxiv.org:0911.0391"]",10.1214/10-aop589,"Approximating the moments of marginals of high-dimensional distributions","["Vershynin, Roman"]",2012-04-13T14:17:31
17025804,"["oai:arxiv.org:1211.6583"]",,"The Wild Number Problem: math or fiction?","["Schogt, Philibert"]",2014-10-23T17:20:43
24746662,"["oai:arxiv.org:1512.03279"]",,"And the math will set you free","["Stoica, O. C."]",2016-08-03T02:34:34
1084636,"["oai:unige.ch:unige:9784","oai:arxiv.org:math\/0510607","oai:citeseerx.psu:10.1.1.239.946","oai:unige.ch:aou:unige:9784","oai:recercat.cat:2072\/4227"]",10.1007/s00208-007-0109-z,"On the asymptotic expansion of the colored Jones polynomial for torus
  knots","["Dubois, J\u00e9r\u00f4me","Kashaev, Rinat"]",2012-04-13T14:23:54
17184155,"["info:doi\/10.1307%2fmmj%2f1457101809","oai:arxiv.org:1403.1074","oai:ruj.uj.edu.pl:item\/26921"]",10.1307/mmj/1457101809,"On IHS fourfolds with $b_2=23$","["Kapustka, Grzegorz"]",2014-10-24T19:24:51
18037967,"["oai:arxiv.org:1501.02703"]",,"Compactness of minimal hypersurfaces with bounded index","["Sharp, Ben"]",2015-09-24T00:01:23
45152705,"["oai:arxiv.org:1711.00301"]",,"$L^p-L^q$ boundedness of Bergman-type operators over the Siegel upper
  half-space","["Hu, Pengyan","Liu, Congwen","Si, Jiajia"]",2017-11-21T00:02:34
774585,"["oai:arxiv.org:1108.4603"]",10.1007/s00208-012-0788-y,"Note on K-stability of pairs","["Sun, Song"]",2012-04-13T14:19:08
44591178,"["oai:arxiv.org:1708.05823"]",10.1090/proc/14049,"Behavior of the squeezing function near h-extendible boundary points","["Nikolov, Nikolai"]",2017-10-17T02:36:27
