"workID","oaiID","doi","title","authors","createdDate"
17017848,"["oai:arxiv.org:1210.7744"]",,"A proof of the Quadratic Reciprocity Law","["Dicker, Math"]",2014-10-23T17:20:05
2384164,"["oai:dlese.org:nasa-eserevprod-000-000-000-406"]",,"Space Math: Lunar Math","["Sten Odenwald"]",2012-06-27T11:43:28
2384186,"["oai:dlese.org:nasa-eserevprod-000-000-000-539"]",,"Space Math: Hinode Math","["Sten Odenwald"]",2012-06-27T11:43:28
4241346,"["oai:arxiv.org:1209.2088"]",,"Spreading Processes and Large Components in Ordered, Directed Random
  Graphs","["Horn, Paul","Magdon-Ismail, Malik"]",2012-09-13T13:50:47
2384038,"["oai:dlese.org:nasa-eserevprod-000-000-000-405"]",,"Space Math: Black Hole Math","["Sten Odenwald"]",2012-06-27T11:43:28
41663669,"["info:doi\/10.5688%2fajpe6257","oai:fisherpub.sjfc.edu:pharmacy_facpub-1190","oai:fisherpub.sjf.edu:pharmacy_facpub-1190"]",10.5688/ajpe6257,"The Relationship Between Prior Experiences in Mathematics and Pharmacy School Success","["Birnie, Christine R.","Brown, Jack","Conn, Kelly M.","McCaffrey, David"]",2019-07-09T11:11:52
36994800,"["oai:harvest.issuelab.org:14698"]",,"Held Back: Addressing Misplacement of 9th Grade Students in Bay Area School Math Classes",[],2016-11-21T19:16:27
748837,"["oai:arxiv.org:1103.5453"]",,"Using a Non-Commutative Bernstein Bound to Approximate Some Matrix
  Algorithms in the Spectral Norm","["Magdon-Ismail, Malik"]",2012-04-13T14:18:45
1069504,"["oai:arxiv.org:math\/0301173"]",,"Homomorphisms of hyperelliptic jacobians","["Zarhin, Yu. G."]",2012-04-13T14:23:41
41663653,"["oai:fisherpub.sjf.edu:education_etd_masters-1368","oai:fisherpub.sjfc.edu:education_etd_masters-1368"]",,"Supporting Students with Math Anxiety","["Walters, Brandie"]",2019-07-09T11:11:49
341233,"["oai:eprints.ioe.ac.uk.oai2:6883","oai:eprints.ucl.ac.uk.oai2:1348758","info:doi\/10.1037%2fa0024556","oai:sure.sunderland.ac.uk:13635","oai:eprints.ucl.ac.uk.oai2:10006883"]",10.1037/a0024556,"Basic calculation proficiency and mathematics achievement in elementary school children","["Cole-Fletcher, Rachel","Cowan, Richard","Donlan, Chris","Hurry, Jane","Saxton, Matthew","Shepherd, Donna-Lynn"]",2012-02-23T11:18:01
17198511,"["oai:arxiv.org:1405.3353","oai:citeseerx.psu:10.1.1.747.6962"]",10.1007/978-3-319-08434-3_15,"Which one is better: presentation-based or content-based math search?","["A.S. Youssef","B.R. Miller","J. Mi\u0161utka","M. Adeel","M. Kohlhase","M.E. Altamimi","M.Q. Nghiem","R. Miner","R. Zanibbi","S. Kamali"]",2014-10-24T19:26:28
713047,"["oai:arxiv.org:1008.0587"]",,"Row Sampling for Matrix Algorithms via a Non-Commutative Bernstein Bound","["Magdon-Ismail, Malik"]",2012-04-13T14:18:11
9208291,"["oai:scholarworks.alaska.edu:11122\/9762"]",,"The treatment of missing data on placement tools for predicting success in college algebra at the University of Alaska","["Crawford, Alyssa"]",2019-02-03T12:08:06
4653978,"["oai:eprints.uny.ac.id:947"]",,"Factor Analysis Of Ordinal Data Based On Weighted Ranking And Its Application To Reduce Perception Variables To Math Lessons Of Senior High School Student","["Kariyam, Kariyam","Perdana, R.B, Perdana, R.B"]",2013-07-08T16:50:05
8962792,"["oai:repository.derby.ac.uk:925x4","oai:derby.openrepository.com:10545\/618797"]",,"Math anxiety, intrusive thoughts and performance: Exploring the relationship between mathematics anxiety and performance: The role of intrusive thoughts","["Clark-Carter, David","Hunt, Thomas E.","Sheffield, David"]",2016-09-16T10:31:59
18046737,"["oai:arxiv.org:1502.06494"]",,Math-Selfie,"["Kutateladze, S. S."]",2015-09-24T00:05:29
54185201,"["oai:arxiv.org:1812.11786"]",,"Mathematics Content Understanding for Cyberlearning via Formula
  Evolution Map","["Gao, Liangcai","Gao, Zheng","Jiang, Zhuoren","Liu, Xiaozhong","Tang, Zhi","Yuan, Ke"]",2019-02-06T06:51:45
24810870,"["oai:arxiv.org:1606.07185"]",10.1093/imrn/rnw256,"Horospheres in degenerate 3-manifolds","["Lecuire, Cyril","Mj, Mahan"]",2016-08-03T03:08:55
40091954,"["oai:digitalcommons.linfield.edu:linfield_magazine-1637"]",,"Math Mentors","["Kelley, Natalie, \\u2718"]",2018-01-01T02:08:19
62531501,"["oai:scholarscompass.vcu.edu:jmsce_vamsc-1088"]",,"The Use of Project-Based Learning in a Technology Course for Math and Science Teachers","["Murfin, B."]",2019-07-09T15:38:28
1080749,"["oai:arxiv.org:math\/0503258"]",,"Global Embedding of Analytic Branes into ES Einstein MD Bulk Cosmology:
  Wormholes","["Katzourakis, Nikolaos I."]",2012-04-13T14:23:50
44613899,"["oai:arxiv.org:1710.00094"]",,"Optimal Design of Hybrid AC/DC Microgrids","["Bahramirad, Shay","Bollen, Math","Khodaei, Amin","Lotfi, Hossein"]",2017-10-17T02:49:53
37471635,"["oai:scholars.unh.edu:student_research-1001"]",,"Utilizing CoCoRaHS Climate Data to Improve Climate Literacy at the Middle School Level","["Lovely, Amy E","Stampone, Mary L."]",2016-12-01T10:58:43
54170380,"["oai:arxiv.org:1811.04962"]",,"A simplified static frequency converter model for electromechanical
  transient stability studies of 16$\frac{2}{3}$ Hz railways","["Abrahamsson, Lars","Bollen, Math H. J","Laury, John"]",2019-02-06T06:47:27
1080574,"["oai:arxiv.org:math\/0503129"]",,"On the Global Embedding of Spacetime into Singular ES Einstein
  Manifolds: Wormholes","["Katzourakis, Nikolaos I."]",2012-04-13T14:23:50
1078957,"["oai:arxiv.org:math\/0411630"]",,"Global Embedding of Analytic Branes into Einstein MD Bulk Cosmology","["Katzourakis, Nikolaos I."]",2012-04-13T14:23:49
541975,"["oai:arxiv.org:0704.0937"]",10.1088/1751-8113/40/27/009,"Invariants of Triangular Lie Algebras","["Ancochea J M","Barannyk L F Fushchych W I","Boyko V","Boyko V","Campoamor-Stursberg R","Campoamor-Stursberg R","Jiri Patera","Kaneta H","Kaneta H","Ndogmo J C","Ndogmo J C","Ndogmo J C","Olver P J","Roman Popovych","Rubin J L","Snobl L","Tremblay S","Tremblay S","Vyacheslav Boyko"]",2012-04-13T14:15:38
40140546,"["oai:docs.rwu.edu:weekatroger_featured_news-1247"]",,"A Mathematical Solution for Medicine’s Unanswered Questions","["Rodrigues, Jill"]",2019-07-09T10:57:06
9463046,"["oai:scholarworks.sjsu.edu:chad_pub-1024"]",,"Language counts: Early language mediates the relationship between parent education and children\u27s math ability","["Ribner, Andrew","Shusterman, Anna","Slusser, Emily"]",2019-07-09T15:27:51
43505674,"["oai:neliti.com:145081"]",,"Lexical Similarities and Differences in the Mathematics, Science and English Language Textbooks","["Menon, S. (Sujatha)","Mukundan, J. (Jayakaran)"]",2017-08-19T04:02:28
1056836,"["oai:arxiv.org:math-ph\/0301030","oai:libcdm.ku.edu.tr:ir\/514"]",10.1063/1.1540714,"Erratum: Pseudo-Hermiticity for a class of nondiagonalizable
  Hamiltonians [J. Math. Phys. 43, 6343 (2002); math-ph/0207009]","["Mostafazadeh, Ali"]",2012-04-13T14:23:28
17210750,"["oai:arxiv.org:1407.2927"]",,"Just Math: A new epistemic frame","["Caballero, Marcos D.","Doughty, Leanne","Irving, Paul W.","Sayre, Eleanor C.","Wolf, Steven F."]",2014-10-24T19:27:51
43152261,"["oai:scholarscompass.vcu.edu:wilder_pubs-1020"]",,"Math in Motion","["Alcaine, Jose","Barden, Diana","Floyd-Miller, Lori","Grace E. Harris Leadership Institute, Virginia Commonwealth University","MacIver, Blake","Marshall, Lea","Nelson, Angela","Vahdani, Thomas","Witten, Tarynn"]",2017-08-03T20:38:17
2739094,[],,"Recruiting Effective Math Teachers: How Do Math Immersion Teachers Compare?: Evidence from New York City","["Donald Boyd","Hamilton Lankford","James Wyckoff","Karen Hammerness","Mathew Ronfeldt","Pam Grossman","Susanna Loeb"]",2012-07-06T03:56:53
1076268,"["oai:citeseerx.psu:10.1.1.367.5014","oai:arxiv.org:math\/0406444"]",10.1214/009117904000001026,"Levy processes: Capacity and Hausdorff dimension","["Khoshnevisan, Davar","Xiao, Yimin"]",2012-04-13T14:23:47
38140689,"["oai:works.swarthmore.edu:fac-education-1046","info:doi\/10.1017%2fcbo9780511805080.011"]",10.1017/cbo9780511805080.011,"The Centrality Of Culture And Community To Participant Learning At And With The Math Forum","["Renninger, K. Ann","Shumar, W."]",2017-02-15T19:44:42
18051779,"["oai:arxiv.org:1503.03903"]",,"Approximating Sparse PCA from Incomplete Data","["Drineas, Petros","Kundu, Abhisek","Magdon-Ismail, Malik"]",2015-09-24T00:07:20
125022986,"["info:doi\/10.5539%2fjel.v2n3p1","oai:publikationen.ub.uni-frankfurt.de:31663"]",10.5539/jel.v2n3p1,"Gender differences in children’s math self-concept in the first years

of elementary school","["Ehm, Jan-Henning","Hasselhorn, Marcus","Lindberg, Sven","Linkersd\u00f6rfer, Janosch","Lonnemann, Jan"]",2013-10-03T13:01:53
920281,"["oai:repositorio.furg.br:1\/1058","oai:arxiv.org:cond-mat\/0608177"]",10.1088/0305-4470/39/36/014,"Generalization of the matrix product ansatz for integrable chains","["Alcaraz F C","Alcaraz F C","Alcaraz F C","F C Alcaraz","Golinelli O Mallick K","M J Lazo"]",2012-04-13T14:21:29
54171892,"["oai:arxiv.org:1811.07398"]",10.1007/s00030-018-0534-6,"Formation of Singularities of Spherically Symmetric Solutions to the 3D
  Compressible Euler Equations and Euler-Poisson Equations","["Li, Hai-Liang","Wang, Yuexun"]",2019-02-06T06:47:59
43118704,"["oai:arxiv.org:1707.00504"]",,"Long-time existence of nonlinear inhomogeneous compressible elastic
  waves","["Cui, Xiufang","Yin, Silu"]",2017-07-23T18:36:15
31636270,"["oai:digitalcommons.bryant.edu:honors_mathematics-1015"]",,"Relationship between Classroom Climate, Student Self-Efficacy, and Achievement in the High School Math Classroom","["Carr, Delaney"]",2016-11-15T16:03:59
1087975,"["oai:citeseerx.psu:10.1.1.607.947","oai:doaj.org\/article:e5c58bd024f84e2581b3108df3a09bdc","oai:arxiv.org:math\/0604153","oai:citeseerx.psu:10.1.1.602.3440","oai:citeseerx.psu:10.1.1.237.9731"]",10.1155/ijmms/2006/69248,"(Co)homology of triassociative algebras","["Yau, Donald"]",2012-04-13T14:23:57
18057897,"["oai:arxiv.org:1504.01855"]",,"Math Marvel with M-Learning","["Balaji, Malathi","Balaji, R. D.","Veeramani, V."]",2015-09-24T00:09:49
1100087,"["oai:citeseerx.psu:10.1.1.240.9343","oai:arxiv.org:math\/9902080"]",,"The Explicit Formula and the conductor operator","["Burnol, Jean-Francois"]",2012-04-13T14:24:08
612446,"["oai:repository.ubn.ru.nl:2066\/129030","oai:arxiv.org:0809.3341","oai:citeseerx.psu:10.1.1.143.1671","oai:recercat.cat:2072\/377564","oai:recercat.cat:2072\/14636","oai:hal:hal-01296573v1","oai:citeseerx.psu:10.1.1.353.838","oai:dspace.library.uu.nl:1874\/226064"]",10.1007/s00209-010-0770-x,"On an extension of the notion of Reedy category","["Clemens Berger","Ieke Moerdijk","Math Z","Mathematische Zeitschrift"]",2012-04-13T14:16:39
4547699,"["oai:citeseerx.psu:10.1.1.407.2760","oai:eprints.vu.edu.au:17169","oai:eprints.vu.edu.au:17773","oai:doaj.org\/article:3b87bf5b712f4ab59df2e61388e4071e","oai:doaj.org\/article:6716eedce0634d57aa4eb1410826e2a4"]",10.1155/s0161171203210279,"On an Inequality of Diananda, II","["Gao, Peng"]",2013-06-28T17:58:38
1082670,"["oai:arxiv.org:math\/0506612","oai:citeseerx.psu:10.1.1.239.9619"]",,"Automorphisms of K3 surfaces","["Zhang, D. -Q."]",2012-04-13T14:23:52
15206675,"["oai:citeseerx.psu:10.1.1.245.5811","oai:arxiv.org:0801.1997","oai:citeseerx.psu:10.1.1.245.3588"]",,"An upper bound for the lower central series quotients of a free
  associative algebra","["Dobrovolska, G.","Etingof, P."]",2012-04-13T14:16:11
18933620,"["oai:aei.pitt.edu:102346"]",,"The effect of high school rank in English and math on college major choice. ESRI Working Paper No. 650
January 2020","["Delaney, Judith","Devereux, Paul J."]",2020-02-06T04:11:29
54161975,"["oai:arxiv.org:1810.06876"]",,"A rotary frequency converter model for electromechanical transient
  studies of 16$\frac{2}{3}$ Hz railway systems","["Abrahamsson, Lars","Bollen, Math H. J","Laury, John"]",2019-02-06T06:44:55
1079575,"["oai:arxiv.org:math\/0501012","oai:citeseerx.psu:10.1.1.741.1561","oai:doaj.org\/article:8a6cd5b004af4a429ecbfb69c87d6e53","oai:citeseerx.psu:10.1.1.620.9865"]",10.1155/ijmms/2006/93942,"Hyers-Ulam-Rassias Stability of Generalized Derivations","["Moslehian, Mohammad Sal"]",2012-04-13T14:23:49
62532807,"["oai:scholarscompass.vcu.edu:jmsce_vamsc-1199"]",,"Persistence in Mathematics by Underrepresented Students: Experiences of a Math Excel Program","["Crow, M. L.","Dick, T.","Hake, C. M."]",2019-07-09T15:38:29
54166102,"["oai:arxiv.org:1811.00720"]",,"Semantically-Aligned Equation Generation for Solving and Reasoning Math
  Word Problems","["Chen, Yun-Nung","Chiang, Ting-Rui"]",2019-02-06T06:46:33
18083959,"["oai:arxiv.org:1507.08987"]",,"Comparable linear contractions in ordered metric spaces","["Alam, Aftab","Imdad, Mohammad"]",2015-09-24T01:23:10
2384206,"["oai:dlese.org:nasa-eserevprod-000-000-000-407"]",,"Space Math IV","["Sten Odenwald"]",2012-06-27T11:43:28
50501269,"["oai:www.research.unipd.it:11577\/3257570"]",10.3389/fnagi.2017.00429,"The relationship between Cognitive Reserve and Math Abilities","["Arcara, Giorgio","Bisso, Alice","Meneghello, Francesca","Mondini, Sara","Palmer, Kate","Semenza, Carlo."]",2018-04-10T11:07:31
85869244,"["oai:escholarship.org\/ark:\/13030\/qt2bx63755","oai:escholarship.org:ark:\/13030\/qt2bx63755"]",,"Student Perceptions of Teacher-Student Relationships in General and Special Education","["Bains, Bhawandeep Kaur"]",2020-05-22T19:27:22
62530825,"["oai:works.swarthmore.edu:fac-math-stat-1242","oai:works.swarthmore.edu:fac-math-stat-1238"]",,"The Impact Of Spike-Frequency Adaptation On Balanced Network Dynamics","["Barranca, Victor J.","Huang, Han, , \\u2719","Li, Sida, , \\u2718"]",2019-07-09T15:37:18
38140783,"["oai:works.swarthmore.edu:fac-education-1097"]",,"Community Building With And For Teachers At The Math Forum","["Renninger, K. Ann","Shumar, W."]",2017-02-15T19:44:44
145914882,"["oai:zenodo.org:9281"]",10.5281/zenodo.9281,"Smarandache Lucky Math","["Ashbacher, Charles"]",2016-02-18T12:51:12
562922,"["oai:arxiv.org:0709.1068"]",,"Semilocal convergence of two iterative methods for simultaneous
  computation of polynomial zeros","["Proinov, Petko D."]",2012-04-13T14:15:57
128496107,"["oai:harvest.issuelab.org:3032"]",,"Alternative High School Math Pathways in Massachusetts: Developing an On-Ramp to Minimize College Remediation in Mathematics",[],2016-11-21T19:08:54
17208245,"["oai:arxiv.org:1406.7428"]",,"Corrected Loop Vertex Expansion for Phi42 Theory","["Rivasseau, Vincent","Wang, Zhituo"]",2014-10-24T19:27:32
84133440,"["oai:generic.eprints.org:13387\/core10784","oai:utpedia.utp.edu.my:13387"]",,"DESIGN OF FIXED OFFSHORE PLATFORM TO MARINE GROWTH THICKNESS IN MALAYSIAN WATER","["ROMLY, MATH"]",2020-04-17T10:30:25
614516,"["oai:arxiv.org:0809.4887"]",10.1134/s0081543809010210,"Absolutely simple Prymians of trigonal curves","["Zarhin, Yuri G."]",2012-04-13T14:16:40
24815022,"["oai:arxiv.org:1606.09328"]",,"Lipschitz type, radial growth and Dirichlet type spaces on functions
  induced by certain elliptic operators","["Chen, Shaolin","Rasila, Antti"]",2016-08-03T03:10:16
18085307,"["oai:arxiv.org:1508.01929"]",10.1145/2810355.2810359,"Combining Text and Formula Queries in Math Information Retrieval:
  Evaluation of Query Results Merging Strategies","["Aizawa A.","Craswell N.","L\u00ed\u0161ka M.","Ounis I.","R\u016f\u017ei\u010dka M."]",2015-09-24T01:29:28
1089285,"["oai:citeseerx.psu:10.1.1.236.1651","oai:citeseerx.psu:10.1.1.237.9990","oai:arxiv.org:math\/0606412"]",,"Hochschild and cyclic homology of central extensions of preprojective
  algebras of ADE quivers","["Eu, Ching-Hwa"]",2012-04-13T14:23:59
1065149,"["oai:arxiv.org:math\/0110287"]",,"mm-Spaces and group actions","["Pestov, Vladimir"]",2012-04-13T14:23:37
17205926,"["oai:citeseerx.psu:10.1.1.749.5482","oai:www.research.unipd.it:11577\/3268189","oai:arxiv.org:1406.4493"]",10.3934/era.2015.22.55,"Global Kolmogorov tori in the planetary N-body problem. Announcement of
  result","["Pinzari, Gabriella"]",2014-10-24T19:27:14
736859,"["oai:arxiv.org:1101.1990","oai:ora.ox.ac.uk:uuid:323a770c-0adc-4227-a8a8-dd623ad7d971"]",10.2298/pim1205095b,"Reflections on Dubinskii's nonlinear compact embedding theorem","["Barrett, John W.","S\u00fcli, Endre"]",2012-04-13T14:18:34
39561381,"["info:doi\/10.1002%2fsce.20431","oai:digitalcommons.georgefox.edu:lang_fac-1021"]",10.1002/sce.20431,"Who Wants to Have a Career in Science or Math? Exploring Adolescents’ Future Aspirations by Gender and Race/Ethnicity","["Moore, Chelsea","Ramos-Wada, Aida","Riegle-Crumb, Catherine"]",2017-04-12T16:23:41
39762333,"["oai:digitalcommons.library.tmc.edu:childrenatrisk-1304"]",,"Extending an Effective Classroom-Based Math Board Game Intervention to Preschoolers’ Homes","["Dowling, Rebecca","Gay, Brittany","Metzger, Shari R","Simons, Cassandra L","Sonnenschein, Susan"]",2017-04-13T17:11:10
1096001,"["oai:citeseerx.psu:10.1.1.239.6796","oai:arxiv.org:math\/0703426"]",10.1515/crelle.2009.042,"Kolyvagin systems of Stark units","["Benedict","Krasner Marc","K\u00e2zim B\u00fcy\u00fckboduk","Mazur Barry","Perrin-Riou Bernadette","Rubin Karl","Solomon David"]",2012-04-13T14:24:04
18068936,"["oai:arxiv.org:1505.07134"]",,"New Laplace transforms for the generalized hypergeometric functions 2F2
  and 3F3","["Rathie, Arjun K.","Wang, Xiaoxia"]",2015-09-24T00:26:31
58965423,"["oai:arxiv.org:1904.02986"]",,"Pointwise approximation of functions by matrix operators of their
  Fourier series with $r$- differences of the entries","["Lenski, Wlodzimierz","Szal, Bogdan"]",2019-06-02T02:00:58
39857075,"["oai:harvest.issuelab.org:26423"]",,"Integrating Mathematical Thinking Into Family Engagement Programs","["Barbara Harris","Dana Petersen"]",2017-04-14T05:29:31
564252,"["oai:arxiv.org:0709.1905"]",10.1016/j.jalgebra.2008.02.019,"On the lower central series of an associative algebra","["Cuntz","Etingof","Feigin","Feigin","Fuks","Fulton","Galyna Dobrovolska","John Kim","Loday","Xiaoguang Ma"]",2012-04-13T14:15:58
729973,"["oai:arxiv.org:1011.3882","oai:citeseerx.psu:10.1.1.752.7226"]",,"Embedding a Forest in a Graph","["Goldberg, Mark","Magdon-Ismail, Malik"]",2012-04-13T14:18:26
756855,"["oai:arxiv.org:1105.2401"]",,"Nieto-Lopez theorems in ordered metric spaces","["Turinici, Mihai"]",2012-04-13T14:18:52
1097541,"["oai:arxiv.org:math\/9603202"]",,"Errata for Geometric Function Theory in Several Complex Variables","["Noguchi, J.","Ochiai, T."]",2012-04-13T14:24:06
66743044,"["oai:scholarworks.sfasu.edu:jma-1051"]",,"Effects of Movement, Growth Mindset and Math Talks on Math Anxiety","["Ewing, Jim","Peterman, Christina J"]",2019-10-16T19:59:12
4240937,"["oai:arxiv.org:1209.2097"]",,"Semantic web applications with regard to math and environment","["Kutz, Nadja"]",2012-09-13T13:50:47
549295,"["oai:arxiv.org:0705.3450"]",,"The symplectic geometry of cotangent bundles from a categorical
  viewpoint","["Fukaya, Kenji","Seidel, Paul","Smith, Ivan"]",2012-04-13T14:15:44
17016549,"["oai:arxiv.org:1210.1447"]",10.1063/1.4772533,"Comment on: "On the consistency of solutions of the space fractional
  Schr\"odinger equation"","["Hawkins, E.","Schwarz, J. M."]",2014-10-23T17:19:33
24769772,"["oai:arxiv.org:1603.03156"]",,"Finite groups whose non-linear irreducible characters of the same degree
  are Galois conjugate","["Dolfi, Silvio","Yadav, Manoj K."]",2016-08-03T02:49:37
37684636,"["oai:deepblue.lib.umich.edu:2027.42\/111676"]",,Tellings,"["Monahan, Math"]",2016-12-20T18:32:24
8682251,"["oai:pure.atira.dk:publications\/c28e349f-4993-46b4-b145-a7607842dca9"]",,"The human rights/multinationals problematic: values, values and values.:Does the Quality of science matter?","["Noortmann, Math"]",2021-04-13T02:01:27
34299176,"["oai:dspace.ut.ee:10062\/62158"]",,"A method of rapid curriculum development for foreign language teaching","["Bullerman, Math"]",2019-02-21T10:43:29
1059106,"["oai:arxiv.org:math-ph\/0605059","oai:citeseerx.psu:10.1.1.340.6927","oai:iris.unige.it:11567\/230255"]",10.1142/s0219887806001818,"General Relativity as a constrained Gauge Theory","["Bruno, D.","Cianci, R.","Vignolo, S."]",2012-04-13T14:23:32
36999903,"["oai:harvest.issuelab.org:14424"]",,"Math and Science Reform",[],2016-11-21T19:16:23
576852,"["oai:arxiv.org:0712.2484"]",,"Asymptotic Stability of the Stationary Solution for a Hyperbolic Free
  Boundary Problem Modeling Tumor Growth","["Cui, Shangbin"]",2012-04-13T14:16:09
39559482,"["oai:scholarscompass.vcu.edu:merc_pubs-1061"]",,"Reading and Math Interventions at the Secondary Level:  A Research Brief","["Lester, Ashlee","Naff, David"]",2017-04-12T17:10:55
1095470,"["oai:arxiv.org:math\/0702634"]",10.1214/009053606000000623,"Discussion paper. Conditional growth charts","["He, Xuming","Wei, Ying"]",2012-04-13T14:24:04
8680961,"["oai:pure.atira.dk:publications\/db84d64e-adde-4558-b61f-52b9891c3728"]",,Preface,"["Noortmann, Math"]",2021-03-11T03:15:56
19169845,"["info:doi\/10.5703%2f1288284316393","oai:docs.lib.purdue.edu:jpur-1269"]",10.5703/1288284316393,"Fang and Feather: The Origin of Avian-Serpent Imagery at Teotihuacan and Symbolic Interaction With Jaguar Iconography in Mesoamerica","["Math, Kathryn"]",2017-11-20T18:48:20
691653,"["oai:ria.ua.pt:10773\/4068","oai:arxiv.org:1003.4772"]",10.7153/mia-14-23,"Inequalities and majorisations for the Riemann-Stieltjes integral on
  time scales","["Mozyrska, Dorota","Pawluszewicz, Ewa","Torres, Delfim F. M."]",2012-04-13T14:17:51
37633832,"["oai:pure.atira.dk:publications\/39bcb6a7-d369-43e4-ae30-43c65c490c8a","oai:arxiv.org:1610.06210","oai:pure.atira.dk:openaire_cris_publications\/39bcb6a7-d369-43e4-ae30-43c65c490c8a"]",10.18653/v1/d16-1168,"A Theme-Rewriting Approach for Generating Algebra Word Problems","["Hajishirzi, Hannaneh","Koncel-Kedziorski, Rik","Konstas, Ioannis","Zettlemoyer, Luke"]",2016-12-01T20:58:05
62532861,"["oai:scholarscompass.vcu.edu:jmsce_vamsc-1229"]",,"Reaching DEEP in Math (Developing Educational Excellence and Proficiency in Mathematics)","["Anderson, R. D."]",2019-07-09T15:38:29
44764974,"["oai:digitalcommons.liberty.edu:honors-2030"]",,"Using Preschool to Close the Socioeconomic Math Achievement Gap","["King, Sydney"]",2020-05-15T10:44:23
1073072,"["oai:arxiv.org:math\/0311131"]",,"On the error term in Duke's estimate for the average special value of
  L-functions","["Ellenberg, Jordan S."]",2012-04-13T14:23:44
18059364,"["oai:arxiv.org:1504.04598"]",,"Ultrametric fixed points in reduced axiomatic systems","["Turinici, Mihai"]",2015-09-24T00:10:50
4355607,"["oai:citeseerx.psu:10.1.1.427.813","oai:openaccess.city.ac.uk:1912"]",10.1016/s0022-4049(01)00143-8,"Quillen stratification for block varieties","["Alperin","Alperin","Avrunin","Benson","Benson","Brou\u00e9","Brou\u00e9","Carlson","Cartan","Evens","Linckelmann","Linckelmann","Linckelmann","Linckelmann","Markus Linckelmann","Puig","Puig","Quillen","Quillen","Th\u00e9venaz"]",2012-12-13T04:53:09
718823,"["oai:arxiv.org:1009.2593"]",,"Remarks on the Sequential Products","["Junde, Wu","Weihua, Liu","Zhaoqi, Wu"]",2012-04-13T14:18:15
18069179,"["oai:arxiv.org:1505.08155"]",10.1007/978-3-319-20615-8_16,"Performance Evaluation and Optimization of Math-Similarity Search","["C Spearman","D Hawking","J Bar-Ilan","L Vaughan","M Kendall","Q Zhang","R Fagin","W Hartmann"]",2015-09-24T00:27:46
17227784,"["oai:eprints.lancs.ac.uk:78198","oai:centre-mersenne.org:crmath_2016__354_5_459_0","oai:arxiv.org:1409.8203","oai:numdam.org:crmath_2016__354_5_459_0","info:doi\/10.1016%2fj.crma.2015.12.020"]",10.1016/j.crma.2015.12.020,"Splittings of extensions and homological bidimension of the algebra of
  bounded operators on a Banach space","["Laustsen, Niels Jakob","Skillicorn, Richard"]",2014-10-24T19:29:48
2417211,"["oai:arxiv.org:1206.4025","oai:hal:hal-01111570v1"]",10.7900/jot.2012jul02.1947,"Elementary Proofs of Grothendieck Theorems for Completely Bounded Norms","["Regev, Oded","Vidick, Thomas"]",2012-06-28T20:38:51
36987829,"["oai:harvest.issuelab.org:1065"]",,"The Evaluation of Enhanced Academic Instruction in After-School Programs: Findings After the First Year of Implementation","["Alison Rebeck Black","Fred Doolittle","Jean Baldwin Grossman","Pei Zhu","Rebecca Unterman"]",2016-11-21T19:08:10
1089347,"["oai:citeseerx.psu:10.1.1.237.4505","oai:arxiv.org:math\/0606269"]",,"Igusa and Denef-Sperber Conjectures on nondegenerate p-adic exponential
  sums","["Cluckers, R."]",2012-04-13T14:23:58
1147579,"["oai:arxiv.org:quant-ph\/0603096","oai:cds.cern.ch:935313","oai:citeseerx.psu:10.1.1.251.9461"]",,"Comment on ``On Existence of a Biorthonormal Basis Composed of
  Eigenvectors of Non-Hermitian Operators [quant-ph/0603075]''","["Mostafazadeh, Ali"]",2012-04-13T14:24:56
24736655,"["oai:archive.wias-berlin.de:wias_mods_00003019","oai:oa.tib.eu:123456789\/3477","oai:arxiv.org:1510.03755"]",10.20347/wias.preprint.2164,"A temperature-dependent phase-field model for phase separation and
  damage","["Heinemann, C.","Kraus, C.","Rocca, E.","Rossi, R."]",2016-08-03T02:24:43
50728790,"["oai:scholarworks.uark.edu:oepreport-1050"]",,"What Does the NAEP Tell Us About Student Achievement in Arkansas?","["Barnett, Joshua H.","Ritter, Gary W."]",2018-04-18T08:13:12
40084756,"["oai:digitalcommons.linfield.edu:linfield_magazine-1061"]",,"Pitney Tackles Summer Math","["Davis, Laura"]",2018-01-01T02:06:38
85840026,"["oai:researchportal.port.ac.uk:publications\/3fd55bc5-70e2-4cc6-8ece-5439259053ef","oai:arxiv.org:2003.01193","oai:ruj.uj.edu.pl:item\/262998"]",10.1090/proc/15195,"Approximate modularity: Kalton's constant is not smaller than 3","["Gnacik, Michal","Guzik, Marcin","Kania, Tomasz"]",2020-05-20T19:54:58
43118508,"["oai:arxiv.org:1707.00305"]",,"Anticanonical modules of Segre products","["Ene, Viviana","Herzog, J\u00fcrgen","Stamate, Dumitru I."]",2017-07-23T18:36:06
1094148,"["oai:arxiv.org:math\/0612817"]",10.1214/088342306000000493,"Support Vector Machines with Applications","["Moguerza, Javier M.","Mu\u00f1oz, Alberto"]",2012-04-13T14:24:03
