"workID","oaiID","doi","title","authors","createdDate"
42865629,"["oai:arxiv.org:1705.04799"]",,"Quantum Cohomology under Birational Maps and Transitions","["Lee, Yuan-Pin","Lin, Hui-Wen","Wang, Chin-Lung"]",2017-06-19T02:41:04
625299,"["oai:arxiv.org:0812.2461"]",,"Uniqueness of contact Hamiltonians of topological strictly contact
  isotopies","["Banyaga, Augustin","Spaeth, Peter"]",2012-04-13T14:16:50
762757,"["oai:arxiv.org:1106.3351"]",10.1112/plms/pdr057,"The spine of a Fourier-Stieltjes algebra: corrigenda","["Ilie, Monica","Spronk, Nico"]",2012-04-13T14:18:58
17151286,"["oai:arxiv.org:1310.2787","oai:citeseerx.psu:10.1.1.740.4765"]",,"On the Leray-Hopf Extension Condition for the Steady-State Navier-Stokes
  Problem in Multiply-Connected Bounded Domains","["Galdi, Giovanni P."]",2014-10-24T19:21:36
42852289,"["oai:arxiv.org:1703.09478"]",,"On a problem of Bharanedhar and Ponnusamy involving planar harmonic
  mappings","["Liu, Zhi-Hong","Rasila, Antti","Sun, Yong","Wang, Zhi-Gang"]",2017-06-19T02:28:45
633927,"["oai:citeseerx.psu:10.1.1.247.9116","oai:arxiv.org:0902.4266"]",10.1007/s10468-011-9268-4,"Relations between O(n)-invariants of several matrices","["Lopatin, A. A."]",2012-04-13T14:16:59
563530,"["oai:arxiv.org:0709.1032"]",10.1142/s0129055x08003468,"Weyl asymptotics for magnetic Schr\"odinger operators and de Gennes'
  boundary condition","["AYMAN KACHMAR","Bonnaillie V.","de Gennes P. G.","Helffer B.","Kachmar A.","Kachmar A.","Kachmar A.","Reed M.","Tamura H.","Truc F."]",2012-04-13T14:15:57
17044038,"["oai:arxiv.org:1303.0508"]",,"An application of Miller and Mocanu lemma","["Owa, Shigeyoshi","Shiraishi, Hitoshi"]",2014-10-23T17:22:49
42847547,"["oai:arxiv.org:1703.03554"]",,"Commutator Estimates for the Dirichlet-to-Neumann Map of Stokes Systems
  in Lipschitz Domains","["Xu, Qiang","Zhao, Weiren","Zhou, Shulin"]",2017-06-19T02:24:19
2350593,"["oai:ecommons.cornell.edu:1813\/77119","oai:digitalcommons.ilr.cornell.edu:cahrswp-1254","oai:citeseerx.psu:10.1.1.671.7317"]",,"The Impact of Curriculum-Based Examinations on Learning in Canadian Secondary Schools","["Bishop, John  H."]",2012-06-26T11:09:35
1069314,"["oai:arxiv.org:math\/0212273"]",,"Lower Order Terms in Szego Theorems on Zoll Manifolds","["Gioev, Dimitri"]",2012-04-13T14:23:40
1087624,"["oai:arxiv.org:math\/0603501"]",,"Stability of Derivations on Hilbert $C^*$-Modules","["amyari, M.","Moslehian, M. S."]",2012-04-13T14:23:57
1082888,"["oai:arxiv.org:math\/0507212","oai:citeseerx.psu:10.1.1.236.7835"]",10.1007/s00209-006-0093-0,"Stein structures and holomorphic mappings","["A. Andreotti","A. Newlander","A. Phillips","A. Weinstein","E. Bishop","E.L. Stout","F. Forstneri\u010d","F. Forstneri\u010d","F. Forstneri\u010d","F. Forstneri\u010d","F. Forstneri\u010d","F. Forstneri\u010d","F. Forstneri\u010d","F. Forstneri\u010d","F. Forstneri\u010d","Franc Forstneri\u010d","H. Grauert","H. Grauert","H. Grauert","H. Grauert","H. Whitney","H.F. Lai","J. Milnor","J.-P. Rosay","J.E. Forn\u00e6ss","K. Oka","M. Freedman","M. Gromov","M. Gromov","M. Gromov","M. Hirsch","M. Slapar","Marko Slapar","O. Forster","P. Lisca","P. Ozsv\u00e1th","P.B. Kronheimer","R.C. Gunning","R.E. Gompf","S. Smale","S. Webster","S.S. Chern","V. Arnol\u2019d","Y. Eliashberg","Y. Eliashberg","Y. Eliashberg"]",2012-04-13T14:23:52
48202218,"["info:doi\/10.4169%2fmathhorizons.22.4.26","oai:cupola.gettysburg.edu:mathfac-1042"]",10.4169/mathhorizons.22.4.26,"Math Quiz on the Radio","["Glass, Darren B."]",2018-02-11T15:19:11
17024785,"["oai:arxiv.org:1211.4611"]",10.1137/120868943,"A variational approach for continuous supply chain networks","["Friesz, Terry L.","Han, Ke","Yao, Tao"]",2014-10-23T17:20:32
563461,"["oai:arxiv.org:0709.1228"]",,"Koszul duality for Operads","["Ginzburg, Victor","Kapranov, Mikhail"]",2012-04-13T14:15:57
42869347,"["oai:arxiv.org:1705.09475"]",,"An update on non-Hamiltonian $\frac{5}{4}$-tough maximal planar graphs","["Kabela, Adam"]",2017-06-19T02:44:31
17027527,"["info:doi\/10.1016%2fj.disc.2013.03.011","oai:arxiv.org:1212.4816","oai:art.torvergata.it:2108\/89933"]",10.1016/j.disc.2013.03.011,"Determinants of grids, tori, cylinders and M\"{o}bius ladders","["Bibak, Khodakhast","Tauraso, Roberto"]",2014-10-23T17:21:12
617604,"["oai:doaj.org\/article:425342b7843a4a3caf744eb7c65c6bb5","oai:www.producao.usp.br:bdpi\/16694","oai:arxiv.org:0810.3458","oai:agregador.ibict.br.ri_usp:oai:www.producao.usp.br:bdpi\/16694","oai:dspace.nbuv.gov.ua:123456789\/149179","oai:citeseerx.psu:10.1.1.243.4705","oai:citeseerx.psu:10.1.1.169.9955"]",10.3842/sigma.2009.026,"Induced Modules for Affine Lie Algebras","["Futorny, Vyacheslav","Kashuba, Iryna"]",2012-04-13T14:16:43
24734962,"["oai:arxiv.org:1510.05844"]",,"Strongly regular sequences and proximate orders","["Jim\u00e9nez-Garrido, Javier","Sanz, Javier"]",2016-08-03T02:25:37
1103968,"["oai:epub.uni-regensburg.de:1478","oai:arxiv.org:nlin\/0303053"]",10.1088/0305-4470/36/30/101,"Leading off-diagonal contribution to the spectral form factor of chaotic
  quantum systems","["Argaman N","Berry M V","Bogomolny E","Bohigas O","Brack M","Braun P A","Creagh S C","Foxman J A","Gaspard P","Gutzwiller M C","Haake F","Klaus Richter","Marko Turek","Nagao T","Pandey A","Parry W","Primack H","Richter K","Sieber M","Sieber M","St\u00f6ckmann H-J","Tanner G","Turek M"]",2012-04-13T14:24:18
17150207,"["oai:citeseerx.psu:10.1.1.755.6947","oai:arxiv.org:1309.6528"]",,"On derived categories of K3 surfaces, symplectic automorphisms and the
  Conway group","["Huybrechts, Daniel"]",2014-10-24T19:21:15
85931171,"["oai:arxiv.org:2005.11152"]",,"On some results of S. Abramyan and T. Panov","["Skopenkov, A."]",2020-05-25T11:56:02
4654023,"["oai:eprints.uny.ac.id:1335","oai:eprints.uny.ac.id:1014"]",,"On The Teaching Of Analyzing The Effects Of Parameter Changes 

On The Graph Of Function","["Darmawan, Darmawan","Iwan , Pranoto"]",2013-07-08T16:50:06
2541551,[],,"Are Immigrants Graded Worse in Primary and Secondary Education? – Evidence for German Schools","["David Kiss"]",2012-07-06T03:44:15
1071208,"["oai:citeseerx.psu:10.1.1.234.2338","oai:citeseerx.psu:10.1.1.235.1058","oai:arxiv.org:math\/0308183","oai:hal:hal-01011006v1","oai:dipot.ulb.ac.be:2013\/128279","oai:citeseerx.psu:10.1.1.234.1341"]",10.2140/gt.2003.7.799,"Compactness results in Symplectic Field Theory","["Bourgeois, F","Eliashberg, Y","Hofer, H","Wysocki, K","Zehnder, E"]",2012-04-13T14:23:43
1074254,"["oai:arxiv.org:math\/0402022"]",,"Families of Hopf algebras of trees and pre-Lie algebras","["Moerdijk, Ieke","van der Laan, Pepijn"]",2012-04-13T14:23:45
24811782,"["oai:arxiv.org:1606.09511","oai:citeseerx.psu:10.1.1.766.8336"]",,"Corrigendum to "On injective modules and support varieties for the small
  quantum group"","["Drupieski, Christopher M."]",2016-08-03T03:10:22
17213840,"["oai:arxiv.org:1407.6641"]",10.1063/1.4900926,"Classification of constraints and degrees of freedom for quadratic
  discrete actions","["Hoehn, Philipp A."]",2014-10-24T19:28:11
1066226,"["oai:arxiv.org:math\/0203085"]",,"Projections in normed linear spaces and sufficient enlargements","["Ostrovskii, M. I."]",2012-04-13T14:23:38
1059578,"["oai:arxiv.org:math-ph\/0610074"]",10.1063/1.2712418,"Independent electrons model for open quantum systems: Landauer-Buettiker
  formula and strict positivity of the entropy production","["Amrein W. O.","Gheorghe Nenciu","Goldberger M. L.","Reed M.","Yafaev D."]",2012-04-13T14:23:32
58975565,"["oai:arxiv.org:1905.02802","oai:air.unimi.it:2434\/705667"]",10.1063/1.5080434,"W-Symmetries of Ito stochastic differential equations","["Gaeta, Giuseppe"]",2019-06-02T02:03:07
24803931,"["oai:research.vu.nl:publications\/48ad79b1-0447-4b39-bd18-86176d6836cd","oai:arxiv.org:1605.09322","info:doi\/10.1007%2fs11784-016-0351-7"]",10.1007/s11784-016-0351-7,"Symplectomorphisms and discrete braid invariants","["Czechowski, Aleksander","Vandervorst, Robert"]",2016-08-03T03:04:24
1090186,"["oai:citeseerx.psu:10.1.1.385.6354","oai:hal:hal-00087321v1","oai:arxiv.org:math\/0607573","oai:basepub.dauphine.fr:123456789\/338"]",10.1137/050625175,"Solving the Boltzmann equation in N log N","["Bird G.","Bobylev A.","Bobylev Alexandre","Bobyl\u00ebv A.","Cl\u00e9ment Mouhot","Ellis R. S.","Francis Filbet","Lorenzo Pareschi","Martin Yves\u2010Lo\u00efc","Nanbu K."]",2012-04-13T14:23:59
17026422,"["oai:arxiv.org:1211.7194"]",,"Impossible? Publication Quality Research with the Weakest 10% of
  Incoming Freshmen","["Courtney, Amy","Courtney, Michael"]",2014-10-23T17:20:46
24776159,"["oai:arxiv.org:1603.09159"]",,"Relation-theoretic metrical coincidence theorems","["Alam, Aftab","Imdad, Mohammad"]",2016-08-03T02:53:18
62532650,"["oai:scholarscompass.vcu.edu:jmsce_vamsc-1070"]",,"Curriculum Restructuring at Lynchburg College: Effects of Realignment to State-Mandated Competencies and Implications for K-6 Math and Science Teacher Preparation","["McKenzie, W.","Messerschmidt, C."]",2019-07-09T15:38:27
709054,"["oai:arxiv.org:1007.1575"]",,"Metric properties of the set of orthogonal projections and their
  applications to operator perturbation theory","["Makarov, Konstantin A.","Seelmann, Albrecht"]",2012-04-13T14:18:05
551678,"["oai:citeseerx.psu:10.1.1.247.5981","oai:arxiv.org:math-ph\/0612078","oai:arxiv.org:0706.0814"]",10.1088/1751-8113/40/33/009,"New conditional symmetries and exact solutions of nonlinear
  reaction-diffusion-convection equations. II","["Ames W F","Arrigo D J","Bluman G W","Cherniha R","Cherniha R Pliukhin O","Cherniha R Serov M","Dixon J M","Fitzhugh R","Fushchych W I","Fushchych W I","Fushchych W I","Gandarias M L","Kamke E","Kolmogoroff A","Levi D","Murray J D","Murray J D","Nucci M C","Oleksii Pliukhin","Oliveira-Pinto F","Ovsiannikov L V","Polyanin A D","Pucci E","Roman Cherniha","Saccomandi G"]",2012-04-13T14:15:46
682360,"["oai:arxiv.org:1001.3752"]",,"Bipartite $S_2$ graphs are Cohen-Macaulay","["Haghighi, Hassan","Yassemi, Siamak","Zaare-Nahandi, Rahim"]",2012-04-13T14:17:42
1132359,"["oai:arxiv.org:physics\/9803033","oai:cds.cern.ch:351218"]",10.1063/1.531985,"Comment on: Diffusion through a slab","["J. G. Kirk","McCormick N. J.","U. D. J. Gieseler"]",2012-04-13T14:24:42
8866894,"["oai:philpapers.org\/rec\/stenpo-7"]",,"Nietzsche’s Philosophy of Mathematics","["Steinhart, Eric"]",2020-03-11T10:24:46
809227,"["info:doi\/10.1016%2fj.amc.2012.08.028","oai:arxiv.org:1202.2682"]",10.1016/j.amc.2012.08.028,"Construction and separability of nonlinear soliton integrable couplings","["Blaszak, Maciej","Silindir, Burcu","Szablikowski, Blazej M."]",2012-04-13T14:19:40
36984069,"["oai:harvest.issuelab.org:4113"]",,"Gender Differences in K-12 Education: What Indicators Are Important?","["Kathleen C. Basile"]",2016-11-21T19:09:20
1077477,"["oai:arxiv.org:math\/0410432","oai:citeseerx.psu:10.1.1.238.213","oai:citeseerx.psu:10.1.1.237.2489","oai:citeseerx.psu:10.1.1.236.3116"]",10.1007/s00208-005-0649-z,"On projective varieties with nef anticanonical divisors","["Zhang, Qi"]",2012-04-13T14:23:48
24732480,"["oai:hal:hal-01208479v1","oai:arxiv.org:1510.01119"]",,"Amplitude equations for weakly nonlinear surface waves in variational
  problems","["Benzoni-Gavage, Sylvie","Coulombel, Jean-Fran\u00e7ois"]",2016-08-03T02:23:18
1069430,"["oai:arxiv.org:math\/0301177"]",,"Hyperelliptic jacobians without complex multiplication and Steinberg
  representations in positive characteristic","["Zarhin, Yuri G."]",2012-04-13T14:23:41
85939315,"["oai:archive.ugent.be:8661933"]",10.1037/edu0000444,"How can the blow of math difficulty on elementary school children’s motivational, cognitive, and affective experiences be dampened? : The critical role of autonomy-supportive instructions","["Baten, Elke","De Muynck, Gert-Jan","De Poortere, Eline","Desoete, Annemie","Vansteenkiste, Maarten"]",2020-05-14T16:09:12
1079926,"["oai:citeseerx.psu:10.1.1.235.8336","oai:arxiv.org:math\/0501461"]",,"Homogeneous Solutions to Fully Nonlinear Elliptic Equations","["Nadirashvili, Nikolai","Yuan, Yu"]",2012-04-13T14:23:50
41665495,"["oai:fisherpub.sjf.edu:math_facpub-1019","oai:fisherpub.sjfc.edu:math_facpub-1019"]",,"Coming Out of the Dungeon: Mathematics and Role-Playing Games","["Green, Kris H"]",2019-07-09T11:11:51
42873299,"["oai:arxiv.org:1706.03344"]",,"Large time behavior of a generalized Oseen evolution operator, with
  applications to the Navier-Stokes flow past a rotating obstacle","["Hishida, Toshiaki"]",2017-06-19T02:48:16
1080186,"["oai:cds.cern.ch:823722","oai:arxiv.org:math\/0502389"]",,"Kolmogorov-Sinai entropy of a generalized Markov shift","["Werner, Ivan"]",2012-04-13T14:23:50
544329,"["oai:arxiv.org:1610.01557","oai:cds.cern.ch:2223104","oai:inspirehep.net:1489663","oai:arxiv.org:0704.3099"]",,"Elliptic hypergeometric functions","["Spiridonov, V. P."]",2012-04-13T14:15:40
18064638,"["oai:arxiv.org:1505.02798","oai:citeseerx.psu:10.1.1.719.4880"]",,"Math Search for the Masses: Multimodal Search Interfaces and
  Appearance-Based Retrieval","["Orakwue, Awelemdy","Zanibbi, Richard"]",2015-09-24T00:22:08
42848638,"["oai:arxiv.org:1703.04931","oai:dspace.nbuv.gov.ua:123456789\/148581"]",10.3842/sigma.2017.016,"Some Open Problems in Random Matrix Theory and the Theory of Integrable
  Systems. II","["Deift, Percy"]",2017-06-19T02:25:17
36994056,"["oai:harvest.issuelab.org:11762"]",,"Are Boys Making the Grade? Gender Gaps in Achievement and Attainment",[],2016-11-21T19:13:25
570596,"["oai:arxiv.org:0710.4853"]",10.1007/s00220-008-0462-0,"Erratum: Propagation Effects on the Breakdown of a Linear Amplifier
  Model: Complex-Mass Schrodinger Equation Driven by the Square of a Gaussian
  Field","["Collet, Pierre","Lebowitz, Joel L.","Mounaix, Philippe"]",2012-04-13T14:16:04
63664091,"["oai:digitalcommons.ilr.cornell.edu:buffalocommons-1351","oai:ecommons.cornell.edu:1813\/73468"]",,"A Profile of Third-Grade Proficiency in Erie County","["United Way of Buffalo & Erie County on behalf of the Erie\/Niagara Birth to 8 Coalition"]",2019-07-10T01:09:21
672429,"["oai:citeseerx.psu:10.1.1.749.65","oai:arxiv.org:0911.1283"]",,"On multilinear determinant functionals","["Gressman, Philip T."]",2012-04-13T14:17:32
17231750,"["oai:arxiv.org:1410.3948"]",,"Uniform asymptotics for discrete orthogonal polynomials on infinite
  nodes with an accumulation point","["Lin, Yu","Wu, Xiao-Bo","Xu, Shuai-Xia","Zhao, Yu-Qiu"]",2014-10-24T19:30:13
17225813,"["oai:arxiv.org:1409.5174"]",10.1016/j.bulsci.2015.08.003,"On the three-dimensional magnetohydrodynamics system in
  scaling-invariant spaces","["Yamazaki, Kazuo"]",2014-10-24T19:29:32
17021858,"["oai:arxiv.org:1211.0414","oai:citeseerx.psu:10.1.1.703.3589"]",,"Convergence of nonlinear semigroups under nonpositive curvature","["Bacak, Miroslav"]",2014-10-23T17:20:12
17031817,"["oai:citeseerx.psu:10.1.1.764.9022","oai:arxiv.org:1301.0102"]",,"Ricci-flat graphs with girth at least five","["Lin, Yong","Lu, Linyuan","Yau, S. -T."]",2014-10-23T17:21:25
40084892,"["oai:digitalcommons.linfield.edu:linfield_magazine-1132"]",,"Students Investigate Bat Wings and Caterpillars","["Thompson, Beth Rogers"]",2018-01-01T02:06:43
646993,"["oai:arxiv.org:0905.3485"]",10.1112/blms/bdp025,"Rigidity of Mori cone for Fano manifolds","["Wisniewski, Jaroslaw A."]",2012-04-13T14:17:10
1059195,"["oai:arxiv.org:math-ph\/0604057"]",10.1007/s11071-006-9104-2,"Conservation Laws of Multidimensional Diffusion-Convection Equations","["Ivanova, Nataliya M."]",2012-04-13T14:23:31
692260,"["oai:arxiv.org:1003.4420","oai:ri.conicet.gov.ar:11336\/186533","oai:dspace.mit.edu:1721.1\/115838"]",10.1063/1.3397419,"Irreducible modules over finite simple Lie conformal superalgebras of
  type K","["Carina Boyallian","Jos\u00e9 I. Liberati","Kac V. G.","Rudakov A.","Rumin M.","Victor G. Kac"]",2012-04-13T14:17:51
24747862,"["oai:arxiv.org:1512.00348"]",,"Nonlinear contractions in metric spaces under locally T-transitive
  binary relations","["Alam, Aftab","Imdad, Mohammad"]",2016-08-03T02:32:54
54177224,"["oai:arxiv.org:1812.00362"]",,"Relative \v{C}ech-Dolbeault homology and applications","["Tardini, Nicoletta"]",2019-02-06T06:49:15
37630918,"["oai:arxiv.org:1610.03546","oai:edpsciences.org:dkey\/10.1209\/0295-5075\/116\/41001"]",10.1209/0295-5075/116/41001,"Classical and \textcolor{blue}{Quantum} Field-Theoretical approach to
  the non-linear q-Klein-Gordon Equation","["Plastino, A.","Rocca, M. C."]",2016-12-01T20:57:41
17223554,"["info:doi\/10.1016%2fj.jfa.2015.02.011","oai:iris.uniroma1.it:11573\/1117405","oai:arxiv.org:1409.2320","oai:iris.unipv.it:11571\/1218679"]",10.1016/j.jfa.2015.02.011,"Improved estimate of the singular set of Dir-minimizing Q-valued
  functions via an abstract regularity result","["Focardi, Matteo","Marchese, Andrea","Spadaro, Emanuele"]",2014-10-24T19:29:16
1073307,"["oai:arxiv.org:math\/0311339"]",10.1215/s0012-7094-04-12523-0,"A geometric Jacquet functor","["Emerton, Matthew","Nadler, David","Vilonen, Kari"]",2012-04-13T14:23:44
721122,"["oai:arxiv.org:1009.0705"]",,"On comparison theorems for elliptic inequalities","["Kon'kov, Andrej A."]",2012-04-13T14:18:14
18056576,"["oai:arxiv.org:1504.00878"]",10.1063/1.4916895,"Integrable semi-discretization of a multi-component short pulse equation","["Feng, Bao-Feng","Maruno, Ken-ichi","Ohta, Yasuhiro"]",2015-09-24T00:09:29
722952,"["oai:arxiv.org:1010.0870"]",10.1007/s11232-011-0024-z,"Ambiguity-free formulation of the Higgs-Kibble model","["Quadri, A.","Slavnov, A. A."]",2012-04-13T14:18:19
1056268,"["oai:arxiv.org:math-ph\/0207022"]",,"Exactly solvable periodic Darboux q-chains","["Dynnikov, Ivan A.","Smirnov, Sergey V."]",2012-04-13T14:23:28
2403940,"["oai:arxiv.org:1205.2899"]",,"Some toy Furstenberg sets and projections of the four-corner Cantor set","["Oberlin, Daniel M."]",2012-06-28T20:38:37
214769,"["oai:eprints.bbk.ac.uk.oai2:392"]",10.1007/s11075-006-9024-8,"Interpolation with circular basis functions","["Hubbert, Simon","Muller, S."]",2012-06-22T02:56:41
18086473,"["oai:arxiv.org:1508.03460"]",10.1016/j.jmaa.2015.11.009,"Borwein-Preiss Variational Principle Revisited","["Kruger, A. Y.","Plubtieng, S.","Seangwattana, T."]",2015-09-24T01:34:34
17138386,"["oai:arxiv.org:1307.6151","oai:ruj.uj.edu.pl:item\/262","oai:acta.bibl.u-szeged.hu:32907"]",,"Framings and dilations","["Larson, David R.","Szafraniec, Franciszek Hugon"]",2014-10-24T19:19:57
17012821,"["oai:arxiv.org:1209.3751"]",,"Basis problem for analytic multiple gaps","["Avil\u00e9s, Antonio","Todorcevic, Stevo"]",2014-10-23T17:19:09
19109807,"["oai:repository.upenn.edu:gse_pubs-1577"]",,"Responsive Math Teaching Model","["Responsive Math Teaching Project"]",2021-04-08T01:51:11
125022966,"["oai:publikationen.ub.uni-frankfurt.de:31346"]",,"Refactoring the UrQMD model for many-core architectures","["Gerhard, Jochen (Dipl.-Math.)"]",2013-08-27T18:05:26
1099358,"["oai:arxiv.org:math\/9903019"]",,"Proof of a partition identity conjectured by Lassalle","["Eisenk\u00f6lbl, Theresia"]",2012-04-13T14:24:08
1050136,"["oai:cds.cern.ch:347574","oai:citeseerx.psu:10.1.1.265.7808","oai:citeseerx.psu:10.1.1.265.7752","oai:arxiv.org:hep-th\/9803006"]",10.1063/1.532944,"Hyperbolic Kac-Moody Algebra from Intersecting p-branes","["Bronnikov K. A.","Bronnikov K. A.","Ivashchuk V. D.","Ivashchuk V. D.","Ivashchuk V. D.","Julia B.","S.-W. Kim","Tseytlin A. A.","V. D. Ivashchuk","V. N. Melnikov"]",2012-04-13T14:23:23
2529276,[],,"Detracking Swedish Secondary Schools - Any Losers, Any Winners?","["Sund, Krister"]",2012-07-06T03:43:43
1059944,"["oai:arxiv.org:math-ph\/9805025"]",,"Five-Dimensional Tangent Vectors in Space-Time: II.
  Differential-Geometric Approach","["Krasulin, Alexander"]",2012-04-13T14:23:32
1069609,"["oai:arxiv.org:math\/0301289"]",,"Errata to: Local contribution to the Lefschetz fixed point formula","["Goresky, Mark","MacPherson, Robert"]",2012-04-13T14:23:41
49548163,"["oai:arxiv.org:1802.01528"]",,"The Matrix Calculus You Need For Deep Learning","["Howard, Jeremy","Parr, Terence"]",2018-03-05T19:52:05
1066494,"["oai:arxiv.org:math\/0204083","oai:arxiv.org:math\/0207270"]",,"Classification of log Enriques surfaces with delta=2","["Kudryavtsev, Sergey"]",2012-04-13T14:23:38
781024,"["oai:arxiv.org:1109.6418"]",10.1088/1751-8113/44/42/428001,"Comment on `A general integral identity'","["Santos, Andr\u00e9s"]",2012-04-13T14:19:14
51500757,"["oai:arxiv.org:1805.04796"]",,"Two-numbers and their applications - A survey","["Chen, Bang-Yen"]",2018-06-16T12:28:55
957079,"["oai:cds.cern.ch:1017454","oai:arxiv.org:gr-qc\/0702102","oai:citeseerx.psu:10.1.1.341.1558"]",10.1063/1.2716204,"Tikekar superdense stars in electric fields","["Komathiraj, K.","Maharaj, S. D."]",2012-04-13T14:22:00
64850200,"["oai:pure.mpg.de:item_3086308"]",10.1007/s12220-018-0050-2,"On the lower bound of the inner radius of nodal domains","["Georgiev, B."]",2019-08-08T08:40:09
1066518,"["oai:arts.units.it:11368\/1693190","oai:citeseerx.psu:10.1.1.241.2789","oai:tsukuba.repo.nii.ac.jp:00017573","oai:citeseerx.psu:10.1.1.239.581","oai:arxiv.org:math\/0207019"]",10.21099/tkbjm/1496164569,"A remark on well-posedness for hyperbolic equations with singular
  coefficients","["Daniele Del","Martino Prizzi","Santo"]",2012-04-13T14:23:39
24768565,"["oai:arxiv.org:1603.01462"]",,"A new asymptotic expansion series for the constant pi","["Abrarov, S. M.","Quine, B. M."]",2016-08-03T02:48:36
1255477,"["oai:arxiv.org:cond-mat\/0011240","oai:deepblue.lib.umich.edu:2027.42\/77044"]",10.1143/jpsj.70.367,"Thermodynamics of osp(1|2) Integrable Spin Chain: Finite Size Correction","["Chen Chi-Tsong","Hairer Ernst","Scheeres C.A."]",2012-04-13T14:20:47
17169336,"["oai:hal:hal-01079286v1","oai:arxiv.org:1312.6266"]",10.1007/s00208-014-1103-x,"Compact homogeneous lcK manifolds are Vaisman","["Gauduchon, Paul","Moroianu, Andrei","Ornea, Liviu"]",2014-10-24T19:23:16
872938,"["oai:arxiv.org:chao-dyn\/9609008"]",,"An Invitation to Algorithmic Information Theory","["Chaitin, G. J."]",2012-04-13T14:20:42
17200014,"["oai:air.unimi.it:2434\/904500","info:doi\/10.1016%2fj.jmaa.2014.09.045","oai:arxiv.org:1406.0192","oai:iris.uniroma3.it:11590\/141748","oai:citeseerx.psu:10.1.1.749.6233"]",10.1016/j.jmaa.2014.09.045,"Quantization of quadratic Li\'enard-type equations by preserving Noether
  symmetries","["Gubbiotti, G.","Nucci, M. C."]",2014-10-24T19:26:50
4474311,"["oai:casi.ntrs.nasa.gov:19820015832"]",,"Wind energy system time-domain (WEST) analyzers","["Dreier, M. E.","Hoffman, J. A."]",2013-05-31T10:45:52
17193013,"["oai:arxiv.org:1404.3935"]",10.1088/0266-5611/30/10/105006,"Exact Reconstruction Formula for the Spherical Mean Radon Transform on
  Ellipsoids","["Haltmeier, M."]",2014-10-24T19:25:51
18091634,"["oai:arxiv.org:1509.04461"]",10.1007/s00208-015-1298-5,"On the nonvanishing of abstract Cauchy-Riemann cohomology groups","["Brinkschulte, Judith","Hill, C. Denson","Nacinovich, Mauro"]",2015-09-24T02:00:28
1100716,"["oai:citeseerx.psu:10.1.1.235.8193","oai:citeseerx.psu:10.1.1.236.7917","oai:arxiv.org:math\/9906167"]",,"Monstrous moonshine and the classification of CFT","["Gannon, Terry"]",2012-04-13T14:24:09
1059374,"["oai:arxiv.org:math-ph\/0610006","oai:citeseerx.psu:10.1.1.341.3332"]",10.1016/j.aml.2007.02.023,"Group Analysis of Nonlinear Fin Equations","["Johnpillai, A. G.","Popovych, R. O.","Sophocleous, C.","Vaneeva, O. O."]",2012-04-13T14:23:32
2465910,[],,"Factors affecting learning of Mexican primary school children","["Joan B. Anderson"]",2012-07-06T03:40:46
708947,"["oai:petit.lib.yamaguchi-u.ac.jp:g0000006y2j2:2013010618","oai:petit.lib.yamaguchi-u.ac.jp:g0000006y2j2:2013010617","oai:arxiv.org:1007.1525"]",10.1088/1751-8113/43/37/375201,"A direct method for solving the generalized sine-Gordon equation II","["Hirota R","Matsuno Y","Matsuno Y","Matsuno Y","Takhtadzhyan L A","Yoshimasa Matsuno"]",2012-04-13T14:18:05
47136100,"["oai:arxiv.org:1712.09391"]",,"Mapping to Declarative Knowledge for Word Problem Solving","["Roth, Dan","Roy, Subhro"]",2018-01-23T13:39:50
49552833,"["oai:arxiv.org:1802.07302"]",,"A translation of Y. Benoist's "Actions propres sur les espaces
  homog\`enes r\'eductifs"","["Smilga, Ilia"]",2018-03-05T19:53:08
1098936,"["oai:citeseerx.psu:10.1.1.240.9786","oai:citeseerx.psu:10.1.1.54.1154","oai:arxiv.org:math\/9807089"]",,"Orthonormal Compactly Supported Wavelets with Optimal Sobolev Regularity","["Ojanen, Harri"]",2012-04-13T14:24:07
132451582,"["oai:repositorio.iscte-iul.pt:10071\/2759","oai:citeseerx.psu:10.1.1.976.9363"]",,"Recent reforms in French and German family policies","["Fagnani, Jeanne","Math, Antoine"]",2017-11-02T01:30:55
47141060,"["oai:arxiv.org:1801.03192"]",10.1215/00127094-2018-0066,"Nonvanishing for threefolds in characteristic $p>5$","["Xu, Chenyang","Zhang, Lei"]",2018-01-23T13:41:36
1066382,"["oai:citeseerx.psu:10.1.1.240.5967","oai:arxiv.org:math\/0203246"]",10.1007/s00209-002-0467-x,"On the vanishing of higher syzygies of curves. II","["Aprodu, Marian"]",2012-04-13T14:23:38
62532573,"["oai:scholarscompass.vcu.edu:jmsce_vamsc-1024"]",,"College of San Mateo Mathematics and Science Teacher Education Program: A Bay Area Collaborative for Excellence in Teacher Preparation with San Jose State University and San Francisco State University","["Tonini, C."]",2019-07-09T15:38:27
17041228,"["oai:arxiv.org:1303.0235"]",,"Common fixed points for Banach-Caristi contractive pairs","["Turinici, Mihai"]",2014-10-23T17:22:47
17124903,"["oai:arxiv.org:1305.2618"]",,"On the Finite Dimensionality of Spaces of Absolutely Convergent Fourier
  Transforms","["Walther, Bj\u00f6rn G."]",2014-10-24T19:18:08
15206560,"["oai:citeseerx.psu:10.1.1.245.7056","oai:arxiv.org:0801.2895"]",10.1007/s00605-008-0556-y,"Remarks on Lempert functions of balanced domains","["Nikolov, Nikolai","Pflug, Peter"]",2012-04-13T14:16:11
1131552,"["oai:arxiv.org:physics\/9701010","oai:cds.cern.ch:304442","oai:citeseerx.psu:10.1.1.262.4915"]",,"On The Even CAR Algebra","["Binnenhei, Carsten"]",2012-04-13T14:24:41
