"workID","oaiID","doi","title","authors","createdDate"
674198,"["oai:arxiv.org:0911.5588"]",10.1111/j.1365-2966.2009.15765.x,"Spots structure and stratification of helium and silicon in the
  atmosphere of He-weak star HD 21699","["A. V. Shavrina","Abt","Alecian","Brown","Donati","Donati","G. A. Chuntonov","Gerth","Glagolevskij","Glagolevskij","Glagolevskij","Grevesse","J. Silvester","Khan","Kupka","Megessier","Molnar","Monin","Morgan","Osmer","Pavlenko","Pavlenko","Percy","Preston","Roman","Ryabchikova","Shore","Smith","Smith","Stateva","Tsymbal","V. R. Khalack","Vauclair","Vauclair","Vauclair","Wade","Ya. V. Pavlenko","Yu. V. Glagolevskij"]",2012-04-13T14:17:35
921440,"["oai:arxiv.org:cond-mat\/0610066"]",,"All-electron study of InAs and GaAs wurtzite: structural and electronic
  properties","["von Barth, Ulf","Zanolli, Zeila"]",2012-04-13T14:21:30
1053303,"["oai:arxiv.org:hep-th\/9903017","oai:cds.cern.ch:380597"]",10.1143/ptp.103.161,"Light-Cone Quantization of the Schwinger Model","["McCartor, Gary","Nakawaki, Yuji"]",2012-04-13T14:23:25
44593735,"["oai:arxiv.org:1708.07314"]",,"A novel TOF-PET MRI detector for diagnosis and follow up of the prostate
  cancer","["Beging, S.","Canese, R.","Carpinelli, G.","Clinthorne, N.","Colilli, S.","Finocchiaro, L. Cosentino P.","Garibaldi, F.","Giuliani, F.","Gricia, M.","Lucentini, M.","Majewski, S.","Monno, E.","Musico, P.","Santavenere, F.","T\u00f6dter, J.","Wegener, H.","Ziemons, K."]",2017-10-17T02:37:49
122390288,"["oai:journal.uin-alauddin.ac.id:article\/23941"]",10.24252/ifk.v5i1.23941,"Periodisasi Penciptaan Alam Semesta  Dalam Manuskrip Kutika dan Science Islam","["Basir, Fathur Rahman","Syarif, Muh. Rasywan"]",2021-10-06T20:40:34
977891,"["oai:arxiv.org:hep-ph\/0012359"]",10.1103/physrevc.63.065203,"Low Energy Pion-Hyperon Interaction","["A. Morelos","A. N. Kammal","A. Pais","B. Andersson","B. C. Pearce","B. R. Martin","C. C. Barros","C. Caso","C. Wilkinson","D. Bonfinger","F. Gross","G. Bunce","H. Pilkuhn","H. T. Coelho","J. Soffer","K. Heller","K. Kubo","M. Anselmino","M. G. Olsson","M. L. Perl","P. F. A. Goudsmit","P. J. Ellis","P. M. Ho","R. Nath","R. Ramerika","S. M. Troshin","S. Okubo","T. A. DeGrand","Y. Hama","Y. Hama","Y. Kitsukawa","Y. Yamamoto"]",2012-04-13T14:22:20
17013359,"["oai:citeseerx.psu:10.1.1.762.1292","oai:arxiv.org:1210.1500"]",10.1002/mma.3211,"Regular Solutions to the Coagulation Equations with Singular Kernels","["Camejo, Carlos Cueto","Gr\u00f6pler, Robin","Warnecke, Gerald"]",2014-10-23T17:19:34
18083920,"["oai:arxiv.org:1508.00118"]",,"A new characterization of Kac-Moody-Malcev superalgebras","["Azam, Saeid"]",2015-09-24T01:23:36
561528,"["oai:arxiv.org:0708.2954"]",10.1086/524841,"Coronal Neutrino Emission in Hypercritical Accretion Flows","["Kawabata, R.","Kawanaka, N.","Mineshige, S."]",2012-04-13T14:15:55
967257,"["oai:arxiv.org:hep-ex\/0611050","oai:cds.cern.ch:1001664"]",10.1142/s0217732307025844,"Q & A Experiment to Search for Vacuum Dichroism, Pseudoscalar-Photon
  Interaction and Millicharged Fermions","["Anselm A. A.","Dine M.","Dong Z.","HSIEN-HAO MEI","Masso E.","Michelson A. A.","Ni W.-T.","Ni W.-T.","Ni W.-T.","Ni W.-T.","Pedrotti F.","Raffelt G. G.","SHENG-JUI CHEN","WEI-TOU NI","Weinberg S."]",2012-04-13T14:22:09
17217563,"["oai:arxiv.org:1408.2799","oai:citeseerx.psu:10.1.1.758.4357"]",10.1142/s0218271815500522,"Particle Creation in Global de Sitter Space: Bulk Space Consideration","["Tanhayi, M. Reza"]",2014-10-24T19:28:39
2392164,"["oai:citeseerx.psu:10.1.1.754.4145","oai:arxiv.org:1203.2139"]",10.1063/1.4745594,"Heat transport in quantum harmonic chains with Redfield baths","["Prosen, Toma\u017e","\u017dunkovi\u010d, Bojan"]",2012-06-28T20:38:05
975280,"["oai:cds.cern.ch:403059","oai:arxiv.org:hep-lat\/9910019"]",10.1016/s0920-5632(00)91594-9,"Results and Perspectives in HEP, vis-a-vis Lattice QCD","["Abbaneo","Abe","Alavi-Harati","Ali","Apanasevich","Apanasevich","Artuso","Aversa","Barbieri","Barbieri","Bertolini","Bigi","Bigi","Brignole","Caso","Catani","Catani","Ciuchini","Colangelo","De Fazio","Ellis","Fritzsch","Giele","Gim\u00e9nez","Gupta","Hambye","Hoang","Hoang","Kidonakis","Kilcup","Laenen","M.L Mangano","Martin","Masiero","Mele","Melnikov","Neubert","Pekurovsky","Pomarol","Sharpe"]",2012-04-13T14:22:17
1081532,"["oai:arxiv.org:math\/0504548"]",,"On Compact and Fredholm Operators over C*-algebras and a New Topology in
  the Space of Compact Operators","["Irmatov, Anwar A.","Mishchenko, Alexandr S."]",2012-04-13T14:23:51
1140551,"["oai:arxiv.org:quant-ph\/0212155","oai:cds.cern.ch:598769"]",,"Quantum description of classical apparatus: Zeno effect and decoherence","["Gurvitz, S. A."]",2012-04-13T14:24:49
2401196,"["oai:arxiv.org:1204.6373"]",,"Hom-Novikov Algebras and Hom-Novikov-Poisson Algebras","["You, Hong","Yuan, Lamei"]",2012-06-28T20:38:30
625389,"["oai:arxiv.org:0812.2541"]",,"Paradox in physics, the consistency of inconsistency","["Cucic, Dragoljub A."]",2012-04-13T14:16:50
17127645,"["oai:arxiv.org:1305.6777"]",,"Existence of positive solutions for nonlinear Kirchhoff type problems in
  R^3 with critical Sobolev exponent and sign-changing nonlinearities","["Gongbao, Li","Hongyu, Ye"]",2014-10-24T19:18:32
157240103,"["oai:riuma.uma.es:10630\/29639"]",10.1016/j.amc.2017.02.032.,"A Geo[X]/G[X]/1 retrial queueing system with removal work and total renewal discipline","["Aguilera-Venegas, Gabriel","Atencia-McKillop, Iv\u00e1n","Gal\u00e1n-Garc\u00eda, Jos\u00e9 Luis","Gal\u00e1n-Garc\u00eda, Mar\u00eda \u00c1ngeles","Rodr\u00edguez-Cielos, Pedro"]",2024-02-16T01:45:02
5995533,"["oai:hrcak.srce.hr:10063"]",10.1177/154405910208100509,"Comparative Microstructural Study of the Diffusion Zone Between Ni-Cr Alloy and Different Dental Ceramics","["C. Hegedus","L. Daroczi","O. Beke","V. Kokenyesi"]",2013-08-27T17:06:01
699219,"["oai:arxiv.org:1005.1127"]",10.1080/00927872.2010.533726,"Hom-Lie color algebra structures","["Aizawa N.","Albert A. A.","Ammar F.","Chaichian M.","Chaichian M.","Chaichian M.","Goze M.","Hartwig J. T.","Lamei Yuan","Larsson D.","Liu K.","Makhlouf A.","Myung H. C.","Myung H. C.","Scheunert M.","Zhou J."]",2012-04-13T14:17:57
18053952,"["oai:arxiv.org:1504.00771","oai:eprints.iisc.ac.in:57577","oai:iris.unimore.it:11380\/1108461"]",10.1515/forum-2015-0080,"Lower bounds for regular genus and gem-complexity of PL 4-manifolds","["Basak, Biplab","Casali, Maria Rita"]",2015-09-24T00:09:27
57614752,"["oai:evastar-karlsruhe.de:1000049779"]",10.5445/ir/1000049779,"Cocoda "Colibri Concordance Database" - A mapping tool for library classification schemes","["Balakrishnan, Uma"]",2019-05-07T00:24:30
859259,"["oai:arxiv.org:astro-ph\/9604055","oai:cds.cern.ch:300955"]",10.1093/mnras/285.4.711,"On star formation in primordial protoglobular clouds","["Jimenez, Raul","Jones, Bernard","Padoan, Paolo"]",2012-04-13T14:20:29
900191,"["oai:arxiv.org:cond-mat\/0401002","oai:scholarworks.umass.edu:physics_faculty_pubs-2190","oai:scholarworks.umass.edu:20.500.14394\/40524"]",,"Weakly interacting Bose gas in the vicinity of the critical point","["Prokof'ev, Nikolay","Ruebenacker, Oliver","Svistunov, Boris"]",2012-04-13T14:21:11
17132690,"["oai:arxiv.org:1306.4816"]",10.1214/ecp.v19-2886,"On differentiability of stochastic flow for a multidimensional SDE with
  discontinuous drift","["Aryasova, Olga","Pilipenko, Andrey"]",2014-10-24T19:19:04
15202092,"["oai:e-archivo.uc3m.es:10016\/29249"]",,"Plan S and Transformative Agreements","["Anglada, Llu\u00eds"]",2020-03-29T02:28:47
17218300,"["oai:arxiv.org:1408.6351"]",10.1109/focs.2014.58,"Ramanujan Complexes and bounded degree topological expanders","["Kaufman, Tali","Kazhdan, David","Lubotzky, Alexander"]",2014-10-24T19:28:59
1072590,"["oai:arxiv.org:math\/0312232"]",,"On the natural representation of $S(\Omega)$ into $L^2(P(\Omega))$:
  Discrete harmonics and Fourier transform","["Marco, Jos\u00e9 Manuel","Parcet, Javier"]",2012-04-13T14:23:44
17030869,"["oai:arxiv.org:1212.5536"]",,"Sketches from the life of hypercomplex numbers","["Andreev, K. V."]",2014-10-23T17:21:16
18072435,"["oai:arxiv.org:1506.03540"]",,"DisCoF$^+$: Asynchronous DisCoF with Flexible Decoupling for Cooperative
  Pathfinding in Distributed Systems","["Campbell, Joe","Duong, William","Fainekos, Georgios","Kim, Kangjin","Zhang, Yu"]",2015-09-24T00:35:27
959629,"["oai:arxiv.org:gr-qc\/9701001","oai:citeseerx.psu:10.1.1.339.5194"]",10.1103/physrevd.56.785,"Gravitational Waves in Brans-Dicke Theory : Analysis by Test Particles
  around a Kerr Black Hole","["A. Abramovici","A. Ohashi","C. Brans","C. M. Will","C. M. Will","C. M. Will","C. M. Will","C. W. Misner","D. M. Eardley","D. M. Eardley","E. W. Leaver","Hisa-aki Shinkai","J. H. Taylor","Kei-ichi Maeda","L. E. Simone","M. A. Scheel","M. P. Haugan","M. Sasaki","M. Shibata","M. Shibata","Motoyuki Saijo","N. Andersson","P. Anninos","R. A. Hulse","R. D. Reasenberg","R. V. Wagoner","S. A. Teukolsky","S. L. Shapiro","T. Harada","T. Nakamura","T. Nakamura","Y. Kojima","Y. Mino"]",2012-04-13T14:22:02
24793115,"["oai:doaj.org\/article:04fba9c067f340cf85de2412d8e6acb6","oai:arxiv.org:1604.07145"]",10.1016/j.physletb.2016.07.013,"Diphoton excess from hidden U(1) gauge symmetry with large kinetic
  mixing","["Takahashi, Fuminobu","Yamada, Masaki","Yokozaki, Norimi"]",2016-08-03T02:57:52
18090719,"["oai:arxiv.org:1509.00126"]",,"Dynamic Network Formation with Foresighted Agents","["Song, Yangbo","van der Schaar, Mihaela"]",2015-09-24T01:49:56
122373584,"["oai:ojs.journals.usamvcluj.ro:article\/7063"]",10.15835/buasvmcn-hort:7063,"Economic efficiency of some tehnological measures for carrot (Daucus carota L.) culture","["ANDREICA, Ileana","GOCAN, Tincu\u0163a Marta","M\u0102NIU\u0162IU, D\u0103nu\u0163 N."]",2019-12-14T00:13:46
19427451,"["oai:amslaurea.cib.unibo.it:10025"]",,"Bionanocomposites based on Plla, Pcl and montmorillonite: synthesis, characterization and crystallization","["Bettini, Giacomo"]",2016-04-29T16:05:18
726454,"["oai:arxiv.org:1010.4994","oai:citeseerx.psu:10.1.1.750.3662"]",10.1093/qmath/har012,"The twistor space of a quaternionic contact manifold","["Davidov, Johann","Ivanov, Stefan","Minchev, Ivan"]",2012-04-13T14:18:22
801803,"["oai:arxiv.org:1201.0351"]",10.1016/j.camwa.2012.09.012,"Liquid-gas-solid flows with lattice Boltzmann: Simulation of floating
  bodies","["Aidun","Aidun","Aidun","Aidun","Binder","Bouzidi","Buick","Caiazzo","Chen","Chen","Chen","Derrett","Donath","Fekken","He","H\u00e4nel","Iglberger","K\u00f6rner","Ladd","Ladd","Lallemand","Luo","Luo","Mei","Mei","Pohl","Qian","Rohde","Simon Bogner","Succi","Ulrich R\u00fcde","Verberg","Wolf-Gladrow"]",2012-04-13T14:19:33
111738845,"["oai:openscience.uz:article\/749","oai:ojs.openscience.uz:article\/749"]",,"FIZIKA O’QITISHDA SAMARADORLIKKA ERISHISH OMILLARI","["G\u2019oibova, Nargiza Ziyoxonovna"]",2021-04-27T06:03:51
153463442,"["oai:hrcak.srce.hr:301049"]",,"Zahvala recenzentima, Metalurgija 62 (2023) 1-4, 3-500","["Mamuzi\u0107, Ilija"]",2023-05-17T06:22:58
1044277,"["oai:cds.cern.ch:274389","oai:arxiv.org:hep-th\/9412226"]",10.1142/s0217751x96000092,"Calculation of Gromov-Witten invariants for $ CP^{3},CP^{4}$,and
  $Gr(2,4)$","["Jinzenji, Masao","Sun, Yi"]",2012-04-13T14:23:17
17189499,"["oai:arxiv.org:1404.0136"]",10.1016/j.pss.2014.05.019,"Scaling of convective velocity in a vertically vibrated granular bed","["Katsuragi, Hiroaki","Yamada, Tomoya M."]",2014-10-24T19:25:29
153864679,"["oai:ojs.eiris.it:article\/1436"]",10.23755/rm.v49i0.1436,"Existence Results for ψ -Caputo Fractional Differential Equations with Boundary Conditions","["C, Monickpriya","D, Swathi"]",2024-01-06T15:45:16
2726767,[],,"Second-order mollified derivatives and optimization","["Crespi Giovanni","La Torre Davide","Rocca Matteo"]",2012-07-06T03:56:05
151329623,"["oai:hrcak.srce.hr:301049"]",,"Zahvala recenzentima, Metalurgija 62 (2023) 1-4, 3-500","["Mamuzi\u0107, Ilija"]",2023-08-29T11:26:31
676231,"["oai:arxiv.org:0912.2297"]",,"Presymplectic manifolds","["Hajduk, Boguslaw","Walczak, Rafal"]",2012-04-13T14:17:37
798069,"["oai:arxiv.org:1112.5890"]",10.1214/11-ejs649,"Adaptive spectral regularizations of high dimensional linear models","["Golubev, Yuri"]",2012-04-13T14:19:33
822709,"["oai:arxiv.org:astro-ph\/0203179","oai:edpsciences.org:dkey\/10.1051\/0004-6361:20020377"]",10.1051/0004-6361:20020377,"Compact groups in the UZC galaxy sample","["Athanassoula","B. Kelm","Bahcall","Barnes","Barton","Barton","Benoist","Bothun","Cappi","Coziol","Coziol","Davis","de Carvalho","Diaferio","Dressler","Falco","Fisher","Fried","Governato","Heldson","Hernquist","Hickson","Hickson","Hickson","Hickson","Huchra","Huchra","Karachentsev","Kelm","Maia","Mamon","Mamon","Mamon","Mamon","Marzke","Mendes de Oliveira","Montoya","Moore","Mulchaey","Oosterloo","P. Focardi","Ponman","Postman","Prandoni","Ramella","Ratcliffe","Ribeiro","Rubin","Sanders","Somerville","Struble","Tonry","Tresse","Tully","Verdes-Montenegro","Walke","Williams","Withmore","Zabludoff","Zaritsky","Zepf","Zucca"]",2012-04-13T14:19:54
43619766,"["oai:casi.ntrs.nasa.gov:19680002123"]",,"The scaler magnetic intensity at 1100 kilometers in middle and low latitudes","["Heuring, F. T.","Radford, W. E.","Verzariu, P.","Zmuda, A. J."]",2017-09-02T12:17:27
133186102,"["oai:ojs.jurnal.polsri.ac.id:article\/3993"]",,"SOSIALISASI PEMANFAATAN ALIRAN SUNGAI KELEKAR SEBAGAI PEMBANGKIT LISTRIK TENAGA MIKROHIDRO (PLTMH)","["., Indrayani Indrayani","Aida Syarif","Norca Praditya","Noviansyah Nugraha","Renny Citra Ramadhani","Syahirman Yus"]",2022-11-10T09:28:57
10927647,"["info:doi\/10.5772%2f24685","oai:intechopen.com:24819"]",10.5772/24685,"Third-Order Optical Nonlinearities of Novel Phthalocyanines and Related Compounds","["Fushi Zhang","Song Xu","Xinyu Zhou","Zhongyu Li","Zihui Chen"]",2020-05-07T20:57:15
127010984,"["oai:ojs.journal.universitaspahlawan.ac.id:article\/6757"]",,"Implementasi Kompresi Citra Digital Mengatur Kualitas Citra Digital","["Afriandika, Riko","Sugiyono,  Sugiyono"]",2022-10-19T06:23:19
78073534,"["info:doi\/10.1117%2f12.2205893"]",10.1117/12.2205893,"Structure of lidar return from cloud layer taking into account the double scattering","["Bryukhanova, Valentina Vladimirovna","Poskrebyshev, Egor R."]",2020-02-26T20:42:00
2594452,[],,"URBAN AIR QUALITY. A COMPARATIVE STUDY OF MAJOR EUROPEAN CAPITALS","["Cristina ALPOPI","Sofia Elena COLESCA"]",2012-07-06T03:46:25
78073496,"["info:doi\/10.1117%2f12.2205890"]",10.1117/12.2205890,"Sensing of low-contrast inhomogeneities in above-water atmosphere","["Bryukhanova, Valentina Vladimirovna","Shamanaev, Vitalii S."]",2020-02-26T20:42:00
1141958,"["oai:oaktrust.library.tamu.edu:1969.1\/126576","oai:arxiv.org:quant-ph\/0309171","oai:cds.cern.ch:644528"]",10.1103/physreva.70.033806,"Buffer-gas induced absorption resonances in Rb vapor","["A. V. Taichenachev","B. D. Agapyev","E. Arimondo","Eugeniy E. Mikhailov","G. S. Agarwal","George R. Welch","Irina Novikova","J. P. Marangos","J. Vanier","M. O. Scully","R. Bernheim","R. Wynands","S. I. Kanorsky","V. Sautenkov","Yuri V. Rostovtsev"]",2012-04-13T14:24:50
898561,"["oai:arxiv.org:cond-mat\/0311281"]",10.1103/physrevb.68.214514,"Poor screening and nonadiabatic superconductivity in correlated systems","["A. Georges","A. Lanzara","A.A. Abrikosov","A.A. Abrikosov","A.B. Migdal","A.I. Liechtenstein","A.Y. Liu","B. Friedl","C. Grimaldi","C. Grimaldi","Claudio Grimaldi","D. Fay","D. Rubio Temprano","E. Cappelluti","Emmanuele Cappelluti","F. Raffa","G. Baym","G. Kotliar","H. Keller","H. Suhl","I. Chang","J. Bouvier","J. Hubbard","J.P. Franck","L. Pietronero","Lilia Boeri","Luciano Pietronero","M. d\u2019Astuto","M. Grilli","M. Scattoni","M. Weger","M.C. Gutzwiller","M.K. Crawford","M.L. Kuli\u0107","M.S. Osofsky","M.S. Osofsky","P. Paci","R. Chitra","R. Zeyher","W.E. Pickett"]",2012-04-13T14:21:10
621757,"["oai:arxiv.org:0811.2871","oai:archive.ugent.be:8644750"]",10.1016/j.na.2010.01.042,"Semilinear ordinary differential equation coupled with distributed order
  fractional differential equation","["Atanackovic, Teodor M.","Oparnica, Ljubica","Pilipovic, Stevan"]",2012-04-13T14:16:48
70045196,"["oai:pasca.unhas.ac.id\/ojs:article\/143"]",,"Analysis SEM the Chemical and Physics Composition of Used Rice Husks as an Absorber Plate","["Selintung, M.","Suriamihardja, D. A.","Syarif, H. U.","Wahab, Abd. W."]",2019-10-30T00:38:46
97406172,"["oai:ojs.pkp.sfu.ca:article\/16451"]",,"Analisis Penalaran Konsep Fisika pada Siswa Kelas X SMAN 1 Torue","["Ali, Muhammad","Rahayu, Ni Komang Tri"]",2020-11-27T11:54:37
89984833,"["oai:int.jurnalinterest.com:article\/192"]",10.37341/interest.v9i1.192,"Effectiveness of Beet Juice, Potato and Ambon Banana Diet to The Elderly with Hypertension for Blood Pressure","["DA, Sri Lestari","Rohimah, Yeni Tutu"]",2020-10-21T13:51:22
151276717,"["oai:zenodo.org:141635"]",10.1142/s0218271800000232,"ON-LINE CONSISTENCY TESTS FOR BAR DETECTORS","["Antonello Ortolan","G. A. Prodi","G. Vedovato","J. P. Zendri","L. Baggio","L. Taffarello","Massimo Cerdonio","Stefano Vitale","V. Martinucci"]",2023-10-30T20:53:47
1044024,"["oai:arxiv.org:hep-th\/9505057","oai:cds.cern.ch:281573"]",10.1142/s0217751x97003030,"Construction of Free Energy of Calabi-Yau manifold embedded in
  $CP^{n-1}$ via Torus Actions","["Jinzenji, Masao"]",2012-04-13T14:23:18
122818833,"["oai:ojs.journal.umg.ac.id:article\/1192"]",10.30587/e-link.v14i2.1192,"Tomografi Komputer Translasi Rotasi Dengan Menggunakan Metode Sampling Pola Square","["Kholis, Nur"]",2021-12-02T13:23:40
961365,"["oai:arxiv.org:gr-qc\/9712098","oai:cds.cern.ch:341615"]",10.1103/physrevd.58.103514,"Chaotic inflation with a scalar field in non-classical states","["Finelli, F.","Vacca, G. P.","Venturi, G."]",2012-04-13T14:22:03
645517,"["oai:arxiv.org:0905.1783"]",10.2140/agt.2010.10.1027,"On the universal sl_2 invariant of ribbon bottom tangles","["Lawrence","Lawrence","Lusztig","Mizuma","Mizuma","Reshetikhin","Sakie Suzuki"]",2012-04-13T14:17:09
17196635,"["oai:air.unimi.it:2434\/651056","oai:arpi.unipi.it:11568\/474669","oai:arxiv.org:1405.4152"]",10.3934/dcdss.2014.7.593,"Ultrafunctions and Applications","["Baglini, Lorenzo Luperi","Benci, Vieri"]",2014-10-24T19:26:31
10148827,"["oai:ojs.pressto.amu.edu.pl:article\/7428","oai:bibliotekanauki.pl:964044"]",10.14746/seg.2016.14.7,"The transformations of the Model Reader and the translation shifts","["Wilkos, Aleksandra"]",2018-04-13T21:44:46
11747732,"["oai:digibug.ugr.es:10481\/57178"]",,"Attitude Control Board for CubeSat","["Aparicio Jim\u00e9nez, Juan"]",2019-11-05T07:13:49
58977652,"["oai:arxiv.org:1905.05019"]",,"Measurement-based VLC channel characterization for I2V communications in
  a real urban scenario","["Caputo, Stefano","Cataliotti, Francesco Saverio","Catani, Jacopo","Mucchi, Lorenzo","Nawaz, Tassadaq","Seminara, Marco"]",2019-06-02T02:03:29
85936125,"["oai:arxiv.org:2005.06264"]",10.1088/1748-0221/15/08/c08013,"Investigation and improvements of the mechanical structure of
  Cylindrical GEMs for the BESIII experiment","["Balossino, Ilaria"]",2020-05-14T16:53:00
2875602,[],,"Knowledge intensive Industrial Clustering around Océ; Embedding a vertical disintegrating","["Cobbenhagen,Jan","Wintjes,Rene"]",2012-07-06T04:03:20
126907652,"["oai:ojs.cvut.cz:article\/4828"]",,"Investigation of Peculiarities of the Discharge Excitation with Hollow Cathode Effect in N2 in a Tube Electrode","["Barouski, I.","Bordusau, S.","Bozhko, A.","Madveika, S.","Tsikhan, O."]",2019-12-15T06:41:33
47139704,"["oai:sfera.unife.it:11392\/2383849","oai:iris.unife.it:11392\/2396662","oai:iris.unife.it:11392\/2383849","oai:arxiv.org:1801.01416","oai:sfera.unife.it:11392\/2396662"]",10.1016/j.jmps.2017.12.004,"The dynamics of a shear band","["Bigoni, Davide","Capuani, Domenico","Giarola, Diana"]",2018-01-23T13:40:56
150254162,"["oai:iris.polito.it:11583\/2782254"]",10.1063/5.0026694,"Low-Order Models for Low-Frequency Combustion Instability in Hybrid Rocket Engines","["Andrea Ferrero","Dario Pastrone","Filippo Masseni"]",2020-02-26T15:09:47
122703805,"["oai:ojs.journal.poltekkes-mks.ac.id:article\/2225"]",10.32382/mirk.v2i2.2225,"PELATIHAN STUNTING PADA GURU SD DAN  ORANG TUA ANAK DI KOTA MAKASSAR","["Jalil, Nuraeni","Muhasidah, Muhasidah","Nasrullah, Nasrullah","Subriah, Subriah"]",2022-01-09T12:06:57
154036401,"["oai:ojs2.bajangjournal.com:article\/6955"]",,"PENGADAAN  PAPAN  BICARA  PENCEGAHAN  MEROKOK DAN  PENYALAHGUNAAN NARKOBA SECARA DINI DI SEKOLAH DASAR KOTA MAKASSAR","["AR. Subriah","Masdiana, Masdiana","Muhasidah, Muhasidah"]",2024-01-12T10:35:36
86043045,"["oai:upcommons.upc.edu:2117\/187099"]",,"Performance of large scaled tsunami run-up analysis using explicit ISPH method","["Asai, Mitsuteru","Furuichi, Mikito","Nishiura, Daisuke","Ogasawara, Keita"]",2020-06-05T09:08:51
10996505,"["oai:elar.urfu.ru:10995\/82844","oai:neliti.com:508302","oai:ojs.www.knepublishing.com:article\/4411"]",10.18502/keg.v1i1.4411,"Microstructure and Thermoelastic Martensitic Transformations in Ni-Mn-Al Based Alloys","["Belosludtseva, Elena S.","Pushin, Artemy V.","Pushin, Vladimir G.","Svirid, Alexey E."]",2020-06-04T07:36:16
17943083,"["info:doi\/10.5604%2f20830157.1194273","oai:bibliotekanauki.pl:408873","oai:ojs2.ph.pollub.pl:article\/1164"]",10.5604/20830157.1194273,"ANALIZA CHARAKTERYSTYK KORELACYJNYCH I SPEKTRALNYCH  SYGNAŁÓW FRAKTALNYCH O STRUKTURZE GRZEBIENIOWEJ","["Politanskyi, Ruslan","Veryga, Andrij"]",2020-01-02T20:13:24
10991945,"["oai:ojs.www.knepublishing.com:article\/2207"]",10.18502/kms.v4i1.2207,"Influence of Sintering Conditions on Specific Electrical Conductivity in Aluminum-Graphene Composite","["Grigoriev, E G","Melnikov, A P","Stolyarov, V V","Zholnin, A G"]",2021-01-25T02:09:08
82412121,"["oai:ojs.jrnl.nau.edu.ua:article\/11391"]",10.18372/1990-5548.50.11391,"Експериментальна перевірка теореми оборотності для осесиметричного тіла з оперенням","["Stepanenko, I. \u041e.","Tupitsin, \u041c. F.","Ziganshin, A. A."]",2020-04-10T15:33:07
84083778,"["oai:sedici.unlp.edu.ar:10915\/5550"]",,"Interconnection and sharing through webservices","["De Giusti, Marisa Raquel","Lira, Ariel Jorge","Sobrado, Ariel","Vila, Mar\u00eda Marta"]",2020-04-17T10:07:25
123389076,"["oai:ojs.journal.poltekkes-mks.ac.id:article\/2633"]",10.32382/mirk.v3i1.2633,"PELATIHAN PENERAPAN FUNGSI KELUARGA DAN GERAKAN  MASYARAKAT HIDUP SEHAT (GERMAS) PADA ANAK  PANTI ASUHAN DI KOTA MAKASSAR","["Ahmad, Abdul Kadir","Angriani, Sri","Jalil, Nuraeni","Muhasidah, Muhasidah","Subriah, Subriah"]",2022-07-21T17:17:52
11458258,"["oai:ejournal.unesa.ac.id:article\/26767","oai:ojs.journal.unesa.ac.id:article\/26767"]",,"RANCANG BANGUN TRAINER VARIASI KECEPATAN AWAL PADA GERAK LURUS BERUBAH BERATURAN MENGGUNAKAN SENSOR ULTRASONIK Hc-Sr04","["ADI PERMANA PUTRA, IVAN","RIANDADARI, DYAH"]",2019-10-17T21:54:18
158196682,"["oai:revues.imist.ma:article\/43210"]",,"Hamiltoniens classiques et géométrie k-symplectique","["Ammar, A.","Awane, A.","Azizi, E.","El Kinani, E. H.","Essabab, S.","Ouhadan, A.","Rahmoune, M."]",2024-10-02T06:56:36
4084950,"["oai:iris.unive.it:10278\/3699471","oai:arxiv.org:1207.2024","info:doi\/10.1007%2fs10884-014-9418-6","oai:citeseerx.psu:10.1.1.748.4081"]",10.1007/s10884-014-9418-6,"Slow motion of internal shock layers for the Jin-Xin system in one space
  dimension","["Strani, Marta"]",2012-07-12T14:05:53
10995687,"["oai:ojs.www.knepublishing.com:article\/4408","oai:elar.urfu.ru:10995\/82841","oai:neliti.com:508283"]",10.18502/keg.v1i1.4408,"Crystal Structure of Martensite and Orientation Relationships During Thermoelastic Martensitic Transformations in Ni-Mn-Based Alloys","["Belosludtseva, Elena S.","Pushin, Artemy V.","Pushin, Vladimir G.","Svirid, Alexey E."]",2020-06-04T07:36:16
132216505,"["oai:ijaseit.insightsociety.org:article\/560"]",10.18517/ijaseit.5.5.560,"Selection and Semi-Dwarf Allele Mutants Segregation Pattern as the Result of Gamma Ray Irradiation of  West Sumatera Black Rice","["Alfi, Hendra","Suliansyah, Irfan","Swasti, Etty","Syarif, Auzar","Warman, Benny"]",2020-04-10T17:51:17
711814,"["oai:arxiv.org:1007.4786"]",,"Effective models for conductance in magnetic fields: derivation of
  Harper and Hofstadter models","["De Nittis, Giuseppe","Panati, Gianluca"]",2012-04-13T14:18:07
51399203,"["oai:arxiv.org:1804.08997"]",,"Self-oscillatory interactions of supersonic streams with cylinders,
  placed in open channels","["Pinchukov, V. I."]",2018-05-15T08:43:15
85610285,"["oai:ojs2.rajpub.com:article\/534"]",10.24297/jap.v11i2.534,"PHYSICAL AND OPTICAL PROPERTIES OF THE FILMS ?i2Te3-Bi2Se3","["Akhmedov, Gurban"]",2020-05-11T18:49:26
122713934,"["oai:ojs.ejournal.poltekkes-smg.ac.id:article\/5824"]",10.31983/jimed.v6i2.5824,"Analisis Variasi Slice Thickness Terhadap Informasi Anatomi Potongan Axial Pada Pemeriksaan MSCT Cervical Pada Kasus Trauma","["Ardiyanto, Jeffri","Nugroho, Rizki Aditya","Wijokongko, Sigit"]",2021-10-12T07:21:25
160791876,"["oai:ojs.um-tapsel.ac.id:article\/17075"]",10.31604/eksakta.v9i2.357,"MEDIA PEMBELAJARAN AUGMENTED REALITY DENGAN METODE MARKER BASED TRACKING: TINGKATKAN KETERAMPILAN BERPIKIR KRITIS SISWA","["Aisyah, Aisyah"]",2024-09-16T00:05:48
123379752,"["oai:ojs3.unpatti.ac.id:article\/5152"]",10.30598/jmsvol3issue1pp40-46,"PENERAPAN VIRTUAL LEARNING CLASS MENGGUNAKAN MODEL FLIPED CLASSROOM DALAM ZOOM MEETING UNTUK MENINGKATKAN PENGUASAAN MATERI GERAK LURUS PESERTA DIDIK KELAS VIII SMP NEGERI 9 AMBON","["Latupeirissa, Asry","Supardan, Dian","Tuhurima, David"]",2022-07-20T13:11:22
1064754,"["oai:arxiv.org:math\/0108209"]",,"Information, initial condition sensitivity and dimension in weakly
  chaotic dynamical systems","["Galatolo, Stefano"]",2012-04-13T14:23:36
