"workID","oaiID","doi","title","authors","createdDate"
124998342,"["oai:riunet.upv.es:10251\/103996","info:doi\/10.1016%2fj.enconman.2016.11.054"]",10.1016/j.enconman.2016.11.054,"Effect of laser induced plasma ignition timing and location on Diesel spray combustion","["Garc\u00eda Mart\u00ednez, Antonio","Garc\u00eda-Oliver, Jos\u00e9 M","Pastor, Jos\u00e9 V.","Pinotti, Mattia"]",2019-12-25T14:14:41
46711349,"["oai:repository.kmou.ac.kr:2014.oak\/9305"]",,"생체재료용 Carbon/PEEK 복합재료의 기계적 특성의 향상에 관한 연구","["\uc724\uc131\uc6d0"]",2018-01-03T10:02:55
61583117,"["oai:hrcak.srce.hr:194868","oai:doaj.org\/article:261aec54d1214e8291bea6cf8fb7eea1"]",10.5599/jese.480,"In-depth component distribution in electrodeposited alloys and multilayers","["Attila Csik","Gy\u00f6rgy Moln\u00e1r","Imre Bakonyi","Katalin Neur\u00f3hr","Katalin N\u00e9meth","Kristina \u017du\u017eek Ro\u017eman","Krisztina Boros","K\u00e1lm\u00e1n Vad","Lajos Pog\u00e1ny","Lara Lobo","L\u00e1szl\u00f3 P\u00e9ter","Rocio Mu\u00f1\u00edz","Rosario Pereiro","Sa\u0161o \u0160turm"]",2018-04-08T01:53:09
10923391,"["oai:intechopen.com:16849","info:doi\/10.5772%2f19779"]",10.5772/19779,"Spin Dependent Transport through a Carbon Nanotube Quantum Dot in the Kondo Regime","["Damian Krychowski","Stanislaw Lipinski"]",2020-05-07T20:55:55
87179703,"["oai:arxiv.org:2008.03702"]",,"Vanishing viscosity approximation for linear transport equations on
  finite starshaped networks","["Guarguaglini, Francesca R.","Natalini, Roberto"]",2020-08-12T00:01:00
29741564,"["oai:iris.unica.it:11584\/110905","oai:arpi.unipi.it:11568\/965505","oai:www.earth-prints.org:2122\/9689","info:doi\/10.1016%2fj.quascirev.2015.03.016","oai:www.iris.unina.it:11588\/635751","oai:ricerca.uniba.it:11586\/219377","oai:iris.unisalento.it:11587\/409882","oai:arts.units.it:11368\/2845156"]",10.1016/j.quascirev.2015.03.016,"Tidal notches in Mediterranean Sea: a comprehensive analysis","["Antonioli, Fabrizio","Anzidei, Marco","de Sabata, Eleonora","Deiana, Giacomo","Ferranti, Luigi","Furlani, Stefano","Lo Presti, Valeria","Mastronuzzi, Giuseppe","Orru, Paolo E.","Pagliarulo, Rossella","Rovere, Alessio","Sannino, Gianmaria","Sans\\uf2, Paolo","Scicchitano, Giovanni","Spampinato, Cecilia R.","Vacchi, Matteo","Vecchio, Antonio"]",2016-11-12T04:33:29
39711794,"["oai:digital.csic.es:10261\/346196","oai:docta.ucm.es:20.500.14352\/7456","oai:repositorio.uam.es:10486\/698229"]",10.3390/ijerph18041965,"Peloids as thermotherapeutic agents","["Armijo, Francisco","Armijo, Onica","Corvillo, Iluminada","Ejeda, Jose Manuel","Fernandez-Toran, Miguel Angel","Maraver, Francisco","Torres-Piles, Silvia","Vazquez, Iciar"]",2021-11-24T14:06:47
735136,"["oai:arxiv.org:1012.5144","oai:citeseerx.psu:10.1.1.759.3819","oai:uhra.herts.ac.uk:2299\/8460","oai:openresearch-repository.anu.edu.au:1885\/66943"]",10.1088/0004-637x/729/1/16,"Chemodynamical Simulations of the Milky Way Galaxy","["Beers","Bergemann","Bertschinger","Bruenn","Chiaki Kobayashi","Cunha","Diemand","Edvardsson","Freeman","Fulbright","Fulbright","Hachisu","Honda","Honma","Israelian","Iwamoto","Kauffmann","Klypin","Kobayashi","Kobayashi","Kobayashi","Kobayashi","Kobayashi","Kobayashi","Kobayashi","Koda","Kodama","Levine","Maeda","Marek","Moore","Morrison","Nakasato","Naohito Nakasato","Navarro","Ohkubo","Podsiadlowski","Prochaska","Ruchti","Saito","Sommer-Larsen","Steinmetz","Sullivan","Takada-Hidai","Tinsley","Tsujimoto"]",2012-04-13T14:18:32
66964557,"["oai:preserve.lehigh.edu:etd-4167"]",,"The effect of cutting conditions on the friction angle","["Burfeind, Alfred F."]",2019-10-17T19:39:27
1010233,"["oai:cds.cern.ch:325913","oai:infoscience.tind.io:152077","oai:arxiv.org:hep-ph\/9705307"]",10.1016/s0550-3213(97)00603-2,"Dynamical Soft Terms with Unbroken Supersymmetry","["Dimopoulos, Savas","Dvali, Gia","Giudice, Gian","Rattazzi, Riccardo"]",2012-04-13T14:22:48
3918473,"["oai:agregador.ibict.br.ri_unesp:oai:repositorio.unesp.br:11449\/4184","oai:doaj.org\/article:69b26b732134478684a34d4b0c5285cf","oai:pub.uni-bielefeld.de:2326455","oai:researchbank.rmit.edu.au:rmit:30846","oai:www.arca.fiocruz.br:icict\/9041","oai:escidoc.org:escidoc:1562550","oai:pubmedcentral.nih.gov:3078919","oai:pub.uni-bielefeld.de:2289971","oai:agregador.ibict.br.ri_fiocruz:oai:localhost:icict\/9041","oai:www.alice.cnptia.embrapa.br:doc\/906799","info:doi\/10.1016%2fj.jbiotec.2010.11.004","oai:escidoc.org:escidoc:1562518","oai:pure.mpg.de:item_1562550","oai:www.alice.cnptia.embrapa.br:doc\/914696","oai:edoc.mpg.de:618819","oai:edoc.mpg.de:618822","oai:repositorio.unesp.br:11449\/4184","oai:pure.mpg.de:item_1562518","oai:acervodigital.unesp.br:11449\/4184"]",10.1371/journal.pone.0018551,"Evidence for Reductive Genome Evolution and Lateral Acquisition of Virulence Functions in Two Corynebacterium pseudotuberculosis Strains","["A Alvarez-Ord\u00f3\u00f1ez","A Barinov","A Kabus","A Khamis","A Khamis","A Silva","A Tauch","Adhemar Zerlotini","AL Hodgson","Amjad Ali","Ana Fl\u00e1via Costa","Anderson Dominitini","Anderson Miyoshi","Anderson R. Santos","Andreas Tauch","Andr\u00e9 L. Pedrosa","Anne C. Pinto","Artur Silva","Aryanne A. M. C. Rocha","AS Guimar\u00e3es","AS Moomaw","B Blombach","B Ewing","B Sa\u00efd-Salim","BG Hall","C Song","C Wittmann","C Wittmann","CA Kunkle","Carlos U. Vieira","CC Brown","CE Zhou","Cl\u00e1udia T. Guimar\u00e3es","CY Soto","D Aguilar","D B\u00f6ltner","D Rittmann","DA Rasko","Daniela C. Bartholomeu","Daniela M. Resende","DG Eggleton","DG Vassylyev","Diana M. Oliveira","DK Karaolis","D\u00e9bora O. Lopes","E P\u00e9rez","E Trost","Elis\u00e2ngela M. Coser","EM Zdobnov","Eva Trost","F Veyrier","FA Dorella","FA Dorella","Fabr\u00edcio R. Santos","Fernanda A. Dorella","Francisco P. Lobo","G Enkavi","Gl\u00f3ria R. Franco","Guilherme C. Oliveira","H Shiotani","H Yamamoto","I Smith","IA Merchant","Ieso M. Castro","Igor Mokrousov","J Arsenault","J Gonzalo-Asensio","Jan Baumbach","Jer\u00f4nimo C. Ruiz","Jesus A. Ferro","JL Ayers","John McCulloch","Jos\u00e9 Miguel Ortega","Juliana Franco Almeida","K Lagesen","K O'Connor","K Rumbold","K Rutherford","KM Connor","L Wooldridge","L Zhang","Louise T. Cerdeira","Luciana M. Oliveira","Luciano V. Paiva","Luis G. C. Pacheco","Luiz R. Goulart","M Casalino","M Krauthammer","Marc\u00edlia P. Costa","Maria In\u00eas T. Ferro","Maria Paula C. Schneider","MD Piontkowski","Meritxell Z. Turk","MG Ribeiro","MS Ben Sa\u00efd","MW Paton","N Seyffert","Newton P. Carneiro","N\u00fabia Seyffert","OF Join-Lambert","P Kiefer","P Rice","P Urbina","Pablo M. R. O. Moraes","Paula R. K. Falc\u00e3o","PD Karp","PEJ Carlson","PJ McNamara","Priscila Grynberg","R Caspi","R Caspi","R R\u00fcbenhagen","RA Burne","Robert J. Moore","Roberto Meyer","Rommel T. J. Ramos","RP Huntley","RR Pinheiro","S Klaffl","S Parche","S Sch\u00f6nert","S Waack","Santuza M. R. Teixeira","SAR Webb","SD Carson","SF Altschul","SG Stoops","SH Binns","Sintia S. Almeida","Siomar C. Soares","ST Cole","S\u00e9rgio Brommonschenkel","S\u00e9rgio C. Oliveira","S\u00edlvia Regina Costa Dias","T May","T Selby","T Shimizu","Thiago L. P. Castro","TJ Carver","TM Lowe","U Dobrindt","U Dobrindt","U Hentschel","V D'Afonseca","V Merhej","Vasco Azevedo","Vinicius A. C. Abreu","V\u00edvian D'Afonseca","W Schumann","Y Nakamura","\u00c9lida Mara Rabelo"]",2012-07-08T14:38:47
17205533,"["oai:arxiv.org:1406.7272"]",,"Nanophotonics and DNA: New approaches","["Bregadze, Vasil G.","Giorgadze, Tamar G.","Melikishvili, Zaza G."]",2014-10-24T19:27:31
155156794,"["oai:vinar.vin.bg.ac.rs:123456789\/12383"]",10.2298/tsci0301063s,"Numerical modeling of disperse material evaporation in axisymmetric thermal plasma reactor","["Cvetinovi\u0107, Dejan","Oka, Simeon","Pavlovi\u0107, Pavle","Stefanovi\u0107, Predrag","\u017divkovi\u0107, Goran"]",2024-05-03T11:39:13
37876088,"["oai:air.uniud.it:11390\/1132912"]",,"Comparative investigation of silicon photomultipliers as possible photon detectors for the Cherenkov Telescope Array","["Stella, Carlo"]",2018-06-19T00:28:54
33180256,"["oai:researchrepository.murdoch.edu.au:57216"]",,"Analysis and optimisation through mathematical modelling: Muresk farm photovoltaic reverse osmosis water treatment plant","["Young, Clinton"]",2020-10-17T14:04:24
120380320,"["oai:estudogeral.uc.pt:10316\/108739","oai:doaj.org\/article:d6b6390e42af47148fa7651ebbe42976","info:doi\/10.3390%2fph9010015","oai:pubmedcentral.nih.gov:4812379","oai:run.unl.pt:10362\/146299"]",10.3390/ph9010015,"11th national meeting of organic chemistry and 4th meeting of therapeutic chemistry","["Andrade,\u00a0Paula B.","Ara\u00fajo,\u00a0Maria Jo\u00e3o","Branco,\u00a0Paula Cristina de S\u00e9rio","Do Vale,\u00a0Maria Lu\u00edsa","Freitas,\u00a0Victor","Gomes,\u00a0Paula","Moreira,\u00a0Rui","Pinho E Melo,\u00a0Teresa M.V.D.","Sousa,\u00a0Maria Em\u00edlia"]",2017-10-13T09:52:08
128501420,"["oai:e-archivo.uc3m.es:10016\/35556"]",10.1016/j.medengphy.2017.11.003,"Full-field strain distribution in multi-vertebra spine segments: An in vitro application of digital image correlation","["Cristofolini, Luca","Marco Esteban, Miguel","Palanca, Marco","Ruspi, Mar\u00eda Luisa"]",2022-10-27T07:46:50
50604464,"["oai:thekeep.eiu.edu:den_1985_jan-1012","oai:thekeep.eiu.edu:den_1986_jan-1015"]",,"Daily Eastern News: January 28, 1986","["Eastern Illinois University"]",2018-04-14T14:56:28
84935596,"["oai:thekeep.eiu.edu:den_1986_jan-1015"]",,"Daily Eastern News: January 28, 1986","["Eastern Illinois University"]",2020-04-18T23:04:16
151405707,"["oai:thekeep.eiu.edu:den_1985_jan-1012","oai:thekeep.eiu.edu:den_1986_jan-1015"]",,"Daily Eastern News: January 28, 1986","["Eastern Illinois University"]",2018-04-14T14:56:28
152895703,"["oai:thekeep.eiu.edu:den_1985_jan-1012","oai:thekeep.eiu.edu:den_1986_jan-1015"]",,"Daily Eastern News: January 28, 1986","["Eastern Illinois University"]",2018-04-14T14:56:28
144664029,"["oai:thekeep.eiu.edu:den_1985_jan-1012","oai:thekeep.eiu.edu:den_1986_jan-1015"]",,"Daily Eastern News: January 28, 1986","["Eastern Illinois University"]",2018-04-14T14:56:28
74113903,"["oai:ojs.localhost:article\/213"]",,"REALITY AND ITS HIERARCHY "Polanyiâ€™s Critics on Material Reductionism"","["Tinambunan, Laurentius"]",2019-12-14T00:07:46
133852671,"["oai:thekeep.eiu.edu:den_1986_jan-1015"]",,"Daily Eastern News: January 28, 1986","["Eastern Illinois University"]",2018-04-14T14:56:28
24321456,"["oai:upcommons.upc.edu:2117\/918","oai:dnet:upcommonspor::e708ae423dbb59216abf2d5f16bf9376"]",,"Algebra and geometry in Pietro Mengoli (1625-1686)","["Massa Esteve, Maria Rosa"]",2016-06-16T17:14:07
139476699,"["oai:thekeep.eiu.edu:den_1986_jan-1015"]",,"Daily Eastern News: January 28, 1986","["Eastern Illinois University"]",2018-04-14T14:56:28
1029952,"["oai:arxiv.org:hep-th\/0404138","oai:cds.cern.ch:731117"]",,"Gauge Invariance and Construction of the Fermion-Boson Vertex in QED3","["Raya, A."]",2012-04-13T14:23:05
794300,"["oai:arxiv.org:1112.0310"]",,"New results for electromagnetic quasinormal modes of black holes","["Fiziev, Plamen","Staicova, Denitsa"]",2012-04-13T14:19:29
158079490,"["oai:egrove.olemiss.edu:thedmonline-2627"]",,"November 19, 1919","["The Mississippian"]",2024-09-28T07:37:12
2565688,[],,"Limited memory can be beneficial for the evolution of cooperation","["Friederike Mengel","Gergely Horv\u00e1th","Jaromir Kovarik"]",2012-07-06T03:45:11
108517426,"["oai:digitalcommons.latech.edu:university-catalogs-1078"]",,"1901-1902 Louisiana Industrial Institute Catalogue","["Louisiana Tech University"]",2021-03-18T05:02:09
7956665,"["oai:scholarworks.rit.edu:theses-6847","oai:repository.rit.edu:theses-6847"]",,"A Comparison of highly efficient iterative linear solvers","["Chowdhury, Akbar"]",2018-01-06T09:02:16
52586724,"["oai:digibuo.uniovi.es:10651\/48889"]",10.5599/jese.480,"In-depth component distribution in electrodeposited alloys and multilayers","["Csik, Attila","Garc\u00eda \u00c1lvarez, Roc\u00edo","Lobo Revilla, Lara","Pereiro Garc\u00eda, Mar\u00eda Rosario","Peter, Laszlo","Vad, Kalman"]",2018-11-05T03:09:37
86002425,"["oai:arxiv.org:1906.08313"]",10.1017/s0022377820000392,"A General Metriplectic Framework with Application to Dissipative
  Extended Magnetohydrodynamics","["Coquinot, Baptiste","Morrison, Philip J."]",2020-06-04T02:02:25
145183131,"["oai:scarab.bates.edu:bates_student-1653","oai:scarab.bates.edu:bates_student-1630"]",,"The Bates Student - volume 63 number 23 - February 19, 1936","["Bates College"]",2019-10-17T21:48:01
68554923,"["oai:scarab.bates.edu:bates_student-1630"]",,"The Bates Student - volume 63 number 23 - February 19, 1936","["Bates College"]",2019-10-17T21:48:01
24897788,"["oai:casi.ntrs.nasa.gov:19820008857"]",,"Aerospace Medicine and Biology.  A continuing bibliography (Supplement 226)",[],2016-08-03T08:07:00
158872037,"["oai:thekeep.eiu.edu:den_1987_jan-1017","oai:thekeep.eiu.edu:den_1985_jan-1013","oai:thekeep.eiu.edu:den_1986_jan-1016"]",,"Daily Eastern News: January 29, 1986","["Eastern Illinois University"]",2018-04-14T14:56:28
107757379,"["oai:arxiv.org:2011.03527"]",,"Supersymmetry in Hadron Spectroscopy and Solitons in 2 Dimensional
  Fermionic Media","["Furui, Sadataka"]",2021-03-02T01:51:28
71420243,"["oai:stars.library.ucf.edu:cfm-sandspur-2247"]",,"Sandspur, Vol. 71 No. 06, February 18, 1965","["Rollins College"]",2019-10-30T09:55:17
148624593,"["oai:thesis.unipd.it:20.500.12608\/22759"]",,"CFD Study of an Installed Transonic Rotor","["Fior, Elisa"]",2023-06-30T06:03:26
133395810,"["oai:upcommons.upc.edu:2117\/357938"]",,"Dicke superradiance in atomic arrays: impact of dimensionality","["Sierra Garzo, Eric"]",2022-03-16T14:36:35
46148217,"["oai:openarchive.ki.se:10616\/47423"]",10.1177/0284185116651003,"MRI sequences for detection of acute pulmonary embolism","["Vargas Paris, Roberto"]",2020-11-23T11:31:48
152895677,"["oai:thekeep.eiu.edu:den_1986_jan-1016"]",,"Daily Eastern News: January 29, 1986","["Eastern Illinois University"]",2018-04-14T14:56:28
19107822,"["oai:digitalcommons.usu.edu:etd-9205"]",,"Modeling, Simulation and Optimization of Nuclear Hybrid Energy Systems Using OpenModelica and RAVEN","["Hills, Stephen Michael"]",2021-04-20T18:33:38
149857798,"["oai:pure.tue.nl:studenttheses\/34eea8f2-3951-421c-89c6-9c37ae713a53","oai:library.tue.nl:759032"]",,"Measuring the fast ion density profile and energy distribution inside a Fusor using passive spectroscopy","["Spijkers, B.E.N."]",2017-02-15T04:43:04
125350485,"["oai:ricerca.uniparthenope.it:11367\/22118","oai:econstor.eu:10419\/90000"]",,"Overeducation at a glance.
Determinants and wage effects of the educational mismatch, looking at the AlmaLaurea data","["CAROLEO, Floro Ernesto","PASTORE F."]",2016-06-14T01:37:36
57643469,"["oai:evastar-karlsruhe.de:270022040"]",10.5445/ir/270022040,"Initial CAD investigations for NET. Final report June 1, 1985","["Katz, F.","Leinemann, K.","Ludwig, A.","Marek, U.","Olbrich, W.","Schlechtendahl, E.G."]",2019-05-07T00:28:07
9388243,"["oai:iris.sissa.it:20.500.11767\/3972"]",,"Neutral models in ecology : species abundance and extinction dynamics","["Pigolotti, Simone"]",2018-01-01T16:12:38
24911210,"["oai:casi.ntrs.nasa.gov:19790020695"]",,"Aerospace medicine and biology.  A continuing bibliography with indexes, supplement 195",[],2016-08-03T08:26:40
24833417,"["oai:casi.ntrs.nasa.gov:19970030306","oai:casi.ntrs.nasa.gov:19970034681"]",,"A Study of Convergence of the PMARC Matrices Applicable to WICS Calculations","["Ghosh, Amitabha"]",2016-08-03T04:45:17
86549256,"["oai:repositorio.aemet.es:20.500.11765\/11956"]",,"Caracterización de la dinámica atmosférica mediante tipos de circulación y su relación con la variabilidad climática en la península ibérica","["Garc\u00eda Valero, Juan Andr\u00e9s"]",2020-06-30T12:20:07
143432132,"["oai:crossworks.holycross.edu:purple_patcher-1101","oai:crossworks.holycross.edu:purple_patcher-1099"]",,"Purple Patcher 1974","["College of the Holy Cross"]",2023-03-31T15:02:02
46135807,"["oai:run.unl.pt:10362\/117488"]",,"Effect of eco-friendly solvents in solution-based AlOx dielectrics at low temperature","["Silva, Jo\u00e3o Miguel Rolo"]",2021-05-21T05:27:53
77639996,"["oai:renati.sunedu.gob.pe:sunedu\/753116"]",,"Techniques to reduce the Mutual Coupling and to improve the Isolation between antennas in a Diversity System","["Pablos Aberailas, Javier"]",2020-01-30T10:40:37
46820113,"["oai:helvia.uco.es:10396\/18667","oai:helvia.uco.es:10396\/27032"]",10.1016/j.trd.2019.05.010,"The potential of car advertising in pursuing transport policy goals: Code of good practices in the Spanish context","["Aparicio Mart\u00ednez, Pilar","Mart\u00ednez-Jim\u00e9nez, Pilar","Pedr\u00f3s P\u00e9rez, Gerardo"]",2019-06-03T08:19:31
149819760,"["oai:air.uniud.it:11390\/1230944"]",,"Radiation damage of FBK Silicon Photomultipliers for HEP applications","["ALTAMURA, ANNA RITA"]",2023-08-09T09:37:10
988705,"["oai:arxiv.org:hep-ph\/0311212"]",,"Chiral Dynamics: Theory and Experiment (CD2003)","["Hammer, H. -W.","Mei\u00dfner, Ulf-G.","Wirzba, Andreas"]",2012-04-13T14:22:29
26126698,"["oai:amslaurea.cib.unibo.it:12021","oai:inspirehep.net:1520807"]",,"Studies of CMS data access patterns with machine learning techniques","["De Luca, Silvia"]",2017-02-27T19:50:06
40838309,"["oai:upcommons.upc.edu:2117\/96618"]",,"Positioning systems on light coordinates","["Rivera Mu\u00f1oz, David"]",2017-05-01T02:10:12
139460580,"["oai:upcommons.upc.edu:2117\/383011"]",,"Machine Learning based prediction of the effect of lay-up defects in the automated fiber placement","["Iborra Escarr\u00e9, Mar\u00e7al"]",2023-02-17T19:49:13
5132978,"["oai:fedoa.unina.it:1473"]",10.6092/unina/fedoa/1473,"Cloud characterization in CIRA icing wind tunnel","["Bellucci, Matteo"]",2013-07-16T15:12:29
139476698,"["oai:thekeep.eiu.edu:den_1986_jan-1017"]",,"Daily Eastern News: January 30, 1986","["Eastern Illinois University"]",2018-04-14T14:56:28
50604422,"["oai:thekeep.eiu.edu:den_1986_jan-1017"]",,"Daily Eastern News: January 30, 1986","["Eastern Illinois University"]",2018-04-14T14:56:28
24905027,"["oai:casi.ntrs.nasa.gov:19790025647"]",,"Aerospace medicine and biology:  A continuing bibliography with indexes, supplement 197, September 1979",[],2016-08-03T08:26:12
74757399,"["oai:scholar.rose-hulman.edu:modulus-1081"]",,"2000 Modulus","["Rose-Hulman Institute of Technology"]",2019-12-15T04:04:53
37887176,"["oai:air.uniud.it:11390\/1132208"]",,"Evalutation of fetal cerebral blood flow perfusion using three dimensional power doppler ultrasound angiography in fetuses affected by intrauterine growth retardation","["Rossi, Alberto"]",2018-06-19T00:28:55
620308,"["oai:iris.uniroma3.it:11590\/119958","oai:arxiv.org:0811.1194","oai:citeseerx.psu:10.1.1.247.6816"]",10.1088/0034-4885/71/10/106201,"Experimental results on neutrino oscillations","["Acquafredda R","Adamson P","Ahrens L A","Alberico A","Aoki M","Apollonio M","Ardellier F","Ariga A","Athar M S","Ayres D","Bahcall J","Bahcall J","Bahcall J N","Beavis D","Blake A","Cabibbo N","Campagne J E Cazes A","Casagrande L","Chubey S","Clayton D","Cleveland B T","Cleveland B T Gavrin V N","Cravens J P","D Orestano","De Bellefon A","Diddens A N","Ferrari A Sala P","Fiorini E","Giunti C Lavader M","Gruber P","Guler M","Guo X","Heeger K","Itow Y","Joo K K","Jung C K","Kaijta T","Kaiser B","Kajita T","Kajita T","Komatsu M","Lipari P","Maltoni M","McDonald A B","Mezzetto M","Mezzetto M","Mikheyev S P","Nakamura K","Nishikawa K","Pontecorvo B","Pontecorvo B","Pontecorvo B","Pontecorvo B","Pontecorvo B","Pontecorvo B","Richter B","Schwetz T","Shana P","Strumia A Vissani F","Takeuchi Y","U Dore","Vidyakin G S","Vilain P","Vogel A","Vovenko A S"]",2012-04-13T14:16:46
71360834,"["oai:scarab.bates.edu:bates_student-2814"]",,"The Bates Student - volume 106 number 28 - February 8, 1980","["Bates College"]",2019-10-17T21:48:31
75084960,"["oai:tigerprints.clemson.edu:pres_reports-1083"]",,"President\u27s Report to Board of Trustees, 1924-07","["University, Clemson"]",2019-12-15T07:41:58
44430321,"["oai:ir.library.illinoisstate.edu:aq-1036"]",,"Alumni Quarterly, Volume 10 Number 2, May 1921","["Illinois State University"]",2022-05-19T22:26:15
124935652,"["oai:arxiv.org:2112.11739"]",10.1145/3554727,"A Survey of Natural Language Generation","["Chen, Miaoxin","Dong, Chenhe","Gong, Haifan","Li, Junxin","Li, Yinghui","Shen, Ying","Yang, Min"]",2022-02-22T00:03:05
158096783,"["oai:egrove.olemiss.edu:thedmonline-3419"]",,"February 08, 1946","["The Mississippian"]",2024-09-28T07:37:27
157273554,"["oai:arxiv.org:2401.14736"]",,"How does Simulation-based Testing for Self-driving Cars match Human
  Perception?","["Birchler, Christian","Kehrer, Timo","Mohammed, Tanzil Kombarabettu","Nechita, Teodora","Panichella, Sebastiano","Rani, Pooja"]",2024-08-24T00:03:55
11622908,"["oai:scholarworks.umass.edu:20.500.14394\/15614","oai:scholarworks.umass.edu:dissertations_1-6197"]",10.7275/16131673,"The effect of video printer technology on event memory in young children.","["Kim, Mi-suk"]",2020-01-23T20:10:22
70563564,"["oai:scholarworks.bgsu.edu:catalogs-1028"]",,"Firelands Bulletin 1974-75","["Bowling Green State University"]",2019-10-30T02:15:25
153366841,"["oai:iris.unibas.it:11563\/175295"]",,"STUDY OF ARCHEOLOGICAL METALLIC ARTEFACTS, RAW MATERIALS AND CONSERVATION WITH BIOLOGICAL AGENTS","["SGARRO, NICOLETTA"]",2024-02-03T20:33:25
24921070,"["oai:casi.ntrs.nasa.gov:19740024607"]",,"Zero-gravity cloud physics laboratory:  Experiment program definition and preliminary laboratory concept studies","["Eaton, L. R.","Greco, E. V."]",2016-08-03T09:03:01
8526059,"["oai:era.ed.ac.uk:1842\/12544","oai:www.era.lib.ed.ac.uk:1842\/12544"]",,"Carbon allocation and tree growth under hydraulic constraints in Scots pine (Pinus sylvestris L.)","["Magnani, Federico"]",2016-07-28T19:45:40
19170489,"["oai:docs.lib.purdue.edu:ecetr-1685"]",,"Development of Process Technology for GaAs E/D MODFET Logic Circuits","["Chen, Kai","Cooper, James A., Jr"]",2019-07-11T02:50:35
51414994,"["oai:upcommons.upc.edu:2117\/115953","oai:dnet:upcommonspor::2d0492296018cecc90a94e54d252d072"]",,"Systematic characterization of the micromechanical behaviour of inorganic matrix composites","["Lamelas Cubero, V\u00edctor"]",2018-05-21T18:05:31
152823401,"["oai:dnet:scipediaopen::a17a43354d5ba08dac610af3c1815cde","oai:scipedia.com:linero_et_al_2019b"]",,"A model of material failure for reinforced concrete via continuum strong discontinuity approach and mixing theory","["Huespe, A.","Linero, D.L.","Oliver, J."]",2020-04-10T16:00:54
15198034,"["oai:e-archivo.uc3m.es:10016\/24714","oai:dnet:earchivo____::cef37a1433982d2c1ceabbc4f2e4adf9"]",,"Optimization of construction cost and magnetic fields of underground powerlines","["Hern\u00e1ndez Jim\u00e9nez, V\u00edctor Julian"]",2019-05-06T21:28:12
133657073,"["oai:upcommons.upc.edu:2117\/377033"]",,"Use of robotic systems on airport management optimization","["Salmer\u00f3n Rodr\u00edguez, Javier"]",2022-12-02T00:22:54
46044332,"["oai:run.unl.pt:10362\/7875"]",,"Preparation of affinity membranes using alternative solvents","["Barroso, Telma Godinho"]",2018-05-11T01:14:57
45786086,"["oai:repositori.udl.cat:10459.1\/60152"]",,"Mechanical Dystopia: A roguelite videogame developed in Unity","["Vila Almenara, Sergi"]",2018-08-19T05:16:29
84892718,"["oai:ubibliorum.ubi.pt:10400.6\/8019"]",,"Using Project Management methodologies in a CubeSat project","["Pardal, Gon\u00e7alo Alexandre Lopes"]",2020-04-18T22:03:01
24921904,"["oai:casi.ntrs.nasa.gov:19760012974"]",,"Aeronautical Engineering:  A special bibliography with indexes, supplement 67, February 1976",[],2016-08-03T08:49:21
149862603,"["oai:pure.tue.nl:studenttheses\/4a50ce05-c91e-4645-9adf-0f20f32dbcb2"]",,"Automatic Generation of In-Circuit Tests for Discrete Active Components","["Pardo Parrado, Ricardo"]",2023-08-11T12:59:33
78423166,"["oai:dspace.lboro.ac.uk:2134\/35982","oai:figshare.com:article\/9375575"]",,"Inverse boundary spectral problem for Riemannian polyhedra","["Anna Kirpichnikova (7129733)"]",2019-01-02T14:38:00
69178607,"["oai:digitalcommons.njit.edu:dissertations-2150"]",,"Biological denitrification : fundamental kinetic studies, and process analysis for sequencing batch reactor operation","["Wang, Jun-Hsien"]",2019-10-29T07:11:57
63463897,"["oai:digitalrepository.unm.edu:abq_citizen_news-4027"]",,"Albuquerque Citizen, 03-20-1909","["Hughes & McCreight"]",2019-07-09T18:48:01
58871176,"["oai:evastar-karlsruhe.de:270033340"]",10.5445/ir/270033340,"Material development for fusion reactors","["Ehrlich, K."]",2019-05-07T00:27:58
57641410,"["oai:evastar-karlsruhe.de:270035869"]",10.5445/ir/270035869,"Proceedings of the IEA-workshop on intense neutron sources Karlsruhe, Germany, 21-23 September 1992. IEA-implementing agreement for a programme of research and development on fusion materials. Working group task - annex II","["Daum, E.","Ehrlich, K."]",2019-05-07T00:27:57
5071138,"["oai:iris.unife.it:11392\/2389378","oai:eprints.unife.it:375","oai:sfera.unife.it:11392\/2389378"]",,"Study of aerosol scavenging processes in atmosphere","["Di Matteo, Lorenza"]",2013-07-15T16:15:20
24869528,"["oai:casi.ntrs.nasa.gov:19910014578"]",,"Metal thin-film optical polarizers for space applications, phase 2","["Slocum, Robert E."]",2016-08-03T05:56:29
31139735,"["oai:iris.uniroma1.it:11573\/918066","oai:padis.uniroma1.it:10805\/2709"]",,"Effect of micro-particle addition on frictional energy dissipation and strength of concrete: experiments and modelling","["Scerrato, Daria"]",2016-11-12T11:41:39
6156541,"["oai:etd.adm.unipi.it:etd-09222012-153745"]",,"On-Chip Optical Interconnection Networks for Multi/Manycore Architectures","["SABA, GIANMARCO"]",2013-08-28T14:13:09
143695348,"["oai:run.unl.pt:10362\/151145"]",,"3D Sensing Character Simulation using Game Engine Physics","["Rodrigues, Jo\u00e3o Filipe Pereira"]",2023-04-05T02:06:59
