"workID","oaiID","doi","title","authors","createdDate"
1077347,"["oai:arxiv.org:math\/0408389","oai:ri.conicet.gov.ar:11336\/100311"]",10.1515/crelle.2006.086,"Relative cyclic homology of square zero extensions","["Guccione, Jorge A.","Guccione, Juan J."]",2012-04-13T14:23:47
71614756,"["oai:ojs.pkp.sfu.ca:article\/5563","oai:ojs.pp.bme.hu:article\/5563"]",,"MATHEMATICAL MODELLING OF NERVE PULSE TRANSMISSION","["Engelbrecht, J\u00fcri"]",2019-11-04T13:30:14
98118232,"["oai:agregador.ibict.br.ri_ufjf:oai:hermes.cpd.ufjf.br:ufjf\/1689","oai:hermes.cpd.ufjf.br:ufjf\/1689","oai:hermes.cpd.ufjf.br:ufjf\/1717","oai:ojs2.rajpub.com:article\/534","oai:agregador.ibict.br.ri_ufjf:oai:hermes.cpd.ufjf.br:ufjf\/1717"]",10.24297/jap.v11i2.534,"PHYSICAL AND OPTICAL PROPERTIES OF THE FILMS ?i2Te3-Bi2Se3","["Akhmedov, Gurban"]",2017-12-19T19:56:53
1078832,"["oai:arxiv.org:math\/0501392"]",,"Elliptic genera, torus orbifolds and multi-fans; II","["Hattori, Akio"]",2012-04-13T14:23:50
17127594,"["oai:arxiv.org:1305.6791"]",,"Existence of positive ground state solutions for the nonlinear Kirchhoff
  type equations in $R^3$","["Gongbao, Li","Hongyu, Ye"]",2014-10-24T19:18:33
77867820,"["oai:ojs.journals.usamvcluj.ro:article\/6580"]",10.15835/buasvmcn-agr:6580,"Mathematical Modeling of Batch Enzymatic Starch Hydrolysis","["MUNTEAN, Edward"]",2020-02-26T14:44:27
145621610,"["oai:thesis.unipd.it:20.500.12608\/14962"]",,"Measurements and numerical models for the evaluation of performance in microwave ovens",[],2023-06-30T06:03:58
160060493,"["info:doi\/10.1007%2fs10916-017-0888-z","oai:gredos.usal.es:10366\/157845"]",10.1007/s10916-017-0888-z,"Advantages and Disadvantages in Image Processing with Free Software in Radiology","["Frami\u00f1\u00e1n de Miguel, Andr\u00e9s","Juanes M\u00e9ndez, Juan Antonio","Mujika, Katrin Muradas"]",2021-04-12T20:55:55
9447587,"["oai:scholarworks.sjsu.edu:spartandaily-7223","oai:scholarworks.sjsu.edu:spartandaily-6949","oai:scholarworks.sjsu.edu:spartandaily-7086"]",,"Spartan Daily, October 20, 1982","["San Jose State University, School of Journalism and Mass Communications"]",2016-11-19T06:20:11
97787967,"["oai:s-space.snu.ac.kr:10371\/150716"]",,"산소 작용기 제어를 통한  그래핀 옥사이드의 밴드 갭 조절","["\uae40\uc720\ub9ac"]",2020-11-27T20:29:34
2832901,[],,"Institutional Change and Academic Patenting: French Universities and the Innovation Act of the 1999.","["Antonio Della Malva","Francesco Lissoni","Patrick Llerena"]",2012-07-06T04:01:49
148421301,"["oai:ojs2.e-journal.iain-palangkaraya.ac.id:article\/4477"]",10.23971/eds.v11i1.4477,"Pengaruh Model Pembelajaran Inkuiri Terbimbing dipadu Brainstorming terhadap Kemampuan Berpikir Kritis dan Motivasi Belajar Siswa","["Dwiastuti, Sri","Istiyova, Lathifah Radha","Santosa, Slamet"]",2023-08-19T09:23:13
150651653,"["oai:ojs.journal.unpas.ac.id:article\/7629"]",,"UPAYA PENINGKATAN MOTIVASI BELAJAR SISWA PADA PEMBELAJARAN TEMATIK MELALUI MEDIA JUMPING ON WORMS GAME DI SEKOLAH DASAR","["Azwar Uswatun, Din","Ikrima Nur Hafizhah","Rizqia Amalia, Arsyi"]",2023-06-29T08:44:06
2644769,[],,"Technological innovation in creative clusters. The case of laser in conservation of artworks in Florence","["Francesco Capone","Luciana Lazzeretti","Tommaso Cinti"]",2012-07-06T03:48:37
24802420,"["oai:arxiv.org:1605.06911"]",,"A representation for the derivative with respect to the initial data of
  the solution of an SDE with a non-regular drift and a Gaussian noise","["Aryasova, Olga","Pilipenko, Andrey"]",2016-08-03T03:03:01
2673106,[],,"AN EXHAUSTIVE COEFFICIENT OF RANK CORRELATION","["Agostino Tarsitano","Rosetta Lombardo"]",2012-07-06T03:49:56
1048580,"["oai:arxiv.org:hep-th\/9702122","oai:cds.cern.ch:320515"]",,"Maximal subalgebras of matrix Lie superalgebras","["Shchepochkina, Irina"]",2012-04-13T14:23:21
89587690,"["oai:arxiv.org:1911.06000"]",,"System and event activity dependent inclusive jet production with ALICE","["Hou, Yongzhen"]",2020-10-12T15:48:30
107759461,"["oai:arxiv.org:2011.07475"]",10.1103/physreve.103.l040202,"Presence and Absence of Delocalization-localization Transition in
  Coherently Perturbed Disordered Lattices","["Ikeda, Kensuke S.","Yamada, Hiroaki S."]",2021-03-02T01:52:37
956042,"["oai:arxiv.org:gr-qc\/0512013","oai:cds.cern.ch:912331"]",10.1142/s0218271805008145,"Perspectives on Quantum Gravity Phenomenology","["Abu-Zayyad T.","Amelino-Camelia G.","DANIEL SUDARSKY","Grumiller D.","Padmanabhan T.","Penrose R.","Perez A.","Rembieli\u0144ski J.","Sch\u00fctzhold R.","Vilela Mendez R."]",2012-04-13T14:21:59
108217777,"["oai:www.lume.ufrgs.br:10183\/217250"]",,"H-FEM and FSDT to approach the free and forced vibration of a graphene sheet using a non-local continuum mechanics theory","["Rossi, Rodrigo","Suarez, Oscar Alfredo Garcia de"]",2021-03-10T17:59:11
107296610,"["oai:js.ugd.edu.mk:article\/3960"]",10.46763/scgw207-20685s,"THE SOCIAL ESSENCE FOR LAW AND POLITICS","["Stojanovi\u0107, Radomir"]",2021-02-21T00:44:32
148414594,"["oai:ojs.journal.unpas.ac.id:article\/7629"]",,"UPAYA PENINGKATAN MOTIVASI BELAJAR SISWA PADA PEMBELAJARAN TEMATIK MELALUI MEDIA JUMPING ON WORMS GAME DI SEKOLAH DASAR","["Azwar Uswatun, Din","Ikrima Nur Hafizhah","Rizqia Amalia, Arsyi"]",2023-06-19T13:53:19
1063221,"["oai:arxiv.org:math\/0102187"]",,"Orbit complexity, initial data sensitivity and weakly chaotic dynamical
  systems","["Galatolo, Stefano"]",2012-04-13T14:23:35
74937460,"["oai:czasopisma.viamedica.pl:article\/21637"]",,"Study on the spatial distribution pattern of Cx40 gap junctions in the atria of patients with coronary heart disease","["Jian-qun, Tang","Qi-ming, Liu","Rong-shang, Li","Sheng-hua, Zhou","Tao, Zhou","Wang-hong, Du","Xian-zhi, He","Xu-ping, Li"]",2019-12-15T06:35:41
982340,"["oai:arxiv.org:hep-ph\/0112293"]",,HadAtom01,"["Gasser, J.","Rusetsky, A.","Schacher, J."]",2012-04-13T14:22:23
4082485,"["oai:arxiv.org:1207.2190"]",,"On a non linear third - order parabolic equation","["De Angelis, Monica"]",2012-07-12T14:05:53
998478,"["oai:arxiv.org:hep-ph\/0611201","oai:cds.cern.ch:999407"]",,"Forty years of acting electron-positron colliders","["Baier, V. N."]",2012-04-13T14:22:37
71616304,"["oai:ojs.pp.bme.hu:article\/8892","oai:ojs.pkp.sfu.ca:article\/8892"]",,"The Alternative Way to Drive the Automobile Air-Conditioning, Improve Performance, and Mitigate the High Temperature: A Literature Overview","["Hamidi, Nurkholis","Setiyo, Muji","Soeparman, Sudjito","Wahyudi, Slamet"]",2019-11-04T13:30:39
133645082,"["oai:addi.ehu.eus:10810\/26514"]",,"CorTen steel: a solution to atmospheric degradation in acid and marine environments","["Ruiz Galende, Patricia"]",2022-12-03T05:01:26
52225881,"["oai:arxiv.org:1807.10370"]",10.1364/josab.36.000890,"Transit Ramsey EIT resonances in a Rb vacuum cell","["Jenkins, Ravn M.","Mikhailov, Eugeniy E.","Novikova, Irina"]",2018-09-08T08:11:13
160809935,"["oai:ojs.pkp.sfu.ca:article\/17581"]",,"Analisis Struktur Mikro Nanokomposit Fe3O4/Karbon Aktif dari Limbah Tongkol Jagung","["Dwiridal, Letmi","Farras Drasih, Nabilah","Hidayat, Rahmat","Ulfa Jhora, Fadhila"]",2024-09-16T10:14:29
108218755,"["oai:www.lume.ufrgs.br:10183\/217269"]",,"Uniform FEM B-splines in the analysis of free vibration problem in the axisymmetric nano shells in elastic medium using a non-local elasticity theory","["Rossi, Rodrigo","Suarez, Oscar Alfredo Garcia de"]",2021-03-10T17:59:11
122925665,"["oai:ojs.pkp.sfu.ca:article\/143","oai:ojs3.114.7.97.221:article\/143"]",,"PENGARUH PERUBAHAN TEGANGAN TERHADAP  KONTRAS  RESOLUSI  PADA CT SCAN","["Dabukke, Hotromasari"]",2021-12-02T18:50:52
68780521,"["oai:er.nau.edu.ua:nau\/36177","oai:ojs.jrnl.nau.edu.ua:article\/12786"]",10.18372/1990-5548.55.12786,"Розрахунок розмірів газ-динамічного комплексу","["Krymov, Y. O.","Malakhov, S. O.","Tupitsin, N. F."]",2020-01-30T22:25:56
145467675,"["oai:e-journal.unmuhkupang.ac.id:article\/942"]",10.59098/pensos.v1i1.942,"Pemanfaatan Smartphone sebagai Media Pembelajaran Mandiri pada Anak di Kabupaten Kupang","["Senge, Wildaya"]",2023-06-28T03:46:34
154681957,"["oai:arxiv.org:2311.18469"]",,"Acoustic instability of a circular vortex with a smoothed vorticity
  profile","["Barbasov, A. B.","Chernyshev, S. A.","Kopiev, V. F."]",2024-05-10T00:08:57
144864238,"["oai:zenodo.org:34076"]",10.1016/j.egypro.2014.11.1005,"Transients Analysis of a Tidal Currents Self-balancing Kinetic Turbine with on Shore Basement","["Antonino Cutrupi","Gaetano Florio","Giacomo Lo Zupone","Mario Amelio","Nino Michele Scornaienchi","Silvio Barbarelli"]",2019-06-05T23:13:16
122714008,"["oai:ojs.ejournal.poltekkes-smg.ac.id:article\/6855"]",,"ANALYSIS OF WINDOW WIDTH VARIATION ON IMAGE ANATOMICAL INFORMATION MSCT STONOGRAPHY","["Izzudin, Muhammad"]",2021-10-12T07:21:36
126484944,"["oai:ijaseit.insightsociety.org:article\/8347"]",10.18517/ijaseit.9.2.8347,"Towards Neuro-Inspired Electronic Oscillators Based on The Dynamical Relaying Mechanism","["Acciarito, Simone","Cristini, Alessandro","Maest\u00fa, Fernando","Pascual, Teodoro","Susi, Gianluca"]",2020-04-10T17:51:11
647894,"["oai:arxiv.org:0906.0617"]",,"Stability of the Jensen--type functional equation in ternary Banach
  algebras: An alternative fixed point approach","["Ebadian, A.","Najafzadeh, Sh."]",2012-04-13T14:17:13
150013304,"["oai:iris.unipa.it:10447\/614533"]",10.1016/j.jmaa.2018.07.044,"Theory of generalized trigonometric functions: From Laguerre to Airy forms","["Dattoli G.","Licciardi S.","Pidatella R. M."]",2023-11-19T19:19:02
554275,"["oai:arxiv.org:0706.3485"]",10.1088/1475-7516/2008/01/018,"In which shell-type SNRs should we look for gamma-rays and neutrinos
  from p-p collisions?","["Aschenbach B","Boaz Katz","Cassam-Chenai G Hughes J\u00a0P Ballet J Decourchelle A","Dickel J R","Drury L O","Drury L O","Eli Waxman","Fukui Y","Ichimaru S","Longair M S","Malkov M A","Moraitis K","Muraishi H","Rybicki G B"]",2012-04-13T14:15:49
121308653,"["oai:ojs.jurnal.fkip.unila.ac.id:article\/13659"]",,"Pengembangan Lembar Kegiatan Peserta Didik Berbasis Project Based Learning","["Surbakti, Arwin","Suwarjo, Suwarjo","Yulisa, Nuransyoria"]",2020-04-09T17:02:31
151276792,"["oai:zenodo.org:142455"]",10.5194/astra-7-477-2011,"Detecting ultra-high energy cosmic rays from space with unprecedented acceptance: objectives and design of the JEM-EUSO mission","["Andrea Santangelo","E. Parizot","F. Kajino","Gustavo Medina-Tanco","H. Miyamoto","H. Ohomori","Il Han Park","James H. Adams","James H. Adams","K. Shinozaki","Katsuhiko Tsuno","M. E. Bertaina","Marco Casolino","Mark Christl","Mark Christl","Naoto Sakaki","P. Gorodetzky","P. Picozza","Toshikazu Ebisuzaki","Y. Hachisu","Y. Takizawa","Yoshiya Kawasaki"]",2023-10-30T20:53:50
95860059,"["oai:ruj.uj.edu.pl:item\/249715"]",,"The multiple meanings of management","["Su\u0142kowski, \u0141ukasz"]",2020-11-22T20:38:43
42711460,"["oai:hal:hal-02364554v1"]",,"3D structure and dynamics of filaments in turbulence simulations of WEST diverted plasmas","["Bufferand, H.","Ciraolo, G.","Fedorczak, N.","Galassi, D.","Ghendrih, Ph","Marandet, Y.","Nespoli, F.","Serre, E.","Tamain, P.","Tatali, R."]",2019-12-05T08:20:29
11803465,"["oai:riunet.upv.es:10251\/156849"]",10.1080/00295450.2019.1631051,"Cross-Section Generation Using TXT2NTAB Code for Uncertainty Propagation with Burnup Dependence","["Labarile, A.","Mesado, C.","Mir\u00f3 Herrero, Rafael","Verd\u00fa Mart\u00edn, Gumersindo Jes\u00fas"]",2021-04-08T11:09:42
107265313,"["oai:ojs.journal.uinsgd.ac.id:article\/8744"]",10.15575/ak.v7i2.8744,"Uji Kualitas Hand Sanitizer Ekstrak Daun Kunyit (Curcuma Longa Linn)","["Baizuroh, Ning","Dewi, Yuli Kusuma","Yahdi, Yahdi"]",2021-02-20T13:07:41
140055985,"["info:doi\/10.2298%2ftsci160415244l","oai:machinery.mas.bg.ac.rs:123456789\/2558"]",10.2298/tsci160415244l,"A variable-order fractal derivative model for anomalous diffusion","["Fu, Zhuojia","Lazarevi\u0107, Mihailo","Liu, Xiaoting","Sun, HongGuang"]",2019-04-01T14:46:46
70350895,"["oai:ojs.localhost:article\/9396"]",,"Production of Cellulose Acetate from Oil Palm Empty Fruit Bunches Cellulose","["Bahmid, Nur Alim","Maddu, Akhiruddin","Syamsu, Khaswar"]",2019-10-30T01:57:31
18052452,"["oai:arxiv.org:1503.05116"]",,"DC thermal modeling of CNTFETs based on a semi-empirical approach","["Marani, Roberto","Perri, Anna Gina"]",2015-09-24T00:07:44
132181363,"["oai:ojs.unm.ac.id:article\/915","oai:neliti.com:319289"]",10.35580/jspf.v8i3.915,"PERANAN STRATEGI PEMBELAJARAN BERDASARKAN TINGKAT PERKEMBANGAN KOGNITIF DALAM PEMBELAJARAN FISIKA PADA SEKOLAH MENENGAH PERTAMA DI KOTA MAKASSAR","["Martawijaya, Muh Agus"]",2020-06-12T06:40:24
133462497,"["info:doi\/10.1155%2f2015%2f890289","oai:doaj.org\/article:20004b439e93495c9eb6e6ead8476ee6","oai:www.iris.unina.it:11588\/586609","oai:zenodo.org:48824"]",10.1155/2015/890289,"An Obstacle Problem for Noncoercive Operators","["Gabriella Zecca","Gioconda Moscariello","Luigi Greco"]",2016-11-12T08:50:28
99237790,"["oai:journal.iainlangsa.ac.id:article\/1531"]",10.32505/qadha.v7i1.1531,"REKONSTRUKSI HUKUM WARISAN DI INDONESIA PERSPEKTIF PLURALISME AGAMA","["Mufid, Abdul"]",2020-12-02T06:28:21
1120986,"["oai:arxiv.org:physics\/0111182"]",,"Macroquantum effects in condensed matter","["Ilyanok, Alexander M."]",2012-04-13T14:24:34
26122606,"["oai:amslaurea.cib.unibo.it:14354"]",,"Condition Monitoring of a Belt-Based Transmission System for Comau Racer3 Robots","["Tanzariello, Roberta"]",2017-11-21T02:04:23
787288,"["oai:ri.conicet.gov.ar:11336\/197611","oai:sedici.unlp.edu.ar:10915\/83995","info:doi\/10.1016%2fj.physletb.2012.10.016","oai:arxiv.org:1110.3527"]",10.1016/j.physletb.2012.10.016,"Constraining the fundamental interactions and couplings with E\"otv\"os
  experiments","["Kraiselburd, Lucila","Vucetich, Hector"]",2012-04-13T14:19:17
11459773,"["oai:ejournal.unesa.ac.id:article\/37448"]",10.26740/ujced.v10n1.p66-75,"PENGEMBANGAN LKPD BERBASIS COLLABORATIVE CREATIVITY UNTUK MENINGKATKAN CREATIVE THINKING SKILL PADA MATERI ASAM BASA","["Hervyanti, Refanny Anindya Fitria","Muchlis, Muchlis"]",2021-12-12T15:45:27
129761427,"["oai:ojs2.bajangjournal.com:article\/3473"]",,"PENGARUH TEMPERATUR KALSINASI GRAFIT-TiO2 TERHADAP PERFORMA DYE SENSITIZER SOLAR CELL (DSSC) BERBASIS DYE DARI DAUN SUJI  (Dracaena Angustifolia)","["Insira Insani Fitri"]",2022-11-10T22:47:31
54151906,"["oai:arxiv.org:1809.06471"]",,"A Language for Large-Scale Collaboration in Economics: A Streamlined
  Computational Representation of Financial Models","["Faleiro, Jorge"]",2019-02-06T06:42:25
74692883,"["oai:ojs.pkp.sfu.ca:article\/269","info:doi\/10.22158%2fselt.v3n1p41"]",10.22158/selt.v3n1p41,"The Effect of Concept-Mapping on Speaking and Self-Regulation in Speaking of Iranian Intermediate EFL Learners","["Saeedi Farjam, Elaheh","Seyed Erfani, Shiva"]",2019-12-15T02:11:33
1149151,"["oai:localhost:20.500.11897\/397610","oai:arxiv.org:quant-ph\/0702267"]",10.1103/physrevlett.99.131802,"Measurement of EPR-type flavour entanglement in Upsilon(4S)->B0 B0bar
  decays","["A. Bay","A. Bozek","A. Chen","A. Drutskoy","A. Go","A. Go","A. Gori\u0161ek","A. Imoto","A. Ishikawa","A. J. Schwartz","A. Kuzmin","A. Limosani","A. M. Bakich","A. Matyja","A. Pompili","A. Somov","A. Yamaguchi","A. Zupanc","B. D. Yabsley","B. G. Cheon","B. Golob","B. Shwartz","C. C. Kuo","C. C. Wang","C. H. Wang","C. Jacoby","C. W. Park","D. Anipko","D. Epifanov","D. Heffernan","D. Liventsev","E. Barberio","E. Nakano","E. Won","F. Takasaki","G. Gokhroo","G. N. Taylor","G. Pakhlova","G. Varner","H. Aihara","H. Ha","H. Hayashii","H. Ishino","H. J. Kim","H. Kichimi","H. Miyake","H. Miyata","H. Palka","H. Park","H. R. Khan","H. Sahoo","H. Shibuya","H. Stoeck","I. Bizjak","I. Tikhomirov","J. B. Singh","J. Dalseno","J. H. Kang","J. Lee","J. S. Lange","J. Sch\u00fcmann","J. Wicht","J.\u2009S. Bell","K. Abe","K. Belous","K. Hayasaka","K. Ikado","K. Inami","K. Kinoshita","K. Senyo","K. Trabelsi","K. Ueno","K.-F. Chen","L. E. Piilonen","L. S. Peak","M. Bra\u010dko","M. Danilov","M. Dash","M. Hazumi","M. Iwasaki","M. J. Lee","M. Nakao","M. Peters","M. Shapkin","M. Stari\u010d","M. Tanaka","M. Yamauchi","M.-Z. Wang","N. C. Hastings","N. Gabyshev","N. Katayama","N. Satoyama","N. Soni","O. Nitoh","O. Schneider","P. Chang","P. Kri\u017ean","P. Krokovny","P. Pakhlov","Q. L. Xie","R. Chistov","R. Itoh","R. Kulasiri","R. Kumar","R. Mizuk","R. Pestotnik","R. Seidl","R.\u2009A. Bertlmann","S. Blyth","S. Cole","S. Eidelman","S. Fratina","S. Hou","S. K. Kim","S. Korpar","S. L. Olsen","S. McOnie","S. Nishida","S. Ogawa","S. Stani\u010d","S. Uehara","S. Uno","S. Villa","S.-W. Lin","T. Aushev","T. E. Browder","T. Gershon","T. Hokuue","T. Iijima","T. Kawasaki","T. Lesiak","T. Matsumoto","T. Mori","T. Ohshima","T. Schietinger","T. Sumiyoshi","T. Tsuboyama","T. Tsukamoto","T. Uglov","U. Bitenc","V. Aulchenko","V. Zhilich","W. Mitaroff","W. T. Chen","W.-S. Hou","X. C. Tian","Y. Chao","Y. Choi","Y. Hoshi","Y. Iwasaki","Y. J. Kim","Y. K. Choi","Y. Liu","Y. Miyazaki","Y. Onuki","Y. Sakai","Y. Teramoto","Y. Unno","Y. Watanabe","Y. Yamashita","Y.-J. Kwon","Z. Natkaniec","Z. P. Zhang"]",2012-04-13T14:24:58
122577987,"["oai:neliti.com:433019","oai:ojs.localhost:article\/944"]",10.31326/jisa.v4i2.944,"Assessment of Employee Using Simple Multi-Attribute Technique Exploiting Rank (SMARTER) and Behaviorally Anchor Rating Scale (BARS) Method","["Sulastri, Heni"]",2022-01-09T06:27:17
54178977,"["oai:arxiv.org:1812.04708"]",,"Non-local Operational Anisotropic Diffusion Filter","["Cappabianco, F\u00e1bio A. M.","da Silva, Petrus P. C. E."]",2019-02-06T06:50:10
152387733,"["oai:ejournal.unesa.ac.id:article\/54137"]",10.26740/jinacs.v4n04.p458-468,"Penerapan Metode Vikor dalam Penentuan Rekomendasi Objek Wisata Terbaik Surabaya di Masa Pandemi Covid-19","["Rochmawati, Naim","Siregar, Verayanti"]",2023-10-24T19:31:06
574191,"["oai:arxiv.org:0711.4481"]",,"Invariance property of orbifold elliptic genus for multi-fans","["hattori, Akio"]",2012-04-13T14:16:08
109887167,"["oai:ojs.unm.ac.id:article\/14161"]",10.26858/retorika.v14i1.14161,"THE EFFECTIVENESS OF TEACHING MODULE COMPUTER BASED DRILLING MODEL AND PRACTICE IN IMPROVING LEARNING ACHIEVEMENT OF INDONESIAN LANGUAGE","["Al-Pansori, Muh. Jaelani","Padlurrahman, Padlurrahman"]",2021-04-18T15:29:39
98655104,"["oai:ojs.localhost:81:article\/2758"]",10.31002/ijose.v4i2.2758,"Experimental Design in Constructing Low Temperature Sensor Based on Resistance Temperature Detector (RTD)","["Singgih, Suwito","Suryandari, Suryandari","Toifur, Moh"]",2020-11-30T15:06:59
8882401,"["oai:philpapers.org\/rec\/rogdmo-2"]",,"Dialectical-Ontological Modeling of Primordial Generating Process ↔ Understand λόγος ↔Δ↔Logos & Count Quickly↔Ontological (Cosmic, Structural) Memory","["Rogozhin, Vladimir"]",2020-10-05T11:45:44
617981,"["oai:arxiv.org:0810.3888"]",10.1112/blms/bdq061,"Quaternionic contact manifolds with a closed fundamental 4-form","["Ivanov, Stefan","Vassilev, Dimiter"]",2012-04-13T14:16:44
11820167,"["oai:riunet.upv.es:10251\/105866","info:doi\/10.1007%2fs10910-016-0723-7"]",10.1007/s10910-016-0723-7,"A family of parametric schemes of arbitrary even order for solving nonlinear models","["Cordero Barbero, Alicia","Torregrosa S\u00e1nchez, Juan Ram\u00f3n","Vassileva, Maria P."]",2019-12-25T14:14:59
1064345,"["oai:arxiv.org:math\/0107014"]",,"Elliptic genera, torus manifolds and multi-fans","["Hattori, Akio","Masuda, Mikiya"]",2012-04-13T14:23:36
556236,"["oai:arxiv.org:0707.1289"]",10.1016/j.matpur.2009.11.002,"Conformal quaternionic contact curvature and the local sphere theorem","["Ivanov, Stefan","Vassilev, Dimiter"]",2012-04-13T14:15:50
128741349,"["info:doi\/10.1080%2f14606925.2017.1352912","oai:flore.unifi.it:2158\/1109086","oai:arpi.unipi.it:11568\/1201354"]",10.1080/14606925.2017.1352912,"TXD. From Traceability to Experience Design in Fashion Accessories Production","["Cianfanelli, Elisabetta","Goretti, Gabriele"]",2021-05-03T19:10:14
1136098,"["oai:citeseerx.psu:10.1.1.251.6968","oai:arxiv.org:1109.4227","oai:arxiv.org:quant-ph\/0003006"]",10.1103/physrevd.91.072006,"Search for n-nbar oscillation in Super-Kamiokande","["collaboration, Super-Kamiokande",":","Abe, K.","Hayato, Y.","Iida, T.","Ishihara, K.","Kameda, J.","Koshio, Y.","Minamino, A.","Mitsuda, C.","Miura, M.","Moriyama, S.","Nakahata, M.","Obayashi, Y.","Ogawa, H.","Sekiya, H.","Shiozawa, M.","Suzuki, Y.","Takeda, A.","Takeuchi, Y.","Ueshima, K.","Watanabe, H.","Higuchi, I.","Ishihara, C.","Ishitsuka, M.","Kajita, T.","Kaneyuki, K.","Mitsuka, G.","Nakayama, S.","Nishino, H.","Okumura, K.","Saji, C.","Takenaga, Y.","Clark, S.","Desai, S.","Dufour, F.","Herfurth, A.","Kearns, E.","Likhoded, S.","Litos, M.","Raaf, J. L.","Stone, J. L.","Sulak, L. R.","Wang, W.","Goldhaber, M.","Casper, D.","Cravens, J. P.","Dunmore, J.","Griskevich, J.","Kropp, W. R.","Liu, D. W.","Mine, S.","Regis, C.","Smy, M. B.","Sobel, H. W.","Vagins, M. R.","Ganezer, K. S.","Hartfiel, B.","Hill, J.","Keig, W. E.","Jang, J. S.","Jeoung, I. S.","Kim, J. Y.","Lim, I. T.","Scholberg, K.","Tanimoto, N.","Walter, C. W.","Wendell, R.","Ellsworth, R. W.","Tasaka, S.","Guillian, G.","Learned, J. G.","Matsuno, S.","Messier, M. D.","Ichikawa, A. K.","Ishida, T.","Ishii, T.","Iwashita, T.","Kobayashi, T.","Nakadaira, T.","Nakamura, K.","Nishikawa, K.","Nitta, K.","Oyama, Y.","Suzuki, A. T.","Hasegawa, M.","Maesaka, H.","Nakaya, T.","Sasaki, T.","Sato, H.","Tanaka, H.","Yamamoto, S.","Yokoyama, M.","Haines, T. J.","Dazeley, S.","Hatakeyama, S.","Svoboda, R.","Sullivan, G. W.","Gran, R.","Habig, A.","Fukuda, Y.","Itow, Y.","Koike, T.","Jung, C. K.","Kato, T.","Kobayashi, K.","McGrew, C.","Sarrat, A.","Terri, R.","Yanagisawa, C.","Tamura, N.","Ikeda, M.","Sakuda, M.","Kuno, Y.","Yoshida, M.","Kim, S. B.","Yang, B. S.","Ishizuka, T.","Okazawa, H.","Choi, Y.","Seo, H. K.","Gando, Y.","Hasegawa, T.","Inoue, K.","Ishii, H.","Nishijima, K.","Ishino, H.","Watanabe, Y.","Koshiba, M.","Totsuka, Y.","Chen, S.","Deng, Z.","Liu, Y.","Kielczewska, D.","Berns, H. G.","Shiraishi, K. K.","Thrane, E.","Washburn, K.","Wilkes, R. J."]",2012-04-13T14:19:12
24741693,"["oai:arxiv.org:1511.01356"]",,"The next generation of FETs: CNTFETs","["Marani, Roberto","Perri, Anna Gina"]",2016-08-03T02:28:07
990159,"["oai:arxiv.org:hep-ph\/0405213","oai:cds.cern.ch:736957"]",10.1134/s1063778806040156,"LHC prospects in searches for neutral scalars in pp\to\gamma\gamma+jet:
  SM Higgs boson, radion, sgoldstino","["A. Djouadi","D. Florian de","D. Florian de","D. S. Gorbunov","D. S. Gorbunov","G. F. Giudice","G. F. Giudice","J. R. Ellis","P. Abreu","S. Abdullin","S. Frixione","S. V. Demidov","U. Baur","V. A. Rubakov","V. Duca Del","W. D. Goldberger"]",2012-04-13T14:22:30
47528617,"["oai:acta.bibl.u-szeged.hu:24815"]",,"Geochemical character of amphibolites from Tisza Unit on the basis of incompatible trace elements","["T\u00f3th, Tivadar M."]",2018-02-08T13:33:16
133593494,"["oai:upcommons.upc.edu:2117\/369106"]",10.5821/mt.11040,"Analysis and discussion of maritime accidents in the spanish fishing sector","["Isalgu\u00e9 Buxeda, Antonio","Mart\u00ednez de Os\u00e9s, Francesc Xavier","Torn\u00e9 Revert\u00e9, Alfredo"]",2022-10-07T06:21:23
582613,"["oai:iris.uniroma3.it:11590\/138315","oai:arxiv.org:0802.0086"]",10.1016/j.physletb.2008.05.031,"Solving the octant degeneracy with the Silver channel","["Apollonio","Autiero","Barger","Bueno","Burguet-Castell","Burguet-Castell","Cervera","Cervera","Cervera","Choubey","Davide Meloni","De Rujula","Donini","Donini","Donini","Donini","Fogli","Gandhi","Geer","Geer","Gonzalez-Garcia","Gribov","Hagiwara","Hiraide","Huber","Huber","Huber","Kajita","Lin","Maki","Minakata","Pontecorvo","Pontecorvo","Rubbia","Yao"]",2012-04-13T14:16:13
690913,"["oai:arxiv.org:1003.2804"]",,"An overview of latent Markov models for longitudinal categorical data","["Bartolucci, F.","Farcomeni, A.","Pennoni, F."]",2012-04-13T14:17:50
17144025,"["oai:arxiv.org:1308.4745"]",10.1007/s00205-014-0810-5,"Trace formula for linear Hamiltonian systems with its applications to
  elliptic Lagrangian solutions","["Hu, Xijun","Ou, Yuwei","Wang, Penghui"]",2014-10-24T19:20:36
2608786,[],,"The path of a scholar","["Birolo, Adriano"]",2012-07-06T03:47:04
59832081,"["oai:doaj.org\/article:cb61e74996744e6d931bfc2c8fe793bb"]",10.1155/2012/580454,"Imaging of Scarce Archaeological Remains Using Microwave Tomographic Depictions of Ground Penetrating Radar Data","["Amir M. Alani","Erica Utsi","Francesco Soldovieri","Raffaele Persico"]",2014-12-17T20:52:16
138295721,"["oai:ejournal.unesa.ac.id:article\/50870"]",,"INOVASI PELAYANAN MELALUI APLIKASI “AYO KE LOMBOK” UNTUK MENINGKATKAN MINAT WISATAWAN  (STUDI DI DINAS PARIWISATA LOMBOK BARAT)","["Akbar, Baharudin","Oktariyanda, Trenda Aktiva"]",2023-02-10T06:15:38
